bout,foul_committed_by,context,foul_type_guess,foul_resulted_in_deduction,referee_paused,round_mentioned
Dustin Stoltzfus (185.5) vs. Nursulton Ruziboev (185.5),Nursulton Ruziboev,"Ruziboev counters with a knee to the body, and he smacks Stoltzfus with a hammerfist and inadvertently headbutts him.",headbutt,FALSE,FALSE,Round 2
Dustin Stoltzfus (185.5) vs. Nursulton Ruziboev (185.5),Nursulton Ruziboev,"Ruziboev pulls on the fence to defend it, as Tognoni shouts at him to knock it off.",pulls on the fence,FALSE,FALSE,Round 2
Dustin Stoltzfus (185.5) vs. Nursulton Ruziboev (185.5),Nursulton Ruziboev,"Ruziboev darts in with a jab and a body kick, and Tognoni warns that the kick went south of the border.","kick, and Tognoni warns that the kick went south of the border",FALSE,FALSE,Round 3
Julian Erosa (145) vs. Melquizael Costa (145),Melquizael Costa,"Erosa jumps at his foe to attack, and Costa times a spinning back kick that pounds into the cup.",kick that pounds into the cup,FALSE,FALSE,Round 1
Julian Erosa (145) vs. Melquizael Costa (145),Melquizael Costa,"Costa is warned for having his toes in the cage, and Erosa drops down a few punches and leans back to watch an upkick buzz past him at the bell.",toes in the cage,FALSE,FALSE,Round 1
Julian Erosa (145) vs. Melquizael Costa (145),Julian Erosa,"Erosa pokes Costa in the eye, and Costa tells them he is fine and keeps going.",eye poke,FALSE,FALSE,Round 2
Sodiq Yusuff (155.5) vs. Mairon Santos (155.5),Sodiq Yusuff,"Yusuff winds up with an inside low kick that grazes the cup, and Santos frowns but does not ask for a timeout.",kick that grazes the cup,FALSE,FALSE,Round 1
Sodiq Yusuff (155.5) vs. Mairon Santos (155.5),Sodiq Yusuff,"Santos gets in a knee or two, and he is smacked in the back of the head a few times.",back of the head,FALSE,FALSE,Round 2
Sodiq Yusuff (155.5) vs. Mairon Santos (155.5),Mairon Santos,"Santos times a spin to deliver a punch that inadvertently lands in the back of the head, and they both plant their feet and bust one another in the chops with fierce right hands.",back of the head,FALSE,FALSE,Round 2
