bout,foul_committed_by,context,foul_type_guess,foul_resulted_in_deduction,referee_paused,round_mentioned
Daniel Marcos (136) vs. Adrian Yanez (136),Daniel Marcos,Marcos lands a simultaneous low blow and an eye poke all at once.,eye poke,FALSE,TRUE,Round 1
Davey Grant (136) vs. Ramon Taveras (136),Davey Grant,"A low blow lands for Grant, so Taveras will take time to recover.",low blow,FALSE,TRUE,Round 1
Jamey-Lyn Horth (126) vs. Miranda Maverick (126),Jamey-Lyn Horth,Sherdog Scores Tyler Treese scores the round: 10-9 Maverick Tristen Critchfield scores the round: 10-9 Maverick Brian Knapp scores the round: 10-9 Maverick Round 2 Maverick complained of shots to the back of the head between rounds.,back of the head,FALSE,FALSE,Round 2
Manel Kape (125) vs. Bruno Silva (126),Bruno Silva,A low blow hits Kape.,low blow,FALSE,TRUE,Round 1
Manel Kape (125) vs. Bruno Silva (126),Bruno Silva,Kape gets kicked in the groin again.,kicked in the groin,FALSE,FALSE,Round 1
Manel Kape (125) vs. Bruno Silva (126),Bruno Silva,Yet another low blow as Kape goes down.,low blow,TRUE,TRUE,Round 2
