"bout","sentence","sid","is_upkick_mention","is_hypothetical","is_groin_candidate","has_foul_raw","is_reaction_only","time_str","round_str_raw","ref_mentioned","ready_mentioned","fight_started","has_foul","pause_token","non_foul_pz","explicit_no_pause","is_neg","is_deduction_raw","is_result","round_mentioned","pos_strong_anchor","pos_eye_clean","pos_pause","pos_deduction","pos_foul_re_hit","neg_block_backhead","neg_block_eye","neg_block_upkick_hypo","neg_block_eye_warning","neg_block_toes_fence","neg_block_legal_belt","neg_gate_reaction","neg_gate_not_started","pos_foul_language","neg_injury_stoppage","pos_ref_words","pos_pause_foul","pos_ref_foul","pos_uncalled_foul","neg_hypo_upkick","neg_nonfoul_eye","neg_eye_warning","neg_nonfoul_back","neg_toes_negated","neg_legal_belt","neg_no_pause","neg_negation","neg_injury_eye","neg_reaction_only","rule_score_raw","rule_score","rule_conf_sigmoid","rule_conf","rule_reasons_pos","rule_reasons_neg"
"Macy Chiasson (137.5: Missed Weight) vs. Yana Santos (135)","Chiasson lands a kick as she gets countered up top, and she pushes past the impact to keep Santos on her heels.",25,FALSE,FALSE,FALSE,FALSE,FALSE,NA,NA,FALSE,FALSE,TRUE,FALSE,FALSE,FALSE,FALSE,FALSE,FALSE,FALSE,"Round 2",FALSE,FALSE,FALSE,FALSE,FALSE,FALSE,FALSE,FALSE,FALSE,FALSE,FALSE,FALSE,FALSE,FALSE,FALSE,FALSE,FALSE,FALSE,FALSE,FALSE,FALSE,FALSE,FALSE,FALSE,FALSE,FALSE,FALSE,FALSE,FALSE,0,0,0.00669285092428486,0.00669285092428486,"",""
"Macy Chiasson (137.5: Missed Weight) vs. Yana Santos (135)","Chiasson takes her foot off the gas, resulting in the two staring one another down for at least 30 seconds.",26,FALSE,FALSE,FALSE,FALSE,FALSE,NA,NA,FALSE,FALSE,TRUE,FALSE,FALSE,FALSE,FALSE,FALSE,FALSE,FALSE,"Round 2",FALSE,FALSE,FALSE,FALSE,FALSE,FALSE,FALSE,FALSE,FALSE,FALSE,FALSE,FALSE,FALSE,FALSE,FALSE,FALSE,FALSE,FALSE,FALSE,FALSE,FALSE,FALSE,FALSE,FALSE,FALSE,FALSE,FALSE,FALSE,FALSE,0,0,0.00669285092428486,0.00669285092428486,"",""
"Macy Chiasson (137.5: Missed Weight) vs. Yana Santos (135)","They suddenly tie up and trade ferocious uppercuts in a short women's bantamweight version of Frye vs.",27,FALSE,FALSE,FALSE,FALSE,FALSE,NA,NA,FALSE,FALSE,TRUE,FALSE,FALSE,FALSE,FALSE,FALSE,FALSE,FALSE,"Round 2",FALSE,FALSE,FALSE,FALSE,FALSE,FALSE,FALSE,FALSE,FALSE,FALSE,FALSE,FALSE,FALSE,FALSE,TRUE,FALSE,FALSE,FALSE,FALSE,FALSE,FALSE,FALSE,FALSE,FALSE,FALSE,FALSE,FALSE,TRUE,FALSE,-80,0,0.00669285092428486,0.00669285092428486,"","injury_eye_context|injury_stoppage"
"Macy Chiasson (137.5: Missed Weight) vs. Yana Santos (135)","Takayama, only for Chiasson to let it go so she can measure a thumping kick to the body.",28,FALSE,FALSE,FALSE,FALSE,FALSE,NA,NA,FALSE,FALSE,TRUE,FALSE,FALSE,FALSE,FALSE,FALSE,FALSE,FALSE,"Round 2",FALSE,FALSE,FALSE,FALSE,FALSE,FALSE,FALSE,FALSE,FALSE,FALSE,FALSE,FALSE,FALSE,FALSE,FALSE,FALSE,FALSE,FALSE,FALSE,FALSE,FALSE,FALSE,FALSE,FALSE,FALSE,FALSE,FALSE,FALSE,FALSE,0,0,0.00669285092428486,0.00669285092428486,"",""
"Macy Chiasson (137.5: Missed Weight) vs. Yana Santos (135)","Santos fires back, and Chiasson answers with a takedown.",29,FALSE,FALSE,FALSE,FALSE,FALSE,NA,NA,FALSE,FALSE,TRUE,FALSE,FALSE,FALSE,FALSE,FALSE,FALSE,FALSE,"Round 2",FALSE,FALSE,FALSE,FALSE,FALSE,FALSE,FALSE,FALSE,FALSE,FALSE,FALSE,FALSE,FALSE,FALSE,FALSE,FALSE,FALSE,FALSE,FALSE,FALSE,FALSE,FALSE,FALSE,FALSE,FALSE,FALSE,FALSE,FALSE,FALSE,0,0,0.00669285092428486,0.00669285092428486,"",""
"Macy Chiasson (137.5: Missed Weight) vs. Yana Santos (135)","Santos moves to her knees with her side against the fencing, and she muscles her way to her feet without being grounded for long.",30,FALSE,FALSE,FALSE,FALSE,FALSE,NA,NA,FALSE,FALSE,TRUE,FALSE,FALSE,FALSE,FALSE,FALSE,FALSE,FALSE,"Round 2",TRUE,FALSE,FALSE,FALSE,FALSE,FALSE,FALSE,FALSE,FALSE,FALSE,FALSE,FALSE,FALSE,FALSE,FALSE,FALSE,FALSE,FALSE,FALSE,FALSE,FALSE,FALSE,FALSE,FALSE,FALSE,FALSE,FALSE,FALSE,FALSE,20,20,0.0474258731775668,0.0474258731775668,"strong_anchor",""
"Macy Chiasson (137.5: Missed Weight) vs. Yana Santos (135)","Chiasson leans over for the takedown, and she plants a knee or two on the stomach before they start spamming uppercuts again up close.",31,FALSE,FALSE,FALSE,FALSE,FALSE,NA,NA,FALSE,FALSE,TRUE,FALSE,FALSE,FALSE,FALSE,FALSE,FALSE,FALSE,"Round 2",FALSE,FALSE,FALSE,FALSE,FALSE,FALSE,FALSE,FALSE,FALSE,FALSE,FALSE,FALSE,FALSE,FALSE,TRUE,FALSE,FALSE,FALSE,FALSE,FALSE,FALSE,FALSE,FALSE,FALSE,FALSE,FALSE,FALSE,TRUE,FALSE,-80,0,0.00669285092428486,0.00669285092428486,"","injury_eye_context|injury_stoppage"
"Macy Chiasson (137.5: Missed Weight) vs. Yana Santos (135)","Chiasson puts more behind her knees, backing Santos up.",32,FALSE,FALSE,FALSE,FALSE,FALSE,NA,NA,FALSE,FALSE,TRUE,FALSE,FALSE,FALSE,FALSE,FALSE,FALSE,FALSE,"Round 2",FALSE,FALSE,FALSE,FALSE,FALSE,FALSE,FALSE,FALSE,FALSE,FALSE,FALSE,FALSE,FALSE,FALSE,FALSE,FALSE,FALSE,FALSE,FALSE,FALSE,FALSE,FALSE,FALSE,FALSE,FALSE,FALSE,FALSE,FALSE,FALSE,0,0,0.00669285092428486,0.00669285092428486,"",""
"Macy Chiasson (137.5: Missed Weight) vs. Yana Santos (135)","Santos responds with a smashing front kick on the jaw, and the Fortis MMA fighter takes it flush as the bell rings.",33,FALSE,FALSE,FALSE,FALSE,FALSE,NA,NA,FALSE,FALSE,TRUE,FALSE,FALSE,FALSE,FALSE,FALSE,FALSE,FALSE,"Round 2",FALSE,FALSE,FALSE,FALSE,FALSE,FALSE,FALSE,FALSE,FALSE,FALSE,FALSE,FALSE,FALSE,FALSE,FALSE,FALSE,FALSE,FALSE,FALSE,FALSE,FALSE,FALSE,FALSE,FALSE,FALSE,FALSE,FALSE,FALSE,FALSE,0,0,0.00669285092428486,0.00669285092428486,"",""
"Macy Chiasson (137.5: Missed Weight) vs. Yana Santos (135)","Sherdog Scores Jay Pettry scores the round: 10-9 Santos Dayne Fox scores the round: 10-9 Santos Scottie Smith scores the round: 10-9 Santos Round 3 Chiasson is fired up from her corner between rounds, and she channels that energy forward into attacks against her opponent.",34,FALSE,FALSE,FALSE,FALSE,FALSE,NA,"Round 3",FALSE,FALSE,TRUE,FALSE,FALSE,FALSE,FALSE,FALSE,FALSE,FALSE,"Round 3",FALSE,FALSE,FALSE,FALSE,FALSE,FALSE,FALSE,FALSE,FALSE,FALSE,FALSE,FALSE,FALSE,FALSE,FALSE,FALSE,FALSE,FALSE,FALSE,FALSE,FALSE,FALSE,FALSE,FALSE,FALSE,FALSE,FALSE,FALSE,FALSE,0,0,0.00669285092428486,0.00669285092428486,"",""
"Macy Chiasson (137.5: Missed Weight) vs. Yana Santos (135)","Santos defends the early offense, and she stops Chiasson from coming at her by tying her up.",35,FALSE,FALSE,FALSE,FALSE,FALSE,NA,NA,FALSE,FALSE,TRUE,FALSE,FALSE,FALSE,FALSE,FALSE,FALSE,FALSE,"Round 3",FALSE,FALSE,FALSE,FALSE,FALSE,FALSE,FALSE,FALSE,FALSE,FALSE,FALSE,FALSE,FALSE,FALSE,FALSE,FALSE,FALSE,FALSE,FALSE,FALSE,FALSE,FALSE,FALSE,FALSE,FALSE,FALSE,FALSE,FALSE,FALSE,0,0,0.00669285092428486,0.00669285092428486,"",""
"Macy Chiasson (137.5: Missed Weight) vs. Yana Santos (135)","Santos scores a few short shots before splitting up, and she backs away to let Chiasson come at her.",36,FALSE,FALSE,FALSE,FALSE,FALSE,NA,NA,FALSE,FALSE,TRUE,FALSE,FALSE,FALSE,FALSE,FALSE,FALSE,FALSE,"Round 3",FALSE,FALSE,FALSE,FALSE,FALSE,FALSE,FALSE,FALSE,FALSE,FALSE,FALSE,FALSE,FALSE,FALSE,FALSE,FALSE,FALSE,FALSE,FALSE,FALSE,FALSE,FALSE,FALSE,FALSE,FALSE,FALSE,FALSE,FALSE,FALSE,0,0,0.00669285092428486,0.00669285092428486,"",""
"Macy Chiasson (137.5: Missed Weight) vs. Yana Santos (135)","They trade body kicks, and Chiasson pressures without letting go with much.",37,FALSE,FALSE,FALSE,FALSE,FALSE,NA,NA,FALSE,FALSE,TRUE,FALSE,FALSE,FALSE,FALSE,FALSE,FALSE,FALSE,"Round 3",FALSE,FALSE,FALSE,FALSE,FALSE,FALSE,FALSE,FALSE,FALSE,FALSE,FALSE,FALSE,FALSE,FALSE,FALSE,FALSE,FALSE,FALSE,FALSE,FALSE,FALSE,FALSE,FALSE,FALSE,FALSE,FALSE,FALSE,FALSE,FALSE,0,0,0.00669285092428486,0.00669285092428486,"",""
"Macy Chiasson (137.5: Missed Weight) vs. Yana Santos (135)","She scores a right hand, and the repeated impact of her hooks has engorged Santos' left eye to a degree.",38,FALSE,FALSE,FALSE,FALSE,FALSE,NA,NA,FALSE,FALSE,TRUE,FALSE,FALSE,FALSE,FALSE,FALSE,FALSE,FALSE,"Round 3",TRUE,FALSE,FALSE,FALSE,FALSE,FALSE,FALSE,FALSE,FALSE,FALSE,FALSE,FALSE,FALSE,FALSE,FALSE,FALSE,FALSE,FALSE,FALSE,FALSE,FALSE,FALSE,FALSE,FALSE,FALSE,FALSE,FALSE,FALSE,FALSE,20,20,0.0474258731775668,0.0474258731775668,"strong_anchor",""
"Macy Chiasson (137.5: Missed Weight) vs. Yana Santos (135)","Santos keeps her distance and tosses out a body kick, and she plays the matador to Chiasson's bull that is only marching at her in straight lines.",39,FALSE,FALSE,FALSE,FALSE,FALSE,NA,NA,FALSE,FALSE,TRUE,FALSE,FALSE,FALSE,FALSE,FALSE,FALSE,FALSE,"Round 3",FALSE,FALSE,FALSE,FALSE,FALSE,FALSE,FALSE,FALSE,FALSE,FALSE,FALSE,FALSE,FALSE,FALSE,FALSE,FALSE,FALSE,FALSE,FALSE,FALSE,FALSE,FALSE,FALSE,FALSE,FALSE,FALSE,FALSE,FALSE,FALSE,0,0,0.00669285092428486,0.00669285092428486,"",""
"Macy Chiasson (137.5: Missed Weight) vs. Yana Santos (135)","Chiasson moves all the way forward to engage in a clinch, where she scores a single, sharp elbow from up close.",40,FALSE,FALSE,FALSE,FALSE,FALSE,NA,NA,FALSE,FALSE,TRUE,FALSE,FALSE,FALSE,FALSE,FALSE,FALSE,FALSE,"Round 3",FALSE,FALSE,FALSE,FALSE,FALSE,FALSE,FALSE,FALSE,FALSE,FALSE,FALSE,FALSE,FALSE,FALSE,FALSE,FALSE,FALSE,FALSE,FALSE,FALSE,FALSE,FALSE,FALSE,FALSE,FALSE,FALSE,FALSE,FALSE,FALSE,0,0,0.00669285092428486,0.00669285092428486,"",""
"Macy Chiasson (137.5: Missed Weight) vs. Yana Santos (135)","The Louisiana native considers a takedown, only to bail on it and come back up top with an elbow.",41,FALSE,FALSE,FALSE,FALSE,FALSE,NA,NA,FALSE,FALSE,TRUE,FALSE,FALSE,FALSE,FALSE,FALSE,FALSE,FALSE,"Round 3",FALSE,FALSE,FALSE,FALSE,FALSE,FALSE,FALSE,FALSE,FALSE,FALSE,FALSE,FALSE,FALSE,FALSE,FALSE,FALSE,FALSE,FALSE,FALSE,FALSE,FALSE,FALSE,FALSE,FALSE,FALSE,FALSE,FALSE,FALSE,FALSE,0,0,0.00669285092428486,0.00669285092428486,"",""
"Macy Chiasson (137.5: Missed Weight) vs. Yana Santos (135)","Short knees to the body from Chiasson lead to a trip takedown attempt, and a second effort from Chiasson drags Santos to her knees.",42,FALSE,FALSE,FALSE,FALSE,FALSE,NA,NA,FALSE,FALSE,TRUE,FALSE,FALSE,FALSE,FALSE,FALSE,FALSE,FALSE,"Round 3",FALSE,FALSE,FALSE,FALSE,FALSE,FALSE,FALSE,FALSE,FALSE,FALSE,FALSE,FALSE,FALSE,FALSE,FALSE,FALSE,FALSE,FALSE,FALSE,FALSE,FALSE,FALSE,FALSE,FALSE,FALSE,FALSE,FALSE,FALSE,FALSE,0,0,0.00669285092428486,0.00669285092428486,"",""
"Macy Chiasson (137.5: Missed Weight) vs. Yana Santos (135)","They land in 50-50 position when hitting the mat, and Chiasson deftly turns to establish herself somehow on top.",43,FALSE,FALSE,FALSE,FALSE,FALSE,NA,NA,FALSE,FALSE,TRUE,FALSE,FALSE,FALSE,FALSE,FALSE,FALSE,FALSE,"Round 3",FALSE,FALSE,FALSE,FALSE,FALSE,FALSE,FALSE,FALSE,FALSE,FALSE,FALSE,FALSE,FALSE,FALSE,FALSE,FALSE,FALSE,FALSE,FALSE,FALSE,FALSE,FALSE,FALSE,FALSE,FALSE,FALSE,FALSE,FALSE,FALSE,0,0,0.00669285092428486,0.00669285092428486,"",""
"Macy Chiasson (137.5: Missed Weight) vs. Yana Santos (135)","Santos clings to Chiasson's left arm, which is draped around the neck but not in the position of a choke.",44,FALSE,FALSE,FALSE,FALSE,FALSE,NA,NA,FALSE,FALSE,TRUE,FALSE,FALSE,FALSE,FALSE,FALSE,FALSE,FALSE,"Round 3",FALSE,FALSE,FALSE,FALSE,FALSE,FALSE,FALSE,FALSE,FALSE,FALSE,FALSE,FALSE,FALSE,FALSE,FALSE,FALSE,FALSE,FALSE,FALSE,FALSE,FALSE,FALSE,FALSE,FALSE,FALSE,FALSE,FALSE,FALSE,FALSE,0,0,0.00669285092428486,0.00669285092428486,"",""
"Macy Chiasson (137.5: Missed Weight) vs. Yana Santos (135)","Chiasson frees her limb and takes the back, allowing Santos to turn to her back so she can beat down on her with punches and elbows.",45,FALSE,FALSE,FALSE,FALSE,FALSE,NA,NA,FALSE,FALSE,TRUE,FALSE,FALSE,FALSE,FALSE,FALSE,FALSE,FALSE,"Round 3",FALSE,FALSE,FALSE,FALSE,FALSE,FALSE,FALSE,FALSE,FALSE,FALSE,FALSE,FALSE,FALSE,FALSE,FALSE,FALSE,FALSE,FALSE,FALSE,FALSE,FALSE,FALSE,FALSE,FALSE,FALSE,FALSE,FALSE,FALSE,FALSE,0,0,0.00669285092428486,0.00669285092428486,"",""
"Macy Chiasson (137.5: Missed Weight) vs. Yana Santos (135)","Tognoni warns the American for striking the back of the head, so she stops hitting and isolates a rear-naked choke.",46,FALSE,FALSE,FALSE,TRUE,FALSE,NA,NA,FALSE,FALSE,TRUE,TRUE,FALSE,FALSE,FALSE,FALSE,FALSE,FALSE,"Round 3",TRUE,FALSE,FALSE,FALSE,TRUE,FALSE,FALSE,FALSE,FALSE,FALSE,FALSE,FALSE,FALSE,TRUE,FALSE,TRUE,FALSE,TRUE,FALSE,FALSE,FALSE,FALSE,FALSE,FALSE,FALSE,FALSE,FALSE,FALSE,FALSE,120,100,0.993307149075715,0.993307149075715,"strong_anchor|foul_language|foul_re_hit|ref_plus_foul_language",""
"Macy Chiasson (137.5: Missed Weight) vs. Yana Santos (135)","The grip is not beneath the chin and is instead on the jaw, cranking Santos' neck to the side rather than choking her.",47,FALSE,FALSE,FALSE,FALSE,FALSE,NA,NA,FALSE,FALSE,TRUE,FALSE,FALSE,FALSE,FALSE,FALSE,FALSE,FALSE,"Round 3",FALSE,FALSE,FALSE,FALSE,FALSE,FALSE,FALSE,FALSE,FALSE,FALSE,FALSE,FALSE,FALSE,FALSE,FALSE,FALSE,FALSE,FALSE,FALSE,FALSE,FALSE,FALSE,FALSE,FALSE,FALSE,FALSE,FALSE,FALSE,FALSE,0,0,0.00669285092428486,0.00669285092428486,"",""
"Macy Chiasson (137.5: Missed Weight) vs. Yana Santos (135)","Chiasson gives it up with a second or two to spare, and she rains down elbows until the match ends.",48,FALSE,FALSE,FALSE,FALSE,FALSE,NA,NA,FALSE,FALSE,TRUE,FALSE,FALSE,FALSE,FALSE,FALSE,FALSE,FALSE,"Round 3",FALSE,FALSE,FALSE,FALSE,FALSE,FALSE,FALSE,FALSE,FALSE,FALSE,FALSE,FALSE,FALSE,FALSE,FALSE,FALSE,FALSE,FALSE,FALSE,FALSE,FALSE,FALSE,FALSE,FALSE,FALSE,FALSE,FALSE,FALSE,FALSE,0,0,0.00669285092428486,0.00669285092428486,"",""
"Macy Chiasson (137.5: Missed Weight) vs. Yana Santos (135)","Chiasson strides off declaring that she won the fight, and it's all up to the judges now.",49,FALSE,FALSE,FALSE,FALSE,FALSE,NA,NA,FALSE,FALSE,TRUE,FALSE,FALSE,FALSE,FALSE,FALSE,FALSE,FALSE,"Round 3",FALSE,FALSE,FALSE,FALSE,FALSE,FALSE,FALSE,FALSE,FALSE,FALSE,FALSE,FALSE,FALSE,FALSE,FALSE,FALSE,FALSE,FALSE,FALSE,FALSE,FALSE,FALSE,FALSE,FALSE,FALSE,FALSE,FALSE,FALSE,FALSE,0,0,0.00669285092428486,0.00669285092428486,"",""
"Macy Chiasson (137.5: Missed Weight) vs. Yana Santos (135)","Sherdog Scores Jay Pettry scores the round: 10-9 Chiasson (29-28 Santos) Dayne Fox scores the round: 10-9 Chiasson (29-28 Santos) Scottie Smith scores the round: 10-9 Chiasson (29-28 Santos) The Official Result Yana Santos def.",50,FALSE,FALSE,FALSE,FALSE,FALSE,NA,NA,FALSE,FALSE,TRUE,FALSE,FALSE,FALSE,FALSE,FALSE,FALSE,FALSE,"Round 3",FALSE,FALSE,FALSE,FALSE,FALSE,FALSE,FALSE,FALSE,FALSE,FALSE,FALSE,FALSE,FALSE,FALSE,FALSE,FALSE,FALSE,FALSE,FALSE,FALSE,FALSE,FALSE,FALSE,FALSE,FALSE,FALSE,FALSE,FALSE,FALSE,0,0,0.00669285092428486,0.00669285092428486,"",""
"Macy Chiasson (137.5: Missed Weight) vs. Yana Santos (135)","Macy Chiasson via Unanimous Decision (29-28, 29-28, 29-28)",51,FALSE,FALSE,FALSE,FALSE,FALSE,NA,NA,FALSE,FALSE,TRUE,FALSE,FALSE,FALSE,FALSE,FALSE,FALSE,FALSE,"Round 3",FALSE,FALSE,FALSE,FALSE,FALSE,FALSE,FALSE,FALSE,FALSE,FALSE,FALSE,FALSE,FALSE,FALSE,FALSE,FALSE,FALSE,FALSE,FALSE,FALSE,FALSE,FALSE,FALSE,FALSE,FALSE,FALSE,FALSE,FALSE,FALSE,0,0,0.00669285092428486,0.00669285092428486,"",""
"Punahele Soriano (170.5) vs. Nikolay Veretennikov (170.5)","Punahele Soriano (170.5) vs.",1,FALSE,FALSE,FALSE,FALSE,FALSE,NA,NA,FALSE,FALSE,FALSE,FALSE,FALSE,FALSE,FALSE,FALSE,FALSE,FALSE,NA,FALSE,FALSE,FALSE,FALSE,FALSE,FALSE,FALSE,FALSE,FALSE,FALSE,FALSE,FALSE,TRUE,FALSE,FALSE,FALSE,FALSE,FALSE,FALSE,FALSE,FALSE,FALSE,FALSE,FALSE,FALSE,FALSE,FALSE,FALSE,FALSE,-40,0,0.00669285092428486,0.00669285092428486,"","gate_not_started"
"Punahele Soriano (170.5) vs. Nikolay Veretennikov (170.5)","Nikolay Veretennikov (170.5) BETTING PREVIEW | SCOUTING REPORT | ODDS: Soriano (-245), Veretennikov (+200) Round 1 Two knockout-inclined welterweights will ply their trades against one another with continued preliminary action.",2,FALSE,FALSE,FALSE,FALSE,FALSE,NA,"Round 1",FALSE,FALSE,FALSE,FALSE,FALSE,FALSE,FALSE,FALSE,FALSE,FALSE,"Round 1",FALSE,FALSE,FALSE,FALSE,FALSE,FALSE,FALSE,FALSE,FALSE,FALSE,FALSE,FALSE,TRUE,FALSE,FALSE,FALSE,FALSE,FALSE,FALSE,FALSE,FALSE,FALSE,FALSE,FALSE,FALSE,FALSE,FALSE,FALSE,FALSE,-40,0,0.00669285092428486,0.00669285092428486,"","gate_not_started"
"Punahele Soriano (170.5) vs. Nikolay Veretennikov (170.5)","A win for Soriano (11-4, 5-4 UFC) would keep him above the dreaded .500 line in the promotion, while Kazakhstan's Veretennikov (13-6, 1-2 UFC) needs to get past ""Story Time"" to reach that level.",3,FALSE,FALSE,FALSE,FALSE,FALSE,NA,NA,FALSE,FALSE,FALSE,FALSE,FALSE,FALSE,FALSE,FALSE,FALSE,FALSE,"Round 1",FALSE,FALSE,FALSE,FALSE,FALSE,FALSE,FALSE,FALSE,FALSE,FALSE,FALSE,FALSE,TRUE,FALSE,FALSE,FALSE,FALSE,FALSE,FALSE,FALSE,FALSE,FALSE,FALSE,FALSE,FALSE,FALSE,FALSE,FALSE,FALSE,-40,0,0.00669285092428486,0.00669285092428486,"","gate_not_started"
"Punahele Soriano (170.5) vs. Nikolay Veretennikov (170.5)","If a brawl ensues, referee Marc Goddard will keep a lid on it as best he can.",4,FALSE,FALSE,FALSE,FALSE,FALSE,NA,NA,TRUE,FALSE,TRUE,FALSE,FALSE,FALSE,FALSE,FALSE,FALSE,FALSE,"Round 1",FALSE,FALSE,FALSE,FALSE,FALSE,FALSE,FALSE,FALSE,FALSE,FALSE,FALSE,FALSE,FALSE,FALSE,FALSE,FALSE,FALSE,FALSE,FALSE,FALSE,FALSE,FALSE,FALSE,FALSE,FALSE,FALSE,FALSE,FALSE,FALSE,0,0,0.00669285092428486,0.00669285092428486,"",""
"Punahele Soriano (170.5) vs. Nikolay Veretennikov (170.5)","Before that prospective slugfest, they tap gloves.",5,FALSE,FALSE,FALSE,FALSE,FALSE,NA,NA,FALSE,FALSE,TRUE,FALSE,FALSE,FALSE,FALSE,FALSE,FALSE,FALSE,"Round 1",FALSE,FALSE,FALSE,FALSE,FALSE,FALSE,FALSE,FALSE,FALSE,FALSE,FALSE,FALSE,FALSE,FALSE,FALSE,FALSE,FALSE,FALSE,FALSE,FALSE,FALSE,FALSE,FALSE,FALSE,FALSE,FALSE,FALSE,FALSE,FALSE,0,0,0.00669285092428486,0.00669285092428486,"",""
"Punahele Soriano (170.5) vs. Nikolay Veretennikov (170.5)","Soriano takes right to the center of the cage, hopping back to avoid a stomp kick to the knee and springing ahead to fire off a body kick.",6,FALSE,FALSE,FALSE,FALSE,FALSE,NA,NA,FALSE,FALSE,TRUE,FALSE,FALSE,FALSE,FALSE,FALSE,FALSE,FALSE,"Round 1",TRUE,FALSE,FALSE,FALSE,FALSE,FALSE,FALSE,FALSE,FALSE,FALSE,FALSE,FALSE,FALSE,FALSE,FALSE,FALSE,FALSE,FALSE,FALSE,FALSE,FALSE,FALSE,FALSE,FALSE,FALSE,FALSE,FALSE,FALSE,FALSE,20,20,0.0474258731775668,0.0474258731775668,"strong_anchor",""
"Punahele Soriano (170.5) vs. Nikolay Veretennikov (170.5)","He aims a second to the same spot, and when Veretennikov counters, Soriano charges with a double and takes Veretennikov off his feet.",7,FALSE,FALSE,FALSE,FALSE,FALSE,NA,NA,FALSE,FALSE,TRUE,FALSE,FALSE,FALSE,FALSE,FALSE,FALSE,FALSE,"Round 1",FALSE,FALSE,FALSE,FALSE,FALSE,FALSE,FALSE,FALSE,FALSE,FALSE,FALSE,FALSE,FALSE,FALSE,FALSE,FALSE,FALSE,FALSE,FALSE,FALSE,FALSE,FALSE,FALSE,FALSE,FALSE,FALSE,FALSE,FALSE,FALSE,0,0,0.00669285092428486,0.00669285092428486,"",""
"Punahele Soriano (170.5) vs. Nikolay Veretennikov (170.5)","Veretennikov bounces off and up in the air, and with Soriano on his knees, he measures and blasts the Hawaiian with a mighty knee to the ribs.",8,FALSE,FALSE,FALSE,FALSE,FALSE,NA,NA,FALSE,FALSE,TRUE,FALSE,FALSE,FALSE,FALSE,FALSE,FALSE,FALSE,"Round 1",FALSE,FALSE,FALSE,FALSE,FALSE,FALSE,FALSE,FALSE,FALSE,FALSE,FALSE,FALSE,FALSE,FALSE,FALSE,FALSE,FALSE,FALSE,FALSE,FALSE,FALSE,FALSE,FALSE,FALSE,FALSE,FALSE,FALSE,FALSE,FALSE,0,0,0.00669285092428486,0.00669285092428486,"",""
"Punahele Soriano (170.5) vs. Nikolay Veretennikov (170.5)","Veretennikov settles down and wraps up a guillotine choke with his left arm, and when Soriano lifts him up and slams him down, the choke briefly tightens.",9,FALSE,FALSE,FALSE,FALSE,FALSE,NA,NA,FALSE,FALSE,TRUE,FALSE,FALSE,FALSE,FALSE,FALSE,FALSE,FALSE,"Round 1",FALSE,FALSE,FALSE,FALSE,FALSE,FALSE,FALSE,FALSE,FALSE,FALSE,FALSE,FALSE,FALSE,FALSE,FALSE,FALSE,FALSE,FALSE,FALSE,FALSE,FALSE,FALSE,FALSE,FALSE,FALSE,FALSE,FALSE,FALSE,FALSE,0,0,0.00669285092428486,0.00669285092428486,"",""
"Punahele Soriano (170.5) vs. Nikolay Veretennikov (170.5)","Soriano sits up and breaks out of the choke, and he starts raining down left hands.",10,FALSE,FALSE,FALSE,FALSE,FALSE,NA,NA,FALSE,FALSE,TRUE,FALSE,FALSE,FALSE,FALSE,FALSE,FALSE,FALSE,"Round 1",FALSE,FALSE,FALSE,FALSE,FALSE,FALSE,FALSE,FALSE,FALSE,FALSE,FALSE,FALSE,FALSE,FALSE,FALSE,FALSE,FALSE,FALSE,FALSE,FALSE,FALSE,FALSE,FALSE,FALSE,FALSE,FALSE,FALSE,FALSE,FALSE,0,0,0.00669285092428486,0.00669285092428486,"",""
"Punahele Soriano (170.5) vs. Nikolay Veretennikov (170.5)","Veretennikov attacks back with his own offense from below, but the power differential is drastic from that position.",11,FALSE,FALSE,FALSE,FALSE,FALSE,NA,NA,FALSE,FALSE,TRUE,FALSE,FALSE,FALSE,FALSE,FALSE,FALSE,FALSE,"Round 1",FALSE,FALSE,FALSE,FALSE,FALSE,FALSE,FALSE,FALSE,FALSE,FALSE,FALSE,FALSE,FALSE,FALSE,FALSE,FALSE,FALSE,FALSE,FALSE,FALSE,FALSE,FALSE,FALSE,FALSE,FALSE,FALSE,FALSE,FALSE,FALSE,0,0,0.00669285092428486,0.00669285092428486,"",""
"Punahele Soriano (170.5) vs. Nikolay Veretennikov (170.5)","Soriano keeps pounding on his opponent, briefly trapping his foe's right arm beneath his knee to open up more shots.",12,FALSE,FALSE,FALSE,FALSE,FALSE,NA,NA,FALSE,FALSE,TRUE,FALSE,FALSE,FALSE,FALSE,FALSE,FALSE,FALSE,"Round 1",FALSE,FALSE,FALSE,FALSE,FALSE,FALSE,FALSE,FALSE,FALSE,FALSE,FALSE,FALSE,FALSE,FALSE,FALSE,FALSE,FALSE,FALSE,FALSE,FALSE,FALSE,FALSE,FALSE,FALSE,FALSE,FALSE,FALSE,FALSE,FALSE,0,0,0.00669285092428486,0.00669285092428486,"",""
"Punahele Soriano (170.5) vs. Nikolay Veretennikov (170.5)","Soriano switches to hammering Veretennikov with elbow after unanswered elbow, and his position tying Veretennikov up while not keeping him flat is pinning Veretennikov to the floor.",13,FALSE,FALSE,FALSE,FALSE,FALSE,NA,NA,FALSE,FALSE,TRUE,FALSE,FALSE,FALSE,FALSE,FALSE,FALSE,FALSE,"Round 1",FALSE,FALSE,FALSE,FALSE,FALSE,FALSE,FALSE,FALSE,FALSE,FALSE,FALSE,FALSE,FALSE,FALSE,FALSE,FALSE,FALSE,FALSE,FALSE,FALSE,FALSE,FALSE,FALSE,FALSE,FALSE,FALSE,FALSE,FALSE,FALSE,0,0,0.00669285092428486,0.00669285092428486,"",""
"Punahele Soriano (170.5) vs. Nikolay Veretennikov (170.5)","Soriano's left hands continue to bludgeon the Kazakhstan native, and even though Goddard is not anywhere close to considering stepping in, these consistent blows are draining him.",14,FALSE,FALSE,FALSE,FALSE,FALSE,NA,NA,FALSE,FALSE,TRUE,FALSE,FALSE,FALSE,FALSE,FALSE,FALSE,FALSE,"Round 1",FALSE,FALSE,FALSE,FALSE,FALSE,FALSE,FALSE,FALSE,FALSE,FALSE,FALSE,FALSE,FALSE,FALSE,FALSE,FALSE,FALSE,FALSE,FALSE,FALSE,FALSE,FALSE,FALSE,FALSE,FALSE,FALSE,FALSE,FALSE,FALSE,0,0,0.00669285092428486,0.00669285092428486,"",""
"Punahele Soriano (170.5) vs. Nikolay Veretennikov (170.5)","Soriano holds Veretennikov down with his left arm and beats on his ribs with his right, and the ground-and-pound may not be devastating but it is effective as can be.",15,FALSE,FALSE,FALSE,FALSE,FALSE,NA,NA,FALSE,FALSE,TRUE,FALSE,FALSE,FALSE,FALSE,FALSE,FALSE,FALSE,"Round 1",FALSE,FALSE,FALSE,FALSE,FALSE,FALSE,FALSE,FALSE,FALSE,FALSE,FALSE,FALSE,FALSE,FALSE,FALSE,FALSE,FALSE,FALSE,FALSE,FALSE,FALSE,FALSE,FALSE,FALSE,FALSE,FALSE,FALSE,FALSE,FALSE,0,0,0.00669285092428486,0.00669285092428486,"",""
"Punahele Soriano (170.5) vs. Nikolay Veretennikov (170.5)","He continues to drive punches down, developing a pattern similar to iambic pentameter in that he lands a soft blow and then a powerful one, and alternates them like ba-dum ba-dum as the sound of the impact echoes around the ring.",16,FALSE,FALSE,FALSE,FALSE,FALSE,NA,NA,FALSE,FALSE,TRUE,FALSE,FALSE,FALSE,FALSE,FALSE,FALSE,FALSE,"Round 1",FALSE,FALSE,FALSE,FALSE,FALSE,FALSE,FALSE,FALSE,FALSE,FALSE,FALSE,FALSE,FALSE,FALSE,FALSE,FALSE,FALSE,FALSE,FALSE,FALSE,FALSE,FALSE,FALSE,FALSE,FALSE,FALSE,FALSE,FALSE,FALSE,0,0,0.00669285092428486,0.00669285092428486,"",""
"Punahele Soriano (170.5) vs. Nikolay Veretennikov (170.5)","The one-sided round ends.",17,FALSE,FALSE,FALSE,FALSE,FALSE,NA,NA,FALSE,FALSE,TRUE,FALSE,FALSE,FALSE,FALSE,FALSE,FALSE,FALSE,"Round 1",FALSE,FALSE,FALSE,FALSE,FALSE,FALSE,FALSE,FALSE,FALSE,FALSE,FALSE,FALSE,FALSE,FALSE,FALSE,FALSE,FALSE,FALSE,FALSE,FALSE,FALSE,FALSE,FALSE,FALSE,FALSE,FALSE,FALSE,FALSE,FALSE,0,0,0.00669285092428486,0.00669285092428486,"",""
"Punahele Soriano (170.5) vs. Nikolay Veretennikov (170.5)","Sherdog Scores Jay Pettry scores the round: 10-8 Soriano Dayne Fox scores the round: 10-9 Soriano Scottie Smith scores the round: 10-9 Soriano Round 2 It takes Soriano 15 seconds to commit to a takedown, and he lifts Veretennikov up in the air and deposits him gingerly to the mat.",18,FALSE,FALSE,FALSE,FALSE,FALSE,NA,"Round 2",FALSE,FALSE,TRUE,FALSE,FALSE,FALSE,FALSE,FALSE,FALSE,FALSE,"Round 2",FALSE,FALSE,FALSE,FALSE,FALSE,FALSE,FALSE,FALSE,FALSE,FALSE,FALSE,FALSE,FALSE,FALSE,FALSE,FALSE,FALSE,FALSE,FALSE,FALSE,FALSE,FALSE,FALSE,FALSE,FALSE,FALSE,FALSE,FALSE,FALSE,0,0,0.00669285092428486,0.00669285092428486,"",""
"Punahele Soriano (170.5) vs. Nikolay Veretennikov (170.5)","Veretennikov defends instinctively with a guillotine choke, and Soriano uses this opportunity to trap him with a Von Preux shoulder choke.",19,FALSE,FALSE,FALSE,FALSE,FALSE,NA,NA,FALSE,FALSE,TRUE,FALSE,FALSE,FALSE,FALSE,FALSE,FALSE,FALSE,"Round 2",FALSE,FALSE,FALSE,FALSE,FALSE,FALSE,FALSE,FALSE,FALSE,FALSE,FALSE,FALSE,FALSE,FALSE,FALSE,FALSE,FALSE,FALSE,FALSE,FALSE,FALSE,FALSE,FALSE,FALSE,FALSE,FALSE,FALSE,FALSE,FALSE,0,0,0.00669285092428486,0.00669285092428486,"",""
"Punahele Soriano (170.5) vs. Nikolay Veretennikov (170.5)","Veretennikov offers a thumbs-up to show he is fine, and he slowly manages to wriggle his neck out of danger.",20,FALSE,FALSE,FALSE,FALSE,FALSE,NA,NA,FALSE,FALSE,TRUE,FALSE,FALSE,FALSE,FALSE,FALSE,FALSE,FALSE,"Round 2",FALSE,FALSE,FALSE,FALSE,FALSE,FALSE,FALSE,FALSE,FALSE,FALSE,FALSE,FALSE,FALSE,FALSE,FALSE,FALSE,FALSE,FALSE,FALSE,FALSE,FALSE,FALSE,FALSE,FALSE,FALSE,FALSE,FALSE,FALSE,FALSE,0,0,0.00669285092428486,0.00669285092428486,"",""
