"bout","sentence","sid","is_upkick_mention","is_hypothetical","is_groin_candidate","has_foul_raw","is_reaction_only","time_str","round_str_raw","ref_mentioned","ready_mentioned","fight_started","has_foul","pause_token","non_foul_pz","explicit_no_pause","is_neg","is_deduction_raw","is_result","round_mentioned","pos_strong_anchor","pos_eye_clean","pos_pause","pos_deduction","pos_foul_re_hit","neg_block_backhead","neg_block_eye","neg_block_upkick_hypo","neg_block_eye_warning","neg_block_toes_fence","neg_block_legal_belt","neg_gate_reaction","neg_gate_not_started","pos_foul_language","neg_injury_stoppage","pos_ref_words","pos_pause_foul","pos_ref_foul","pos_uncalled_foul","neg_hypo_upkick","neg_nonfoul_eye","neg_eye_warning","neg_nonfoul_back","neg_toes_negated","neg_legal_belt","neg_no_pause","neg_negation","neg_injury_eye","neg_reaction_only","rule_score_raw","rule_score","rule_conf_sigmoid","rule_conf","rule_reasons_pos","rule_reasons_neg"
"Patrick “Patchy” Mix (136) vs. Jakub Wiklacz (136)","Mix bucks and shakes Wiklacz off of him, and he establishes top position but has to fight butterfly hooks shortly thereafter.",46,FALSE,FALSE,FALSE,FALSE,FALSE,NA,NA,FALSE,FALSE,TRUE,FALSE,FALSE,FALSE,FALSE,FALSE,FALSE,FALSE,"Round 3",FALSE,FALSE,FALSE,FALSE,FALSE,FALSE,FALSE,FALSE,FALSE,FALSE,FALSE,FALSE,FALSE,FALSE,FALSE,FALSE,FALSE,FALSE,FALSE,FALSE,FALSE,FALSE,FALSE,FALSE,FALSE,FALSE,FALSE,FALSE,FALSE,0,0,0.00669285092428486,0.00669285092428486,"",""
"Patrick “Patchy” Mix (136) vs. Jakub Wiklacz (136)","The Polish fighter kicks Mix off of him for a moment, and Mix leaps back on top of him and starts landing ground strikes.",47,FALSE,FALSE,FALSE,FALSE,FALSE,NA,NA,FALSE,FALSE,TRUE,FALSE,FALSE,FALSE,FALSE,FALSE,FALSE,FALSE,"Round 3",FALSE,FALSE,FALSE,FALSE,FALSE,FALSE,FALSE,FALSE,FALSE,FALSE,FALSE,FALSE,FALSE,FALSE,FALSE,FALSE,FALSE,FALSE,FALSE,FALSE,FALSE,FALSE,FALSE,FALSE,FALSE,FALSE,FALSE,FALSE,FALSE,0,0,0.00669285092428486,0.00669285092428486,"",""
"Patrick “Patchy” Mix (136) vs. Jakub Wiklacz (136)","Wiklacz frames off with elbows on his back, and he sits up but finds a 135-pound weight on his chest.",48,FALSE,FALSE,FALSE,FALSE,FALSE,NA,NA,FALSE,FALSE,TRUE,FALSE,FALSE,FALSE,FALSE,FALSE,FALSE,FALSE,"Round 3",FALSE,FALSE,FALSE,FALSE,FALSE,FALSE,FALSE,FALSE,FALSE,FALSE,FALSE,FALSE,FALSE,FALSE,FALSE,FALSE,FALSE,FALSE,FALSE,FALSE,FALSE,FALSE,FALSE,FALSE,FALSE,FALSE,FALSE,FALSE,FALSE,0,0,0.00669285092428486,0.00669285092428486,"",""
"Patrick “Patchy” Mix (136) vs. Jakub Wiklacz (136)","Mix drives down a single elbow that draws blood above the left eyebrow, and Wiklacz uses a heel hook try to force himself up.",49,FALSE,FALSE,FALSE,FALSE,FALSE,NA,NA,FALSE,FALSE,TRUE,FALSE,FALSE,FALSE,FALSE,FALSE,FALSE,FALSE,"Round 3",FALSE,FALSE,FALSE,FALSE,FALSE,FALSE,FALSE,FALSE,FALSE,FALSE,FALSE,FALSE,FALSE,FALSE,TRUE,FALSE,FALSE,FALSE,FALSE,FALSE,FALSE,FALSE,FALSE,FALSE,FALSE,FALSE,FALSE,TRUE,FALSE,-80,0,0.00669285092428486,0.00669285092428486,"","injury_eye_context|injury_stoppage"
"Patrick “Patchy” Mix (136) vs. Jakub Wiklacz (136)","As red liquid streams down his face, Wiklacz turns to the side so it does not pool in his eye socket.",50,FALSE,FALSE,FALSE,FALSE,FALSE,NA,NA,FALSE,FALSE,TRUE,FALSE,FALSE,FALSE,FALSE,FALSE,FALSE,FALSE,"Round 3",TRUE,FALSE,FALSE,FALSE,FALSE,FALSE,FALSE,FALSE,FALSE,FALSE,FALSE,FALSE,FALSE,TRUE,FALSE,FALSE,FALSE,FALSE,FALSE,FALSE,FALSE,FALSE,FALSE,FALSE,FALSE,FALSE,FALSE,FALSE,FALSE,30,30,0.119202922022118,0.119202922022118,"strong_anchor|foul_language",""
"Patrick “Patchy” Mix (136) vs. Jakub Wiklacz (136)","Mix maintains heavy control without landing much, and the fans start to turn on him.",51,FALSE,FALSE,FALSE,FALSE,FALSE,NA,NA,FALSE,FALSE,TRUE,FALSE,FALSE,FALSE,FALSE,FALSE,FALSE,FALSE,"Round 3",FALSE,FALSE,FALSE,FALSE,FALSE,FALSE,FALSE,FALSE,FALSE,FALSE,FALSE,FALSE,FALSE,FALSE,FALSE,FALSE,FALSE,FALSE,FALSE,FALSE,FALSE,FALSE,FALSE,FALSE,FALSE,FALSE,FALSE,FALSE,FALSE,0,0,0.00669285092428486,0.00669285092428486,"",""
"Patrick “Patchy” Mix (136) vs. Jakub Wiklacz (136)","Wiklacz hacks with a couple elbows to the top of the dome, and Mix continues to embrace the grind.",52,FALSE,FALSE,FALSE,FALSE,FALSE,NA,NA,FALSE,FALSE,TRUE,FALSE,FALSE,FALSE,FALSE,FALSE,FALSE,FALSE,"Round 3",FALSE,FALSE,FALSE,FALSE,FALSE,FALSE,FALSE,FALSE,FALSE,FALSE,FALSE,FALSE,FALSE,FALSE,FALSE,FALSE,FALSE,FALSE,FALSE,FALSE,FALSE,FALSE,FALSE,FALSE,FALSE,FALSE,FALSE,FALSE,FALSE,0,0,0.00669285092428486,0.00669285092428486,"",""
"Patrick “Patchy” Mix (136) vs. Jakub Wiklacz (136)","Mix lands one or two strikes before Wiklacz bucks, and Wiklacz strikes back with more elbows.",53,FALSE,FALSE,FALSE,FALSE,FALSE,NA,NA,FALSE,FALSE,TRUE,FALSE,FALSE,FALSE,FALSE,FALSE,FALSE,FALSE,"Round 3",FALSE,FALSE,FALSE,FALSE,FALSE,FALSE,FALSE,FALSE,FALSE,FALSE,FALSE,FALSE,FALSE,FALSE,FALSE,FALSE,FALSE,FALSE,FALSE,FALSE,FALSE,FALSE,FALSE,FALSE,FALSE,FALSE,FALSE,FALSE,FALSE,0,0,0.00669285092428486,0.00669285092428486,"",""
"Patrick “Patchy” Mix (136) vs. Jakub Wiklacz (136)","Wiklacz bursts back to his feet with seconds to spare, and Mix is quick to mat return him and take his back.",54,FALSE,FALSE,FALSE,FALSE,FALSE,NA,NA,FALSE,FALSE,TRUE,FALSE,FALSE,FALSE,FALSE,FALSE,FALSE,FALSE,"Round 3",FALSE,FALSE,FALSE,FALSE,FALSE,FALSE,FALSE,FALSE,FALSE,FALSE,FALSE,FALSE,FALSE,FALSE,FALSE,FALSE,FALSE,FALSE,FALSE,FALSE,FALSE,FALSE,FALSE,FALSE,FALSE,FALSE,FALSE,FALSE,FALSE,0,0,0.00669285092428486,0.00669285092428486,"",""
"Patrick “Patchy” Mix (136) vs. Jakub Wiklacz (136)","Mix drives home some right hands to punctuate his performance.",55,FALSE,FALSE,FALSE,FALSE,FALSE,NA,NA,FALSE,FALSE,TRUE,FALSE,FALSE,FALSE,FALSE,FALSE,FALSE,FALSE,"Round 3",FALSE,FALSE,FALSE,FALSE,FALSE,FALSE,FALSE,FALSE,FALSE,FALSE,FALSE,FALSE,FALSE,FALSE,FALSE,FALSE,FALSE,FALSE,FALSE,FALSE,FALSE,FALSE,FALSE,FALSE,FALSE,FALSE,FALSE,FALSE,FALSE,0,0,0.00669285092428486,0.00669285092428486,"",""
"Patrick “Patchy” Mix (136) vs. Jakub Wiklacz (136)","It could go either way, likely depending on how the judges saw the second stanza.",56,FALSE,FALSE,FALSE,FALSE,FALSE,NA,NA,FALSE,FALSE,TRUE,FALSE,FALSE,FALSE,FALSE,FALSE,FALSE,FALSE,"Round 3",FALSE,FALSE,FALSE,FALSE,FALSE,FALSE,FALSE,FALSE,FALSE,FALSE,FALSE,FALSE,FALSE,FALSE,FALSE,FALSE,FALSE,FALSE,FALSE,FALSE,FALSE,FALSE,FALSE,FALSE,FALSE,FALSE,FALSE,FALSE,FALSE,0,0,0.00669285092428486,0.00669285092428486,"",""
"Patrick “Patchy” Mix (136) vs. Jakub Wiklacz (136)","Sherdog Scores Jay Pettry scores the round: 10-9 Mix (29-28 Wiklacz) Dayne Fox scores the round: 10-9 Mix (29-28 Mix) Scottie Smith scores the round: 10-9 Mix (29-28 Mix) The Official Result Jakub Wiklacz def.",57,FALSE,FALSE,FALSE,FALSE,FALSE,NA,NA,FALSE,FALSE,TRUE,FALSE,FALSE,FALSE,FALSE,FALSE,FALSE,FALSE,"Round 3",FALSE,FALSE,FALSE,FALSE,FALSE,FALSE,FALSE,FALSE,FALSE,FALSE,FALSE,FALSE,FALSE,FALSE,FALSE,FALSE,FALSE,FALSE,FALSE,FALSE,FALSE,FALSE,FALSE,FALSE,FALSE,FALSE,FALSE,FALSE,FALSE,0,0,0.00669285092428486,0.00669285092428486,"",""
"Patrick “Patchy” Mix (136) vs. Jakub Wiklacz (136)","Patrick Mix via Split Decision (29-28, 28-29, 29-28)",58,FALSE,FALSE,FALSE,FALSE,FALSE,NA,NA,FALSE,FALSE,TRUE,FALSE,FALSE,FALSE,FALSE,FALSE,FALSE,FALSE,"Round 3",FALSE,FALSE,FALSE,FALSE,FALSE,FALSE,FALSE,FALSE,FALSE,FALSE,FALSE,FALSE,FALSE,FALSE,FALSE,FALSE,FALSE,FALSE,FALSE,FALSE,FALSE,FALSE,FALSE,FALSE,FALSE,FALSE,FALSE,FALSE,FALSE,0,0,0.00669285092428486,0.00669285092428486,"",""
"Daniel Santos (151) vs. Joo Sang Yoo (152.5)","Daniel Santos (151) vs.",1,FALSE,FALSE,FALSE,FALSE,FALSE,NA,NA,FALSE,FALSE,FALSE,FALSE,FALSE,FALSE,FALSE,FALSE,FALSE,FALSE,NA,FALSE,FALSE,FALSE,FALSE,FALSE,FALSE,FALSE,FALSE,FALSE,FALSE,FALSE,FALSE,TRUE,FALSE,FALSE,FALSE,FALSE,FALSE,FALSE,FALSE,FALSE,FALSE,FALSE,FALSE,FALSE,FALSE,FALSE,FALSE,FALSE,-40,0,0.00669285092428486,0.00669285092428486,"","gate_not_started"
"Daniel Santos (151) vs. Joo Sang Yoo (152.5)","Joo Sang Yoo (152.5) BETTING PREVIEW | SCOUTING REPORT | ODDS: Santos (-142), Yoo (+120) Round 1 Whether because one or both were going to miss weight badly, this featherweight contested shifted to a catchweight at 153 pounds.",2,FALSE,FALSE,FALSE,FALSE,FALSE,NA,"Round 1",FALSE,FALSE,FALSE,FALSE,FALSE,FALSE,FALSE,FALSE,FALSE,FALSE,"Round 1",FALSE,FALSE,FALSE,FALSE,FALSE,FALSE,FALSE,FALSE,FALSE,FALSE,FALSE,FALSE,TRUE,FALSE,FALSE,FALSE,FALSE,FALSE,FALSE,FALSE,FALSE,FALSE,FALSE,FALSE,FALSE,FALSE,FALSE,FALSE,FALSE,-40,0,0.00669285092428486,0.00669285092428486,"","gate_not_started"
"Daniel Santos (151) vs. Joo Sang Yoo (152.5)","Santos (13-2, 3-1 UFC), who has come in heavy before, will benefit from this relocated weight category as he comes in likely the larger of the two.",3,FALSE,FALSE,FALSE,FALSE,FALSE,NA,NA,FALSE,FALSE,FALSE,FALSE,FALSE,FALSE,FALSE,FALSE,FALSE,FALSE,"Round 1",FALSE,FALSE,FALSE,FALSE,FALSE,FALSE,FALSE,FALSE,FALSE,FALSE,FALSE,FALSE,TRUE,FALSE,FALSE,FALSE,FALSE,FALSE,FALSE,FALSE,FALSE,FALSE,FALSE,FALSE,FALSE,FALSE,FALSE,FALSE,FALSE,-40,0,0.00669285092428486,0.00669285092428486,"","gate_not_started"
"Daniel Santos (151) vs. Joo Sang Yoo (152.5)","Yoo (9-0, 1-0 UFC) is fine with the switch, because he just wants to put hands on faces.",4,FALSE,FALSE,FALSE,FALSE,FALSE,NA,NA,FALSE,FALSE,FALSE,FALSE,FALSE,FALSE,FALSE,FALSE,FALSE,FALSE,"Round 1",FALSE,FALSE,FALSE,FALSE,FALSE,FALSE,FALSE,FALSE,FALSE,FALSE,FALSE,FALSE,TRUE,FALSE,FALSE,FALSE,FALSE,FALSE,FALSE,FALSE,FALSE,FALSE,FALSE,FALSE,FALSE,FALSE,FALSE,FALSE,FALSE,-40,0,0.00669285092428486,0.00669285092428486,"","gate_not_started"
"Daniel Santos (151) vs. Joo Sang Yoo (152.5)","He will just as soon as referee Herb Dean clocks them in, and the two bump fists.",5,FALSE,FALSE,FALSE,FALSE,FALSE,NA,NA,TRUE,FALSE,TRUE,FALSE,FALSE,FALSE,FALSE,FALSE,FALSE,FALSE,"Round 1",FALSE,FALSE,FALSE,FALSE,FALSE,FALSE,FALSE,FALSE,FALSE,FALSE,FALSE,FALSE,FALSE,FALSE,FALSE,FALSE,FALSE,FALSE,FALSE,FALSE,FALSE,FALSE,FALSE,FALSE,FALSE,FALSE,FALSE,FALSE,FALSE,0,0,0.00669285092428486,0.00669285092428486,"",""
"Daniel Santos (151) vs. Joo Sang Yoo (152.5)","Now it's time for some face-punching.",6,FALSE,FALSE,FALSE,FALSE,FALSE,NA,NA,FALSE,FALSE,TRUE,FALSE,FALSE,FALSE,FALSE,FALSE,FALSE,FALSE,"Round 1",FALSE,FALSE,FALSE,FALSE,FALSE,FALSE,FALSE,FALSE,FALSE,FALSE,FALSE,FALSE,FALSE,FALSE,FALSE,FALSE,FALSE,FALSE,FALSE,FALSE,FALSE,FALSE,FALSE,FALSE,FALSE,FALSE,FALSE,FALSE,FALSE,0,0,0.00669285092428486,0.00669285092428486,"",""
"Daniel Santos (151) vs. Joo Sang Yoo (152.5)","Yoo sneaks out a low kick, and he jumps away to dodge a counter kick and plants one more on the same spot.",7,FALSE,FALSE,FALSE,FALSE,FALSE,NA,NA,FALSE,FALSE,TRUE,FALSE,FALSE,FALSE,FALSE,FALSE,FALSE,FALSE,"Round 1",FALSE,FALSE,FALSE,FALSE,FALSE,FALSE,FALSE,FALSE,FALSE,FALSE,FALSE,FALSE,FALSE,FALSE,FALSE,FALSE,FALSE,FALSE,FALSE,FALSE,FALSE,FALSE,FALSE,FALSE,FALSE,FALSE,FALSE,FALSE,FALSE,0,0,0.00669285092428486,0.00669285092428486,"",""
"Daniel Santos (151) vs. Joo Sang Yoo (152.5)","Santos just misses with a spinning wheel kick, and Yoo springs to the side and flicks out a jab.",8,FALSE,FALSE,FALSE,FALSE,FALSE,NA,NA,FALSE,FALSE,TRUE,FALSE,FALSE,FALSE,FALSE,FALSE,FALSE,FALSE,"Round 1",FALSE,FALSE,FALSE,FALSE,FALSE,FALSE,FALSE,FALSE,FALSE,FALSE,FALSE,FALSE,FALSE,FALSE,FALSE,FALSE,FALSE,FALSE,FALSE,FALSE,FALSE,FALSE,FALSE,FALSE,FALSE,FALSE,FALSE,FALSE,FALSE,0,0,0.00669285092428486,0.00669285092428486,"",""
"Daniel Santos (151) vs. Joo Sang Yoo (152.5)","Yoo leaves a right hand out too long, and Santos just misses on the counter.",9,FALSE,FALSE,FALSE,FALSE,FALSE,NA,NA,FALSE,FALSE,TRUE,FALSE,FALSE,FALSE,FALSE,FALSE,FALSE,FALSE,"Round 1",FALSE,FALSE,FALSE,FALSE,FALSE,FALSE,FALSE,FALSE,FALSE,FALSE,FALSE,FALSE,FALSE,FALSE,FALSE,FALSE,FALSE,FALSE,FALSE,FALSE,FALSE,FALSE,FALSE,FALSE,FALSE,FALSE,FALSE,FALSE,FALSE,0,0,0.00669285092428486,0.00669285092428486,"",""
"Daniel Santos (151) vs. Joo Sang Yoo (152.5)","A quick high kick comes from the Brazilian, and he attempts to time a jab with a chopping calf kick.",10,FALSE,FALSE,FALSE,FALSE,FALSE,NA,NA,FALSE,FALSE,TRUE,FALSE,FALSE,FALSE,FALSE,FALSE,FALSE,FALSE,"Round 1",FALSE,FALSE,FALSE,FALSE,FALSE,FALSE,FALSE,FALSE,FALSE,FALSE,FALSE,FALSE,FALSE,FALSE,FALSE,FALSE,FALSE,FALSE,FALSE,FALSE,FALSE,FALSE,FALSE,FALSE,FALSE,FALSE,FALSE,FALSE,FALSE,0,0,0.00669285092428486,0.00669285092428486,"",""
"Daniel Santos (151) vs. Joo Sang Yoo (152.5)","Santos aims and comes up short on a body kick, and he spins with more kicks that keep missing.",11,FALSE,FALSE,FALSE,FALSE,FALSE,NA,NA,FALSE,FALSE,TRUE,FALSE,FALSE,FALSE,FALSE,FALSE,FALSE,FALSE,"Round 1",FALSE,FALSE,FALSE,FALSE,FALSE,FALSE,FALSE,FALSE,FALSE,FALSE,FALSE,FALSE,FALSE,FALSE,FALSE,FALSE,FALSE,FALSE,FALSE,FALSE,FALSE,FALSE,FALSE,FALSE,FALSE,FALSE,FALSE,FALSE,FALSE,0,0,0.00669285092428486,0.00669285092428486,"",""
"Daniel Santos (151) vs. Joo Sang Yoo (152.5)","Yoo busts him in the chops with a knee up the middle, and his right hand and low kick further do damage.",12,FALSE,FALSE,FALSE,FALSE,FALSE,NA,NA,FALSE,FALSE,TRUE,FALSE,FALSE,FALSE,FALSE,FALSE,FALSE,FALSE,"Round 1",FALSE,FALSE,FALSE,FALSE,FALSE,FALSE,FALSE,FALSE,FALSE,FALSE,FALSE,FALSE,FALSE,FALSE,FALSE,FALSE,FALSE,FALSE,FALSE,FALSE,FALSE,FALSE,FALSE,FALSE,FALSE,FALSE,FALSE,FALSE,FALSE,0,0,0.00669285092428486,0.00669285092428486,"",""
"Daniel Santos (151) vs. Joo Sang Yoo (152.5)","Santos comes out swinging back, and ""Zombie Jr."" beats him to the punch with his piston-like jab.",13,FALSE,FALSE,FALSE,FALSE,FALSE,NA,NA,FALSE,FALSE,TRUE,FALSE,FALSE,FALSE,FALSE,FALSE,FALSE,FALSE,"Round 1",FALSE,FALSE,FALSE,FALSE,FALSE,FALSE,FALSE,FALSE,FALSE,FALSE,FALSE,FALSE,FALSE,FALSE,FALSE,FALSE,FALSE,FALSE,FALSE,FALSE,FALSE,FALSE,FALSE,FALSE,FALSE,FALSE,FALSE,FALSE,FALSE,0,0,0.00669285092428486,0.00669285092428486,"",""
"Daniel Santos (151) vs. Joo Sang Yoo (152.5)","Santos leaps after him and catches him with a punch or two, and Yoo claps at him to celebrate.",14,FALSE,FALSE,FALSE,FALSE,FALSE,NA,NA,FALSE,FALSE,TRUE,FALSE,FALSE,FALSE,FALSE,FALSE,FALSE,FALSE,"Round 1",FALSE,FALSE,FALSE,FALSE,FALSE,FALSE,FALSE,FALSE,FALSE,FALSE,FALSE,FALSE,FALSE,FALSE,FALSE,FALSE,FALSE,FALSE,FALSE,FALSE,FALSE,FALSE,FALSE,FALSE,FALSE,FALSE,FALSE,FALSE,FALSE,0,0,0.00669285092428486,0.00669285092428486,"",""
"Daniel Santos (151) vs. Joo Sang Yoo (152.5)","Santos spins and misses, and Yoo showboats and does his own little twirl.",15,FALSE,FALSE,FALSE,FALSE,FALSE,NA,NA,FALSE,FALSE,TRUE,FALSE,FALSE,FALSE,FALSE,FALSE,FALSE,FALSE,"Round 1",FALSE,FALSE,FALSE,FALSE,FALSE,FALSE,FALSE,FALSE,FALSE,FALSE,FALSE,FALSE,FALSE,FALSE,FALSE,FALSE,FALSE,FALSE,FALSE,FALSE,FALSE,FALSE,FALSE,FALSE,FALSE,FALSE,FALSE,FALSE,FALSE,0,0,0.00669285092428486,0.00669285092428486,"",""
"Daniel Santos (151) vs. Joo Sang Yoo (152.5)","Santos punches his way into a double-leg takedown, scoops the South Korean off his feet and taking the excitement out of the crowd.",16,FALSE,FALSE,FALSE,FALSE,FALSE,NA,NA,FALSE,FALSE,TRUE,FALSE,FALSE,FALSE,FALSE,FALSE,FALSE,FALSE,"Round 1",FALSE,FALSE,FALSE,FALSE,FALSE,FALSE,FALSE,FALSE,FALSE,FALSE,FALSE,FALSE,FALSE,FALSE,FALSE,FALSE,FALSE,FALSE,FALSE,FALSE,FALSE,FALSE,FALSE,FALSE,FALSE,FALSE,FALSE,FALSE,FALSE,0,0,0.00669285092428486,0.00669285092428486,"",""
"Daniel Santos (151) vs. Joo Sang Yoo (152.5)","Santos headbutts Yoo in the chest a couple times, and Dean tells him he has to stop doing that.",17,FALSE,FALSE,FALSE,TRUE,FALSE,NA,NA,FALSE,FALSE,TRUE,TRUE,FALSE,FALSE,FALSE,FALSE,FALSE,FALSE,"Round 1",TRUE,FALSE,FALSE,FALSE,TRUE,FALSE,FALSE,FALSE,FALSE,FALSE,FALSE,FALSE,FALSE,TRUE,FALSE,FALSE,FALSE,FALSE,FALSE,FALSE,FALSE,FALSE,FALSE,FALSE,FALSE,FALSE,FALSE,FALSE,FALSE,110,100,0.993307149075715,0.993307149075715,"strong_anchor|foul_language|foul_re_hit",""
"Daniel Santos (151) vs. Joo Sang Yoo (152.5)","Yoo puts his hand by his face to mime that he is resting, and Santos keeps trying to control him.",18,FALSE,FALSE,FALSE,FALSE,FALSE,NA,NA,FALSE,FALSE,TRUE,FALSE,FALSE,FALSE,FALSE,FALSE,FALSE,FALSE,"Round 1",FALSE,FALSE,FALSE,FALSE,FALSE,FALSE,FALSE,FALSE,FALSE,FALSE,FALSE,FALSE,FALSE,FALSE,FALSE,FALSE,FALSE,FALSE,FALSE,FALSE,FALSE,FALSE,FALSE,FALSE,FALSE,FALSE,FALSE,FALSE,FALSE,0,0,0.00669285092428486,0.00669285092428486,"",""
"Daniel Santos (151) vs. Joo Sang Yoo (152.5)","Santos looks to grind Yoo down like a mortar and pestle, grating and draining him all while Yoo motions that he is bored.",19,FALSE,FALSE,FALSE,FALSE,FALSE,NA,NA,FALSE,FALSE,TRUE,FALSE,FALSE,FALSE,FALSE,FALSE,FALSE,FALSE,"Round 1",FALSE,FALSE,FALSE,FALSE,FALSE,FALSE,FALSE,FALSE,FALSE,FALSE,FALSE,FALSE,FALSE,FALSE,FALSE,FALSE,FALSE,FALSE,FALSE,FALSE,FALSE,FALSE,FALSE,FALSE,FALSE,FALSE,FALSE,FALSE,FALSE,0,0,0.00669285092428486,0.00669285092428486,"",""
"Daniel Santos (151) vs. Joo Sang Yoo (152.5)","Yoo fights to his feet, and the fans respond in kind.",20,FALSE,FALSE,FALSE,FALSE,FALSE,NA,NA,FALSE,FALSE,TRUE,FALSE,FALSE,FALSE,FALSE,FALSE,FALSE,FALSE,"Round 1",FALSE,FALSE,FALSE,FALSE,FALSE,FALSE,FALSE,FALSE,FALSE,FALSE,FALSE,FALSE,FALSE,FALSE,FALSE,FALSE,FALSE,FALSE,FALSE,FALSE,FALSE,FALSE,FALSE,FALSE,FALSE,FALSE,FALSE,FALSE,FALSE,0,0,0.00669285092428486,0.00669285092428486,"",""
"Daniel Santos (151) vs. Joo Sang Yoo (152.5)","Yoo jams his man in the torso several times with kicks, and his hands are wide as he snaps out jabs.",21,FALSE,FALSE,FALSE,FALSE,FALSE,NA,NA,FALSE,FALSE,TRUE,FALSE,FALSE,FALSE,FALSE,FALSE,FALSE,FALSE,"Round 1",FALSE,FALSE,FALSE,FALSE,FALSE,FALSE,FALSE,FALSE,FALSE,FALSE,FALSE,FALSE,FALSE,FALSE,FALSE,FALSE,FALSE,FALSE,FALSE,FALSE,FALSE,FALSE,FALSE,FALSE,FALSE,FALSE,FALSE,FALSE,FALSE,0,0,0.00669285092428486,0.00669285092428486,"",""
"Daniel Santos (151) vs. Joo Sang Yoo (152.5)","Santos dips down and wings a right hand, and Yoo laughs it off.",22,FALSE,FALSE,FALSE,FALSE,FALSE,NA,NA,FALSE,FALSE,TRUE,FALSE,FALSE,FALSE,FALSE,FALSE,FALSE,FALSE,"Round 1",FALSE,FALSE,FALSE,FALSE,FALSE,FALSE,FALSE,FALSE,FALSE,FALSE,FALSE,FALSE,FALSE,FALSE,FALSE,FALSE,FALSE,FALSE,FALSE,FALSE,FALSE,FALSE,FALSE,FALSE,FALSE,FALSE,FALSE,FALSE,FALSE,0,0,0.00669285092428486,0.00669285092428486,"",""
"Daniel Santos (151) vs. Joo Sang Yoo (152.5)","Yoo lands, and Santos fires back harder.",23,FALSE,FALSE,FALSE,FALSE,FALSE,NA,NA,FALSE,FALSE,TRUE,FALSE,FALSE,FALSE,FALSE,FALSE,FALSE,FALSE,"Round 1",FALSE,FALSE,FALSE,FALSE,FALSE,FALSE,FALSE,FALSE,FALSE,FALSE,FALSE,FALSE,FALSE,FALSE,FALSE,FALSE,FALSE,FALSE,FALSE,FALSE,FALSE,FALSE,FALSE,FALSE,FALSE,FALSE,FALSE,FALSE,FALSE,0,0,0.00669285092428486,0.00669285092428486,"",""
"Daniel Santos (151) vs. Joo Sang Yoo (152.5)","The impact of Santos' blows is much more measurable, while Yoo would prefer to just touch and get away.",24,FALSE,FALSE,FALSE,FALSE,FALSE,NA,NA,TRUE,FALSE,TRUE,FALSE,FALSE,FALSE,FALSE,FALSE,FALSE,FALSE,"Round 1",FALSE,FALSE,FALSE,FALSE,FALSE,FALSE,FALSE,FALSE,FALSE,FALSE,FALSE,FALSE,FALSE,FALSE,FALSE,FALSE,FALSE,FALSE,FALSE,FALSE,FALSE,FALSE,FALSE,FALSE,FALSE,FALSE,FALSE,FALSE,FALSE,0,0,0.00669285092428486,0.00669285092428486,"",""
"Daniel Santos (151) vs. Joo Sang Yoo (152.5)","Yoo slaps Santos in the face, and Santos pays him back with hard hooks.",25,FALSE,FALSE,FALSE,FALSE,FALSE,NA,NA,FALSE,FALSE,TRUE,FALSE,FALSE,FALSE,FALSE,FALSE,FALSE,FALSE,"Round 1",FALSE,FALSE,FALSE,FALSE,FALSE,FALSE,FALSE,FALSE,FALSE,FALSE,FALSE,FALSE,FALSE,FALSE,FALSE,FALSE,FALSE,FALSE,FALSE,FALSE,FALSE,FALSE,FALSE,FALSE,FALSE,FALSE,FALSE,FALSE,FALSE,0,0,0.00669285092428486,0.00669285092428486,"",""
"Daniel Santos (151) vs. Joo Sang Yoo (152.5)","The South Korean peppers the front leg with kicks and dodges a wheel kick as the horn sounds.",26,FALSE,FALSE,FALSE,FALSE,FALSE,NA,NA,FALSE,FALSE,TRUE,FALSE,FALSE,FALSE,FALSE,FALSE,FALSE,FALSE,"Round 1",FALSE,FALSE,FALSE,FALSE,FALSE,FALSE,FALSE,FALSE,FALSE,FALSE,FALSE,FALSE,FALSE,FALSE,FALSE,FALSE,FALSE,FALSE,FALSE,FALSE,FALSE,FALSE,FALSE,FALSE,FALSE,FALSE,FALSE,FALSE,FALSE,0,0,0.00669285092428486,0.00669285092428486,"",""
"Daniel Santos (151) vs. Joo Sang Yoo (152.5)","Sherdog Scores Jay Pettry scores the round: 10-9 Yoo Dayne Fox scores the round: 10-9 Yoo Scottie Smith scores the round: 10-9 Yoo Round 2 Yoo starts the round elusive as can be, zipping from side to side and tagging Santos with long punches.",27,FALSE,FALSE,FALSE,FALSE,FALSE,NA,"Round 2",FALSE,FALSE,TRUE,FALSE,FALSE,FALSE,FALSE,FALSE,FALSE,FALSE,"Round 2",FALSE,FALSE,FALSE,FALSE,FALSE,FALSE,FALSE,FALSE,FALSE,FALSE,FALSE,FALSE,FALSE,FALSE,FALSE,FALSE,FALSE,FALSE,FALSE,FALSE,FALSE,FALSE,FALSE,FALSE,FALSE,FALSE,FALSE,FALSE,FALSE,0,0,0.00669285092428486,0.00669285092428486,"",""
"Daniel Santos (151) vs. Joo Sang Yoo (152.5)","Santos is angered by this bull-matador approach, and he blitzes the South Korean.",28,FALSE,FALSE,FALSE,FALSE,FALSE,NA,NA,FALSE,FALSE,TRUE,FALSE,FALSE,FALSE,FALSE,FALSE,FALSE,FALSE,"Round 2",FALSE,FALSE,FALSE,FALSE,FALSE,FALSE,FALSE,FALSE,FALSE,FALSE,FALSE,FALSE,FALSE,FALSE,FALSE,FALSE,FALSE,FALSE,FALSE,FALSE,FALSE,FALSE,FALSE,FALSE,FALSE,FALSE,FALSE,FALSE,FALSE,0,0,0.00669285092428486,0.00669285092428486,"",""
"Daniel Santos (151) vs. Joo Sang Yoo (152.5)","Yoo parries two punches,and the third, a sweeping left hook from the Brazilian, smashes square into Yoo's jaw.",29,FALSE,FALSE,FALSE,FALSE,FALSE,NA,NA,FALSE,FALSE,TRUE,FALSE,FALSE,FALSE,FALSE,FALSE,FALSE,FALSE,"Round 2",FALSE,FALSE,FALSE,FALSE,FALSE,FALSE,FALSE,FALSE,FALSE,FALSE,FALSE,FALSE,FALSE,FALSE,FALSE,FALSE,FALSE,FALSE,FALSE,FALSE,FALSE,FALSE,FALSE,FALSE,FALSE,FALSE,FALSE,FALSE,FALSE,0,0,0.00669285092428486,0.00669285092428486,"",""
"Daniel Santos (151) vs. Joo Sang Yoo (152.5)","Yoo collapses to the ground on his knees, and Santos batters him with an onslaught of right hands to finish the job.",30,FALSE,FALSE,FALSE,FALSE,FALSE,NA,NA,FALSE,FALSE,TRUE,FALSE,FALSE,FALSE,FALSE,FALSE,FALSE,FALSE,"Round 2",FALSE,FALSE,FALSE,FALSE,FALSE,FALSE,FALSE,FALSE,FALSE,FALSE,FALSE,FALSE,FALSE,FALSE,FALSE,FALSE,FALSE,FALSE,FALSE,FALSE,FALSE,FALSE,FALSE,FALSE,FALSE,FALSE,FALSE,FALSE,FALSE,0,0,0.00669285092428486,0.00669285092428486,"",""
"Daniel Santos (151) vs. Joo Sang Yoo (152.5)","Yoo appears frustrated that he got caught until his expression changes from the standing-to-ground blows he is absorbing, and it does not take much more than that for Dean to intervene.",31,FALSE,FALSE,FALSE,FALSE,FALSE,NA,NA,FALSE,FALSE,TRUE,FALSE,FALSE,FALSE,FALSE,FALSE,FALSE,FALSE,"Round 2",FALSE,FALSE,FALSE,FALSE,FALSE,FALSE,FALSE,FALSE,FALSE,FALSE,FALSE,FALSE,FALSE,FALSE,FALSE,FALSE,FALSE,FALSE,FALSE,FALSE,FALSE,FALSE,FALSE,FALSE,FALSE,FALSE,FALSE,FALSE,FALSE,0,0,0.00669285092428486,0.00669285092428486,"",""
"Daniel Santos (151) vs. Joo Sang Yoo (152.5)","Just like that, ""Zombie Jr."" has been drummed out of the ranks of the unbeaten, and Santos notches a huge win with style points and runs to greet Mark Zuckerberg sitting cageside.",32,FALSE,FALSE,FALSE,FALSE,FALSE,NA,NA,FALSE,FALSE,TRUE,FALSE,FALSE,FALSE,FALSE,FALSE,FALSE,FALSE,"Round 2",TRUE,FALSE,FALSE,FALSE,FALSE,FALSE,FALSE,FALSE,FALSE,FALSE,FALSE,FALSE,FALSE,FALSE,FALSE,FALSE,FALSE,FALSE,FALSE,FALSE,FALSE,FALSE,FALSE,FALSE,FALSE,FALSE,FALSE,FALSE,FALSE,20,20,0.0474258731775668,0.0474258731775668,"strong_anchor",""
"Daniel Santos (151) vs. Joo Sang Yoo (152.5)","The Official Result Daniel Santos def.",33,FALSE,FALSE,FALSE,FALSE,FALSE,NA,NA,FALSE,FALSE,TRUE,FALSE,FALSE,FALSE,FALSE,FALSE,FALSE,FALSE,"Round 2",FALSE,FALSE,FALSE,FALSE,FALSE,FALSE,FALSE,FALSE,FALSE,FALSE,FALSE,FALSE,FALSE,FALSE,FALSE,FALSE,FALSE,FALSE,FALSE,FALSE,FALSE,FALSE,FALSE,FALSE,FALSE,FALSE,FALSE,FALSE,FALSE,0,0,0.00669285092428486,0.00669285092428486,"",""
"Daniel Santos (151) vs. Joo Sang Yoo (152.5)","Joo Sang Yoo R2 0:21 via TKO (Punches)",34,FALSE,FALSE,FALSE,FALSE,FALSE,"0:21",NA,FALSE,FALSE,TRUE,FALSE,FALSE,FALSE,FALSE,FALSE,FALSE,FALSE,"Round 2",FALSE,FALSE,FALSE,FALSE,FALSE,FALSE,FALSE,FALSE,FALSE,FALSE,FALSE,FALSE,FALSE,FALSE,FALSE,FALSE,FALSE,FALSE,FALSE,FALSE,FALSE,FALSE,FALSE,FALSE,FALSE,FALSE,FALSE,FALSE,FALSE,0,0,0.00669285092428486,0.00669285092428486,"",""
"Ateba Abega Gautier (186) vs. Treston Vines (185)","Ateba Abega Gautier (186) vs.",1,FALSE,FALSE,FALSE,FALSE,FALSE,NA,NA,FALSE,FALSE,FALSE,FALSE,FALSE,FALSE,FALSE,FALSE,FALSE,FALSE,NA,FALSE,FALSE,FALSE,FALSE,FALSE,FALSE,FALSE,FALSE,FALSE,FALSE,FALSE,FALSE,TRUE,FALSE,FALSE,FALSE,FALSE,FALSE,FALSE,FALSE,FALSE,FALSE,FALSE,FALSE,FALSE,FALSE,FALSE,FALSE,FALSE,-40,0,0.00669285092428486,0.00669285092428486,"","gate_not_started"
"Ateba Abega Gautier (186) vs. Treston Vines (185)","Treston Vines (185) BETTING PREVIEW | SCOUTING REPORT | ODDS: Gautier (-1600), Vines (+900) Round 1 Two knock-er-outers enter, and one knock-er-outer will leave.",2,FALSE,FALSE,FALSE,FALSE,FALSE,NA,"Round 1",FALSE,FALSE,FALSE,FALSE,FALSE,FALSE,FALSE,FALSE,FALSE,FALSE,"Round 1",FALSE,FALSE,FALSE,FALSE,FALSE,FALSE,FALSE,FALSE,FALSE,FALSE,FALSE,FALSE,TRUE,FALSE,FALSE,FALSE,FALSE,FALSE,FALSE,FALSE,FALSE,FALSE,FALSE,FALSE,FALSE,FALSE,FALSE,FALSE,FALSE,-40,0,0.00669285092428486,0.00669285092428486,"","gate_not_started"
"Ateba Abega Gautier (186) vs. Treston Vines (185)","Cameroonian slugger Gautier (8-1, 2-0 UFC) will come in as a ludicrous betting favorite against late replacement Vines (10-3, 0-0 UFC).",3,FALSE,FALSE,FALSE,FALSE,FALSE,NA,NA,FALSE,FALSE,FALSE,FALSE,FALSE,FALSE,FALSE,FALSE,FALSE,FALSE,"Round 1",FALSE,FALSE,FALSE,FALSE,FALSE,FALSE,FALSE,FALSE,FALSE,FALSE,FALSE,FALSE,TRUE,FALSE,FALSE,FALSE,FALSE,FALSE,FALSE,FALSE,FALSE,FALSE,FALSE,FALSE,FALSE,FALSE,FALSE,FALSE,FALSE,-40,0,0.00669285092428486,0.00669285092428486,"","gate_not_started"
