"bout","sentence","sid","is_upkick_mention","is_hypothetical","is_groin_candidate","has_foul_raw","is_reaction_only","time_str","round_str_raw","ref_mentioned","ready_mentioned","fight_started","has_foul","pause_token","non_foul_pz","explicit_no_pause","is_neg","is_deduction_raw","is_result","round_mentioned","pos_strong_anchor","pos_eye_clean","pos_pause","pos_deduction","pos_foul_re_hit","neg_block_backhead","neg_block_eye","neg_block_upkick_hypo","neg_block_eye_warning","neg_block_toes_fence","neg_block_legal_belt","neg_gate_reaction","neg_gate_not_started","pos_foul_language","neg_injury_stoppage","pos_ref_words","pos_pause_foul","pos_ref_foul","pos_uncalled_foul","neg_hypo_upkick","neg_nonfoul_eye","neg_eye_warning","neg_nonfoul_back","neg_toes_negated","neg_legal_belt","neg_no_pause","neg_negation","neg_injury_eye","neg_reaction_only","rule_score_raw","rule_score","rule_conf_sigmoid","rule_conf","rule_reasons_pos","rule_reasons_neg"
"Veronica Hardy (124.5) vs. Brogan Walker (125.5)","Veronica Hardy (124.5) vs.",1,FALSE,FALSE,FALSE,FALSE,FALSE,NA,NA,FALSE,FALSE,FALSE,FALSE,FALSE,FALSE,FALSE,FALSE,FALSE,FALSE,NA,FALSE,FALSE,FALSE,FALSE,FALSE,FALSE,FALSE,FALSE,FALSE,FALSE,FALSE,FALSE,TRUE,FALSE,FALSE,FALSE,FALSE,FALSE,FALSE,FALSE,FALSE,FALSE,FALSE,FALSE,FALSE,FALSE,FALSE,FALSE,FALSE,-40,0,0.00669285092428486,0.00669285092428486,"","gate_not_started"
"Veronica Hardy (124.5) vs. Brogan Walker (125.5)","Brogan Walker (125.5) BETTING PREVIEW | SCOUTING REPORT | ODDS: Hardy (-625), Walker (+455) Round 1 Toparaphraselightweight Terrance McKinney, nothing in life is guaranteed except death, taxes and Veronica Hardy (9-5-1, 4-5 UFC) being the first fight of the night.",2,FALSE,FALSE,FALSE,FALSE,FALSE,NA,"Round 1",FALSE,FALSE,FALSE,FALSE,FALSE,FALSE,FALSE,FALSE,FALSE,FALSE,"Round 1",FALSE,FALSE,FALSE,FALSE,FALSE,FALSE,FALSE,FALSE,FALSE,FALSE,FALSE,FALSE,TRUE,FALSE,FALSE,FALSE,FALSE,FALSE,FALSE,FALSE,FALSE,FALSE,FALSE,FALSE,FALSE,FALSE,FALSE,FALSE,FALSE,-40,0,0.00669285092428486,0.00669285092428486,"","gate_not_started"
"Veronica Hardy (124.5) vs. Brogan Walker (125.5)","With tax season months away and no mortality in sight, the guarantee falls to the latter, who is indeed serving as the UFC 320 curtain jerker for her seventh event in a row—likely a UFC record if someone tracked that oddity.",3,FALSE,FALSE,FALSE,FALSE,FALSE,NA,NA,FALSE,FALSE,FALSE,FALSE,FALSE,FALSE,FALSE,FALSE,FALSE,FALSE,"Round 1",FALSE,FALSE,FALSE,FALSE,FALSE,FALSE,FALSE,FALSE,FALSE,FALSE,FALSE,FALSE,TRUE,FALSE,FALSE,FALSE,FALSE,FALSE,FALSE,FALSE,FALSE,FALSE,FALSE,FALSE,FALSE,FALSE,FALSE,FALSE,FALSE,-40,0,0.00669285092428486,0.00669285092428486,"","gate_not_started"
"Veronica Hardy (124.5) vs. Brogan Walker (125.5)","She draws Invicta FC vet Walker (7-4, 0-2 UFC), whose run has not gone well in the promotion as she returns from a lengthy layoff.",4,FALSE,FALSE,FALSE,FALSE,FALSE,NA,NA,FALSE,FALSE,FALSE,FALSE,FALSE,FALSE,FALSE,FALSE,FALSE,FALSE,"Round 1",FALSE,FALSE,FALSE,FALSE,FALSE,FALSE,FALSE,FALSE,FALSE,FALSE,FALSE,FALSE,TRUE,FALSE,FALSE,FALSE,FALSE,FALSE,FALSE,FALSE,FALSE,FALSE,FALSE,FALSE,FALSE,FALSE,FALSE,FALSE,FALSE,-40,0,0.00669285092428486,0.00669285092428486,"","gate_not_started"
"Veronica Hardy (124.5) vs. Brogan Walker (125.5)","A pink slip might be handed out to the unsuccessful flyweight in this contest at night's end, and referee Jason Herzog will make sure everything is above board to then.",5,FALSE,TRUE,FALSE,FALSE,FALSE,NA,NA,TRUE,FALSE,TRUE,FALSE,FALSE,FALSE,FALSE,FALSE,FALSE,FALSE,"Round 1",FALSE,FALSE,FALSE,FALSE,FALSE,FALSE,FALSE,FALSE,FALSE,FALSE,FALSE,FALSE,FALSE,FALSE,FALSE,FALSE,FALSE,FALSE,FALSE,FALSE,FALSE,FALSE,FALSE,FALSE,FALSE,FALSE,FALSE,FALSE,FALSE,0,0,0.00669285092428486,0.00669285092428486,"",""
"Veronica Hardy (124.5) vs. Brogan Walker (125.5)","The ladies bump their firsts together to initiate the evening's frivolities. (function (v,i) { let screenWidth = i.innerWidth; if (screenWidth <= 400) { document.getElementById('adViAi').style.display = 'none'; return; } var scp = v.createElement('script'), config = { ChannelID: '0nqr3w5ff', AdUnitType: '2', PublisherID: '256607409443141', PlacementID: 'pltU2JIgmaTXI9XW18z', DivID: '', IAB_Category: 'IAB17', Keywords: '', Language: 'en-us', BG_Color: '', Text_Color: '', Font: '', FontSize: '', }; scp.src='https://s.vi-serve.com/tagLoader.js'; scp.type = 'text/javascript'; scp.async = true; scp.onload = function() { i[btoa('video intelligence start')].init(config); }; (v.getElementsByTagName('head')[0] || v.documentElement.appendChild(v.createElement('head'))).appendChild(scp); })(document, window); Advertisement Walker slowly walks forward to engage, ignoring a calf kick and sitting down on a right hand when Hardy comes towards her.",6,FALSE,FALSE,FALSE,FALSE,FALSE,NA,NA,FALSE,FALSE,TRUE,FALSE,FALSE,FALSE,FALSE,FALSE,FALSE,FALSE,"Round 1",FALSE,FALSE,FALSE,FALSE,FALSE,FALSE,FALSE,FALSE,FALSE,FALSE,FALSE,FALSE,FALSE,FALSE,FALSE,FALSE,FALSE,FALSE,FALSE,FALSE,FALSE,FALSE,FALSE,FALSE,FALSE,FALSE,FALSE,FALSE,FALSE,0,0,0.00669285092428486,0.00669285092428486,"",""
"Veronica Hardy (124.5) vs. Brogan Walker (125.5)","Walker chops at the front leg after a lull, and she swats out with her left hand to no avail.",7,FALSE,FALSE,FALSE,FALSE,FALSE,NA,NA,FALSE,FALSE,TRUE,FALSE,FALSE,FALSE,FALSE,FALSE,FALSE,FALSE,"Round 1",FALSE,FALSE,FALSE,FALSE,FALSE,FALSE,FALSE,FALSE,FALSE,FALSE,FALSE,FALSE,FALSE,FALSE,FALSE,FALSE,FALSE,FALSE,FALSE,FALSE,FALSE,FALSE,FALSE,FALSE,FALSE,FALSE,FALSE,FALSE,FALSE,0,0,0.00669285092428486,0.00669285092428486,"",""
"Veronica Hardy (124.5) vs. Brogan Walker (125.5)","Hardy swings back with a pair of counters, her lefts clipping Walker on the chin.",8,FALSE,FALSE,FALSE,FALSE,FALSE,NA,NA,FALSE,FALSE,TRUE,FALSE,FALSE,FALSE,FALSE,FALSE,FALSE,FALSE,"Round 1",FALSE,FALSE,FALSE,FALSE,FALSE,FALSE,FALSE,FALSE,FALSE,FALSE,FALSE,FALSE,FALSE,FALSE,FALSE,FALSE,FALSE,FALSE,FALSE,FALSE,FALSE,FALSE,FALSE,FALSE,FALSE,FALSE,FALSE,FALSE,FALSE,0,0,0.00669285092428486,0.00669285092428486,"",""
"Veronica Hardy (124.5) vs. Brogan Walker (125.5)","As Hardy keeps pushing the pace, she bowls Walker over and assumes top position.",9,FALSE,FALSE,FALSE,FALSE,FALSE,NA,NA,FALSE,FALSE,TRUE,FALSE,FALSE,FALSE,FALSE,FALSE,FALSE,FALSE,"Round 1",FALSE,FALSE,FALSE,FALSE,FALSE,FALSE,FALSE,FALSE,FALSE,FALSE,FALSE,FALSE,FALSE,FALSE,FALSE,FALSE,FALSE,FALSE,FALSE,FALSE,FALSE,FALSE,FALSE,FALSE,FALSE,FALSE,FALSE,FALSE,FALSE,0,0,0.00669285092428486,0.00669285092428486,"",""
"Veronica Hardy (124.5) vs. Brogan Walker (125.5)","Walker keeps tight to not let Hardy posture up and get much offense off, resulting in another stalemate.",10,FALSE,FALSE,FALSE,FALSE,FALSE,NA,NA,FALSE,FALSE,TRUE,FALSE,FALSE,FALSE,FALSE,FALSE,FALSE,FALSE,"Round 1",FALSE,FALSE,FALSE,FALSE,FALSE,FALSE,FALSE,FALSE,FALSE,FALSE,FALSE,FALSE,FALSE,FALSE,FALSE,FALSE,FALSE,FALSE,FALSE,FALSE,FALSE,FALSE,FALSE,FALSE,FALSE,FALSE,FALSE,FALSE,FALSE,0,0,0.00669285092428486,0.00669285092428486,"",""
"Veronica Hardy (124.5) vs. Brogan Walker (125.5)","Hardy lifts her foe up and slams her down in an effort to break out of the grip, and when that does not work, she scores a single right hand.",11,FALSE,FALSE,FALSE,FALSE,FALSE,NA,NA,FALSE,FALSE,TRUE,FALSE,FALSE,FALSE,FALSE,FALSE,FALSE,FALSE,"Round 1",FALSE,FALSE,FALSE,FALSE,FALSE,FALSE,FALSE,FALSE,FALSE,FALSE,FALSE,FALSE,FALSE,FALSE,FALSE,FALSE,FALSE,FALSE,FALSE,FALSE,FALSE,FALSE,FALSE,FALSE,FALSE,FALSE,FALSE,FALSE,FALSE,0,0,0.00669285092428486,0.00669285092428486,"",""
"Veronica Hardy (124.5) vs. Brogan Walker (125.5)","Walker hangs on tight, and Hardy once more elevates her to slam her back on the floor.",12,FALSE,FALSE,FALSE,FALSE,FALSE,NA,NA,FALSE,FALSE,TRUE,FALSE,FALSE,FALSE,FALSE,FALSE,FALSE,FALSE,"Round 1",FALSE,FALSE,FALSE,FALSE,FALSE,FALSE,FALSE,FALSE,FALSE,FALSE,FALSE,FALSE,FALSE,FALSE,FALSE,FALSE,FALSE,FALSE,FALSE,FALSE,FALSE,FALSE,FALSE,FALSE,FALSE,FALSE,FALSE,FALSE,FALSE,0,0,0.00669285092428486,0.00669285092428486,"",""
"Veronica Hardy (124.5) vs. Brogan Walker (125.5)","Hardy gladly stacks her up and nullifies her, with little more happening than Hardy presiding on top.",13,FALSE,FALSE,FALSE,FALSE,FALSE,NA,NA,FALSE,FALSE,TRUE,FALSE,FALSE,FALSE,FALSE,FALSE,FALSE,FALSE,"Round 1",FALSE,FALSE,FALSE,FALSE,FALSE,FALSE,FALSE,FALSE,FALSE,FALSE,FALSE,FALSE,FALSE,FALSE,FALSE,FALSE,FALSE,FALSE,FALSE,FALSE,FALSE,FALSE,FALSE,FALSE,FALSE,FALSE,FALSE,FALSE,FALSE,0,0,0.00669285092428486,0.00669285092428486,"",""
"Veronica Hardy (124.5) vs. Brogan Walker (125.5)","The Venezuelan gets off a strike or two, and Walker forces her way back to her feet.",14,FALSE,FALSE,FALSE,FALSE,FALSE,NA,NA,FALSE,FALSE,TRUE,FALSE,FALSE,FALSE,FALSE,FALSE,FALSE,FALSE,"Round 1",FALSE,FALSE,FALSE,FALSE,FALSE,FALSE,FALSE,FALSE,FALSE,FALSE,FALSE,FALSE,FALSE,FALSE,FALSE,FALSE,FALSE,FALSE,FALSE,FALSE,FALSE,FALSE,FALSE,FALSE,FALSE,FALSE,FALSE,FALSE,FALSE,0,0,0.00669285092428486,0.00669285092428486,"",""
"Veronica Hardy (124.5) vs. Brogan Walker (125.5)","On her way up, Walker is blasted in the face by two quick head kicks, and she shakes out the cobwebs and turns Hardy to the fencing.",15,FALSE,FALSE,FALSE,FALSE,FALSE,NA,NA,FALSE,FALSE,TRUE,FALSE,FALSE,FALSE,FALSE,FALSE,FALSE,FALSE,"Round 1",TRUE,FALSE,FALSE,FALSE,FALSE,FALSE,FALSE,FALSE,FALSE,FALSE,FALSE,FALSE,FALSE,FALSE,FALSE,FALSE,FALSE,FALSE,FALSE,FALSE,FALSE,FALSE,FALSE,FALSE,FALSE,FALSE,FALSE,FALSE,FALSE,20,20,0.0474258731775668,0.0474258731775668,"strong_anchor",""
"Veronica Hardy (124.5) vs. Brogan Walker (125.5)","Using a trip, Walker gets Hardy off her feet, and she has to fight through Hardy's offensive guard and upkicks to establish herself.",16,TRUE,FALSE,FALSE,FALSE,FALSE,NA,NA,FALSE,FALSE,TRUE,FALSE,FALSE,FALSE,FALSE,FALSE,FALSE,FALSE,"Round 1",FALSE,FALSE,FALSE,FALSE,FALSE,FALSE,FALSE,FALSE,FALSE,FALSE,FALSE,FALSE,FALSE,FALSE,FALSE,FALSE,FALSE,FALSE,FALSE,FALSE,FALSE,FALSE,FALSE,FALSE,FALSE,FALSE,FALSE,FALSE,FALSE,0,0,0.00669285092428486,0.00669285092428486,"",""
"Veronica Hardy (124.5) vs. Brogan Walker (125.5)","Hardy keeps Walker from climbing into top position until Walker sells out for attack.",17,FALSE,FALSE,FALSE,FALSE,FALSE,NA,NA,FALSE,FALSE,TRUE,FALSE,FALSE,FALSE,FALSE,FALSE,FALSE,FALSE,"Round 1",FALSE,FALSE,FALSE,FALSE,FALSE,FALSE,FALSE,FALSE,FALSE,FALSE,FALSE,FALSE,FALSE,FALSE,FALSE,FALSE,FALSE,FALSE,FALSE,FALSE,FALSE,FALSE,FALSE,FALSE,FALSE,FALSE,FALSE,FALSE,FALSE,0,0,0.00669285092428486,0.00669285092428486,"",""
"Veronica Hardy (124.5) vs. Brogan Walker (125.5)","This is the worst thing she can do, as she falls straight into an armbar, and it is locked as Hardy rolls over.",18,FALSE,FALSE,FALSE,FALSE,FALSE,NA,NA,FALSE,FALSE,TRUE,FALSE,FALSE,FALSE,FALSE,FALSE,FALSE,FALSE,"Round 1",FALSE,FALSE,FALSE,FALSE,FALSE,FALSE,FALSE,FALSE,FALSE,FALSE,FALSE,FALSE,FALSE,FALSE,FALSE,FALSE,FALSE,FALSE,FALSE,FALSE,FALSE,FALSE,FALSE,FALSE,FALSE,FALSE,FALSE,FALSE,FALSE,0,0,0.00669285092428486,0.00669285092428486,"",""
"Veronica Hardy (124.5) vs. Brogan Walker (125.5)","Time expires, and Hardy shouts to Herzog that her opponent tapped.",19,FALSE,FALSE,FALSE,FALSE,FALSE,NA,NA,FALSE,FALSE,TRUE,FALSE,FALSE,FALSE,FALSE,FALSE,FALSE,FALSE,"Round 1",FALSE,FALSE,FALSE,FALSE,FALSE,FALSE,FALSE,FALSE,FALSE,FALSE,FALSE,FALSE,FALSE,FALSE,FALSE,FALSE,FALSE,FALSE,FALSE,FALSE,FALSE,FALSE,FALSE,FALSE,FALSE,FALSE,FALSE,FALSE,FALSE,0,0,0.00669285092428486,0.00669285092428486,"",""
"Veronica Hardy (124.5) vs. Brogan Walker (125.5)","Herzog calls for the replay officials to check on the submission.",20,FALSE,FALSE,FALSE,FALSE,FALSE,NA,NA,FALSE,FALSE,TRUE,FALSE,TRUE,FALSE,FALSE,FALSE,FALSE,FALSE,"Round 1",FALSE,FALSE,TRUE,FALSE,FALSE,FALSE,FALSE,FALSE,FALSE,FALSE,FALSE,FALSE,FALSE,FALSE,FALSE,FALSE,FALSE,FALSE,FALSE,FALSE,FALSE,FALSE,FALSE,FALSE,FALSE,FALSE,FALSE,FALSE,FALSE,0,0,0.00669285092428486,0.00669285092428486,"",""
"Veronica Hardy (124.5) vs. Brogan Walker (125.5)","Sherdog Scores Jay Pettry scores the round: 10-9 Hardy Dayne Fox scores the round: 10-9 Hardy Scottie Smith scores the round: 10-9 Hardy Round 2 To keep paraphrasing today, in the similar words of Tito Ortiz, there was never no tap.",21,FALSE,FALSE,FALSE,FALSE,FALSE,NA,"Round 2",FALSE,FALSE,TRUE,FALSE,FALSE,FALSE,FALSE,FALSE,FALSE,FALSE,"Round 2",FALSE,FALSE,FALSE,FALSE,FALSE,FALSE,FALSE,FALSE,FALSE,FALSE,FALSE,FALSE,FALSE,FALSE,FALSE,FALSE,FALSE,FALSE,FALSE,FALSE,FALSE,FALSE,FALSE,FALSE,FALSE,FALSE,FALSE,FALSE,FALSE,0,0,0.00669285092428486,0.00669285092428486,"",""
"Veronica Hardy (124.5) vs. Brogan Walker (125.5)","The second round begins, with Walker cleared to continue having not surrendered.",22,FALSE,FALSE,FALSE,FALSE,FALSE,NA,NA,FALSE,FALSE,TRUE,FALSE,FALSE,FALSE,FALSE,FALSE,FALSE,FALSE,"Round 2",FALSE,FALSE,FALSE,FALSE,FALSE,FALSE,FALSE,FALSE,FALSE,FALSE,FALSE,FALSE,FALSE,FALSE,FALSE,FALSE,FALSE,FALSE,FALSE,FALSE,FALSE,FALSE,FALSE,FALSE,FALSE,FALSE,FALSE,FALSE,FALSE,0,0,0.00669285092428486,0.00669285092428486,"",""
"Veronica Hardy (124.5) vs. Brogan Walker (125.5)","Both ladies stay away from engaging for much of the first minute, barring a low kick or two.",23,FALSE,FALSE,FALSE,FALSE,FALSE,NA,NA,FALSE,FALSE,TRUE,FALSE,FALSE,FALSE,FALSE,FALSE,FALSE,FALSE,"Round 2",FALSE,FALSE,FALSE,FALSE,FALSE,FALSE,FALSE,FALSE,FALSE,FALSE,FALSE,FALSE,FALSE,FALSE,FALSE,FALSE,FALSE,FALSE,FALSE,FALSE,FALSE,FALSE,FALSE,FALSE,FALSE,FALSE,FALSE,FALSE,FALSE,0,0,0.00669285092428486,0.00669285092428486,"",""
"Veronica Hardy (124.5) vs. Brogan Walker (125.5)","Walker reaches at the end of a right hand, only for Hardy to counter her cleanly.",24,FALSE,FALSE,FALSE,FALSE,FALSE,NA,NA,FALSE,FALSE,TRUE,FALSE,FALSE,FALSE,FALSE,FALSE,FALSE,FALSE,"Round 2",FALSE,FALSE,FALSE,FALSE,FALSE,FALSE,FALSE,FALSE,FALSE,FALSE,FALSE,FALSE,FALSE,FALSE,FALSE,FALSE,FALSE,FALSE,FALSE,FALSE,FALSE,FALSE,FALSE,FALSE,FALSE,FALSE,FALSE,FALSE,FALSE,0,0,0.00669285092428486,0.00669285092428486,"",""
"Veronica Hardy (124.5) vs. Brogan Walker (125.5)","Walker tosses out a low kick, and she is countered over the top with a right hand.",25,FALSE,FALSE,FALSE,FALSE,FALSE,NA,NA,FALSE,FALSE,TRUE,FALSE,FALSE,FALSE,FALSE,FALSE,FALSE,FALSE,"Round 2",FALSE,FALSE,FALSE,FALSE,FALSE,FALSE,FALSE,FALSE,FALSE,FALSE,FALSE,FALSE,FALSE,FALSE,FALSE,FALSE,FALSE,FALSE,FALSE,FALSE,FALSE,FALSE,FALSE,FALSE,FALSE,FALSE,FALSE,FALSE,FALSE,0,0,0.00669285092428486,0.00669285092428486,"",""
"Veronica Hardy (124.5) vs. Brogan Walker (125.5)","Hardy connects with a left hand and tries to chain a few strikes behind it, but ""The Bear"" escapes in time.",26,FALSE,FALSE,FALSE,FALSE,FALSE,NA,NA,FALSE,FALSE,TRUE,FALSE,FALSE,FALSE,FALSE,FALSE,FALSE,FALSE,"Round 2",FALSE,FALSE,FALSE,FALSE,FALSE,FALSE,FALSE,FALSE,FALSE,FALSE,FALSE,FALSE,FALSE,FALSE,FALSE,FALSE,FALSE,FALSE,FALSE,FALSE,FALSE,FALSE,FALSE,FALSE,FALSE,FALSE,FALSE,FALSE,FALSE,0,0,0.00669285092428486,0.00669285092428486,"",""
"Veronica Hardy (124.5) vs. Brogan Walker (125.5)","Both women paw at one another, and they swing big right hands behind them.",27,FALSE,FALSE,FALSE,FALSE,FALSE,NA,NA,FALSE,FALSE,TRUE,FALSE,FALSE,FALSE,FALSE,FALSE,FALSE,FALSE,"Round 2",FALSE,FALSE,FALSE,FALSE,FALSE,FALSE,FALSE,FALSE,FALSE,FALSE,FALSE,FALSE,FALSE,FALSE,FALSE,FALSE,FALSE,FALSE,FALSE,FALSE,FALSE,FALSE,FALSE,FALSE,FALSE,FALSE,FALSE,FALSE,FALSE,0,0,0.00669285092428486,0.00669285092428486,"",""
"Veronica Hardy (124.5) vs. Brogan Walker (125.5)","Hardy knocks Walker clean off her feet, and she raises her arms in the air and allows Walker to stand rather than trying to finish the job.",28,FALSE,FALSE,FALSE,FALSE,FALSE,NA,NA,FALSE,FALSE,TRUE,FALSE,FALSE,FALSE,FALSE,FALSE,FALSE,FALSE,"Round 2",FALSE,FALSE,FALSE,FALSE,FALSE,FALSE,FALSE,FALSE,FALSE,FALSE,FALSE,FALSE,FALSE,FALSE,FALSE,FALSE,FALSE,FALSE,FALSE,FALSE,FALSE,FALSE,FALSE,FALSE,FALSE,FALSE,FALSE,FALSE,FALSE,0,0,0.00669285092428486,0.00669285092428486,"",""
"Veronica Hardy (124.5) vs. Brogan Walker (125.5)","Hardy lashes out with short but effective combinations, ending at least one with a solid body kick but the punches are getting through more and more.",29,FALSE,FALSE,FALSE,FALSE,FALSE,NA,NA,FALSE,FALSE,TRUE,FALSE,FALSE,FALSE,FALSE,FALSE,FALSE,FALSE,"Round 2",FALSE,FALSE,FALSE,FALSE,FALSE,FALSE,FALSE,FALSE,FALSE,FALSE,FALSE,FALSE,FALSE,FALSE,FALSE,FALSE,FALSE,FALSE,FALSE,FALSE,FALSE,FALSE,FALSE,FALSE,FALSE,FALSE,FALSE,FALSE,FALSE,0,0,0.00669285092428486,0.00669285092428486,"",""
"Veronica Hardy (124.5) vs. Brogan Walker (125.5)","Walker tries to catch the kick, but it lands first and Hardy pulls it back in time.",30,FALSE,FALSE,FALSE,FALSE,FALSE,NA,NA,FALSE,FALSE,TRUE,FALSE,FALSE,FALSE,FALSE,FALSE,FALSE,FALSE,"Round 2",FALSE,FALSE,FALSE,FALSE,FALSE,FALSE,FALSE,FALSE,FALSE,FALSE,FALSE,FALSE,FALSE,FALSE,FALSE,FALSE,FALSE,FALSE,FALSE,FALSE,FALSE,FALSE,FALSE,FALSE,FALSE,FALSE,FALSE,FALSE,FALSE,0,0,0.00669285092428486,0.00669285092428486,"",""
"Veronica Hardy (124.5) vs. Brogan Walker (125.5)","Hardy strings three punches together, beating Walker to the punch and pump-faking at the end of it to make her flinch.",31,FALSE,FALSE,FALSE,FALSE,FALSE,NA,NA,FALSE,FALSE,TRUE,FALSE,FALSE,FALSE,FALSE,FALSE,FALSE,FALSE,"Round 2",FALSE,FALSE,FALSE,FALSE,FALSE,FALSE,FALSE,FALSE,FALSE,FALSE,FALSE,FALSE,FALSE,FALSE,FALSE,FALSE,FALSE,FALSE,FALSE,FALSE,FALSE,FALSE,FALSE,FALSE,FALSE,FALSE,FALSE,FALSE,FALSE,0,0,0.00669285092428486,0.00669285092428486,"",""
"Veronica Hardy (124.5) vs. Brogan Walker (125.5)","Hardy sinks a kick in under the elbow, and she dodges one coming back her way to fire back harder.",32,FALSE,FALSE,FALSE,FALSE,FALSE,NA,NA,FALSE,FALSE,TRUE,FALSE,FALSE,FALSE,FALSE,FALSE,FALSE,FALSE,"Round 2",FALSE,FALSE,FALSE,FALSE,FALSE,FALSE,FALSE,FALSE,FALSE,FALSE,FALSE,FALSE,FALSE,FALSE,FALSE,FALSE,FALSE,FALSE,FALSE,FALSE,FALSE,FALSE,FALSE,FALSE,FALSE,FALSE,FALSE,FALSE,FALSE,0,0,0.00669285092428486,0.00669285092428486,"",""
"Veronica Hardy (124.5) vs. Brogan Walker (125.5)","Walker punches her way into a takedown, and she tackles Hardy to the mat with seconds to spare.",33,FALSE,FALSE,FALSE,FALSE,FALSE,NA,NA,FALSE,FALSE,TRUE,FALSE,FALSE,FALSE,FALSE,FALSE,FALSE,FALSE,"Round 2",FALSE,FALSE,FALSE,FALSE,FALSE,FALSE,FALSE,FALSE,FALSE,FALSE,FALSE,FALSE,FALSE,FALSE,FALSE,FALSE,FALSE,FALSE,FALSE,FALSE,FALSE,FALSE,FALSE,FALSE,FALSE,FALSE,FALSE,FALSE,FALSE,0,0,0.00669285092428486,0.00669285092428486,"",""
"Veronica Hardy (124.5) vs. Brogan Walker (125.5)","Hardy fights back by setting up a leglock, and Walker rains down hammerfists to the bell.",34,FALSE,FALSE,FALSE,FALSE,FALSE,NA,NA,FALSE,FALSE,TRUE,FALSE,FALSE,FALSE,FALSE,FALSE,FALSE,FALSE,"Round 2",FALSE,FALSE,FALSE,FALSE,FALSE,FALSE,FALSE,FALSE,FALSE,FALSE,FALSE,FALSE,FALSE,FALSE,FALSE,FALSE,FALSE,FALSE,FALSE,FALSE,FALSE,FALSE,FALSE,FALSE,FALSE,FALSE,FALSE,FALSE,FALSE,0,0,0.00669285092428486,0.00669285092428486,"",""
"Veronica Hardy (124.5) vs. Brogan Walker (125.5)","Sherdog Scores Jay Pettry scores the round: 10-9 Hardy Dayne Fox scores the round: 10-9 Hardy Scottie Smith scores the round: 10-9 Hardy Round 3 The third round begins without a stolen line in sight, as the two flyweights just want to punch one another in the face.",35,FALSE,FALSE,FALSE,FALSE,FALSE,NA,"Round 3",FALSE,FALSE,TRUE,FALSE,FALSE,FALSE,FALSE,FALSE,FALSE,FALSE,"Round 3",FALSE,FALSE,FALSE,FALSE,FALSE,FALSE,FALSE,FALSE,FALSE,FALSE,FALSE,FALSE,FALSE,FALSE,FALSE,FALSE,FALSE,FALSE,FALSE,FALSE,FALSE,FALSE,FALSE,FALSE,FALSE,FALSE,FALSE,FALSE,FALSE,0,0,0.00669285092428486,0.00669285092428486,"",""
"Veronica Hardy (124.5) vs. Brogan Walker (125.5)","Walker lands first with a front-leg body kick, and she skirts away from a calf kick.",36,FALSE,FALSE,FALSE,FALSE,FALSE,NA,NA,FALSE,FALSE,TRUE,FALSE,FALSE,FALSE,FALSE,FALSE,FALSE,FALSE,"Round 3",FALSE,FALSE,FALSE,FALSE,FALSE,FALSE,FALSE,FALSE,FALSE,FALSE,FALSE,FALSE,FALSE,FALSE,FALSE,FALSE,FALSE,FALSE,FALSE,FALSE,FALSE,FALSE,FALSE,FALSE,FALSE,FALSE,FALSE,FALSE,FALSE,0,0,0.00669285092428486,0.00669285092428486,"",""
"Veronica Hardy (124.5) vs. Brogan Walker (125.5)","Both ladies swing and miss at one another, with Hardy coiling and firing off hooks that largely miss the mark.",37,FALSE,FALSE,FALSE,FALSE,FALSE,NA,NA,FALSE,FALSE,TRUE,FALSE,FALSE,FALSE,FALSE,FALSE,FALSE,FALSE,"Round 3",FALSE,FALSE,FALSE,FALSE,FALSE,FALSE,FALSE,FALSE,FALSE,FALSE,FALSE,FALSE,FALSE,FALSE,FALSE,FALSE,FALSE,FALSE,FALSE,FALSE,FALSE,FALSE,FALSE,FALSE,FALSE,FALSE,FALSE,FALSE,FALSE,0,0,0.00669285092428486,0.00669285092428486,"",""
"Veronica Hardy (124.5) vs. Brogan Walker (125.5)","Walker lumbers forward behind a left hand, but she does not pursue grappling behind it.",38,FALSE,FALSE,FALSE,FALSE,FALSE,NA,NA,FALSE,FALSE,TRUE,FALSE,FALSE,FALSE,FALSE,FALSE,FALSE,FALSE,"Round 3",FALSE,FALSE,FALSE,FALSE,FALSE,FALSE,FALSE,FALSE,FALSE,FALSE,FALSE,FALSE,FALSE,FALSE,FALSE,FALSE,FALSE,FALSE,FALSE,FALSE,FALSE,FALSE,FALSE,FALSE,FALSE,FALSE,FALSE,FALSE,FALSE,0,0,0.00669285092428486,0.00669285092428486,"",""
"Veronica Hardy (124.5) vs. Brogan Walker (125.5)","Walker walks straight into an overhand right, and her face is swelling around her left eye as a result of the absorbed blows.",39,FALSE,FALSE,FALSE,FALSE,FALSE,NA,NA,FALSE,FALSE,TRUE,FALSE,FALSE,FALSE,FALSE,FALSE,FALSE,FALSE,"Round 3",TRUE,FALSE,FALSE,FALSE,FALSE,FALSE,TRUE,FALSE,FALSE,FALSE,FALSE,FALSE,FALSE,FALSE,TRUE,FALSE,FALSE,FALSE,FALSE,FALSE,TRUE,FALSE,FALSE,FALSE,FALSE,FALSE,FALSE,TRUE,FALSE,-140,0,0.00669285092428486,0.00669285092428486,"strong_anchor","nonfoul_eye_context|injury_eye_context|blocked_eye|injury_stoppage"
"Veronica Hardy (124.5) vs. Brogan Walker (125.5)","Hardy swings her way into another combo, breaking off before Walker can hit her back.",40,FALSE,FALSE,FALSE,FALSE,FALSE,NA,NA,FALSE,FALSE,TRUE,FALSE,FALSE,FALSE,FALSE,FALSE,FALSE,FALSE,"Round 3",FALSE,FALSE,FALSE,FALSE,FALSE,FALSE,FALSE,FALSE,FALSE,FALSE,FALSE,FALSE,FALSE,FALSE,FALSE,FALSE,FALSE,FALSE,FALSE,FALSE,FALSE,FALSE,FALSE,FALSE,FALSE,FALSE,FALSE,FALSE,FALSE,0,0,0.00669285092428486,0.00669285092428486,"",""
"Veronica Hardy (124.5) vs. Brogan Walker (125.5)","Walker initiates a clinch, and when that fails, her body language appears to betray her as she looks like she just realized she is out of options.",41,FALSE,FALSE,FALSE,FALSE,FALSE,NA,NA,FALSE,FALSE,TRUE,FALSE,FALSE,FALSE,FALSE,FALSE,FALSE,FALSE,"Round 3",FALSE,FALSE,FALSE,FALSE,FALSE,FALSE,FALSE,FALSE,FALSE,FALSE,FALSE,FALSE,FALSE,FALSE,FALSE,FALSE,FALSE,FALSE,FALSE,FALSE,FALSE,FALSE,FALSE,FALSE,FALSE,FALSE,FALSE,FALSE,FALSE,0,0,0.00669285092428486,0.00669285092428486,"",""
"Veronica Hardy (124.5) vs. Brogan Walker (125.5)","Hardy picks and pokes, marking her up with distant right hands that seem to land anytime she commits to one.",42,FALSE,FALSE,FALSE,FALSE,FALSE,NA,NA,FALSE,FALSE,TRUE,FALSE,FALSE,FALSE,FALSE,FALSE,FALSE,FALSE,"Round 3",FALSE,FALSE,FALSE,FALSE,FALSE,FALSE,FALSE,FALSE,FALSE,FALSE,FALSE,FALSE,FALSE,FALSE,FALSE,FALSE,FALSE,FALSE,FALSE,FALSE,FALSE,FALSE,FALSE,FALSE,FALSE,FALSE,FALSE,FALSE,FALSE,0,0,0.00669285092428486,0.00669285092428486,"",""
"Veronica Hardy (124.5) vs. Brogan Walker (125.5)","She does not follow many of these effective strikes with much, allowing Walker to recover if she is stunned.",43,FALSE,FALSE,FALSE,FALSE,FALSE,NA,NA,FALSE,FALSE,TRUE,FALSE,FALSE,FALSE,FALSE,FALSE,FALSE,FALSE,"Round 3",FALSE,FALSE,FALSE,FALSE,FALSE,FALSE,FALSE,FALSE,FALSE,FALSE,FALSE,FALSE,FALSE,FALSE,FALSE,FALSE,FALSE,FALSE,FALSE,FALSE,FALSE,FALSE,FALSE,FALSE,FALSE,FALSE,FALSE,FALSE,FALSE,0,0,0.00669285092428486,0.00669285092428486,"",""
"Veronica Hardy (124.5) vs. Brogan Walker (125.5)","Walker hurls a right hand and bowls Hardy over with 90 seconds to spare, and she somehow takes Hardy's back on the way down and gets a hook in.",44,FALSE,FALSE,FALSE,FALSE,FALSE,NA,NA,FALSE,FALSE,TRUE,FALSE,FALSE,FALSE,FALSE,FALSE,FALSE,FALSE,"Round 3",FALSE,FALSE,FALSE,FALSE,FALSE,FALSE,FALSE,FALSE,FALSE,FALSE,FALSE,FALSE,FALSE,FALSE,FALSE,FALSE,FALSE,FALSE,FALSE,FALSE,FALSE,FALSE,FALSE,FALSE,FALSE,FALSE,FALSE,FALSE,FALSE,0,0,0.00669285092428486,0.00669285092428486,"",""
"Veronica Hardy (124.5) vs. Brogan Walker (125.5)","Hardy turns to her side to try to escape, clinging to Walker's right hand even as Walker sits on top of her in a three-quarter mount position.",45,FALSE,FALSE,FALSE,FALSE,FALSE,NA,NA,FALSE,FALSE,TRUE,FALSE,FALSE,FALSE,FALSE,FALSE,FALSE,FALSE,"Round 3",FALSE,FALSE,FALSE,FALSE,FALSE,FALSE,FALSE,FALSE,FALSE,FALSE,FALSE,FALSE,FALSE,FALSE,FALSE,FALSE,FALSE,FALSE,FALSE,FALSE,FALSE,FALSE,FALSE,FALSE,FALSE,FALSE,FALSE,FALSE,FALSE,0,0,0.00669285092428486,0.00669285092428486,"",""
"Veronica Hardy (124.5) vs. Brogan Walker (125.5)","Hardy's grip protects her from taking damage, perfectly shutting down Walker from doing anything.",46,FALSE,FALSE,FALSE,FALSE,FALSE,NA,NA,FALSE,FALSE,TRUE,FALSE,FALSE,FALSE,FALSE,FALSE,FALSE,FALSE,"Round 3",FALSE,FALSE,FALSE,FALSE,FALSE,FALSE,FALSE,FALSE,FALSE,FALSE,FALSE,FALSE,FALSE,FALSE,FALSE,FALSE,FALSE,FALSE,FALSE,FALSE,FALSE,FALSE,FALSE,FALSE,FALSE,FALSE,FALSE,FALSE,FALSE,0,0,0.00669285092428486,0.00669285092428486,"",""
"Veronica Hardy (124.5) vs. Brogan Walker (125.5)","The fight ends.",47,FALSE,FALSE,FALSE,FALSE,FALSE,NA,NA,FALSE,FALSE,TRUE,FALSE,FALSE,FALSE,FALSE,FALSE,FALSE,FALSE,"Round 3",FALSE,FALSE,FALSE,FALSE,FALSE,FALSE,FALSE,FALSE,FALSE,FALSE,FALSE,FALSE,FALSE,FALSE,FALSE,FALSE,FALSE,FALSE,FALSE,FALSE,FALSE,FALSE,FALSE,FALSE,FALSE,FALSE,FALSE,FALSE,FALSE,0,0,0.00669285092428486,0.00669285092428486,"",""
