"bout","sentence","sid","is_upkick_mention","is_hypothetical","is_groin_candidate","has_foul_raw","is_reaction_only","time_str","round_str_raw","ref_mentioned","ready_mentioned","fight_started","has_foul","pause_token","non_foul_pz","explicit_no_pause","is_neg","is_deduction_raw","is_result","round_mentioned","pos_strong_anchor","pos_eye_clean","pos_pause","pos_deduction","pos_foul_re_hit","neg_block_backhead","neg_block_eye","neg_block_upkick_hypo","neg_block_eye_warning","neg_block_toes_fence","neg_block_legal_belt","neg_gate_reaction","neg_gate_not_started","pos_foul_language","neg_injury_stoppage","pos_ref_words","pos_pause_foul","pos_ref_foul","pos_uncalled_foul","neg_hypo_upkick","neg_nonfoul_eye","neg_eye_warning","neg_nonfoul_back","neg_toes_negated","neg_legal_belt","neg_no_pause","neg_negation","neg_injury_eye","neg_reaction_only","rule_score_raw","rule_score","rule_conf_sigmoid","rule_conf","rule_reasons_pos","rule_reasons_neg"
"Jiri Prochazka (206) vs. Khalil Rountree (205)","Sherdog Scores Jay Pettry scores the round: 10-9 Rountree Dayne Fox scores the round: 10-9 Rountree Scottie Smith scores the round: 10-9 Rountree Round 3 A tiny cut on the corner of Rountree's right eye has been patched between rounds, and the athletes both know it's game time.",42,FALSE,FALSE,FALSE,FALSE,FALSE,NA,"Round 3",FALSE,FALSE,TRUE,FALSE,FALSE,FALSE,FALSE,FALSE,FALSE,FALSE,"Round 3",TRUE,FALSE,FALSE,FALSE,FALSE,FALSE,FALSE,FALSE,FALSE,FALSE,FALSE,FALSE,FALSE,FALSE,TRUE,FALSE,FALSE,FALSE,FALSE,FALSE,FALSE,FALSE,FALSE,FALSE,FALSE,FALSE,FALSE,TRUE,FALSE,-60,0,0.00669285092428486,0.00669285092428486,"strong_anchor","injury_eye_context|injury_stoppage"
"Jiri Prochazka (206) vs. Khalil Rountree (205)","Prochazka lashes out with strikes and threatens with a jump knee, and Rountree catches him with looping lefts.",43,FALSE,FALSE,FALSE,FALSE,FALSE,NA,NA,FALSE,FALSE,TRUE,FALSE,FALSE,FALSE,FALSE,FALSE,FALSE,FALSE,"Round 3",FALSE,FALSE,FALSE,FALSE,FALSE,FALSE,FALSE,FALSE,FALSE,FALSE,FALSE,FALSE,FALSE,FALSE,FALSE,FALSE,FALSE,FALSE,FALSE,FALSE,FALSE,FALSE,FALSE,FALSE,FALSE,FALSE,FALSE,FALSE,FALSE,0,0,0.00669285092428486,0.00669285092428486,"",""
"Jiri Prochazka (206) vs. Khalil Rountree (205)","Prochazka does not get the better of the exchange, so he settles himself down and fights behind a jab again.",44,FALSE,FALSE,FALSE,FALSE,FALSE,NA,NA,FALSE,FALSE,TRUE,FALSE,FALSE,FALSE,FALSE,FALSE,FALSE,FALSE,"Round 3",FALSE,FALSE,FALSE,FALSE,FALSE,FALSE,FALSE,FALSE,FALSE,FALSE,FALSE,FALSE,FALSE,FALSE,FALSE,FALSE,FALSE,FALSE,FALSE,FALSE,FALSE,FALSE,FALSE,FALSE,FALSE,FALSE,FALSE,FALSE,FALSE,0,0,0.00669285092428486,0.00669285092428486,"",""
"Jiri Prochazka (206) vs. Khalil Rountree (205)","Prochazka clips Rountree with a pair of hooks, and he pressures his foe when Rountree counters.",45,FALSE,FALSE,FALSE,FALSE,FALSE,NA,NA,FALSE,FALSE,TRUE,FALSE,FALSE,FALSE,FALSE,FALSE,FALSE,FALSE,"Round 3",FALSE,FALSE,FALSE,FALSE,FALSE,FALSE,FALSE,FALSE,FALSE,FALSE,FALSE,FALSE,FALSE,FALSE,FALSE,FALSE,FALSE,FALSE,FALSE,FALSE,FALSE,FALSE,FALSE,FALSE,FALSE,FALSE,FALSE,FALSE,FALSE,0,0,0.00669285092428486,0.00669285092428486,"",""
"Jiri Prochazka (206) vs. Khalil Rountree (205)","Prochazka walks Rountree down and starts marking him up, and Rountree times a jump knee to knock him out of the air.",46,FALSE,FALSE,FALSE,FALSE,FALSE,NA,NA,FALSE,FALSE,TRUE,FALSE,FALSE,FALSE,FALSE,FALSE,FALSE,FALSE,"Round 3",FALSE,FALSE,FALSE,FALSE,FALSE,FALSE,FALSE,FALSE,FALSE,FALSE,FALSE,FALSE,FALSE,FALSE,FALSE,FALSE,FALSE,FALSE,FALSE,FALSE,FALSE,FALSE,FALSE,FALSE,FALSE,FALSE,FALSE,FALSE,FALSE,0,0,0.00669285092428486,0.00669285092428486,"",""
"Jiri Prochazka (206) vs. Khalil Rountree (205)","Prochazka completely no-sells the offense and starts hurting Rountree, working him to the body and opening up punches upstairs.",47,FALSE,FALSE,FALSE,FALSE,FALSE,NA,NA,FALSE,FALSE,TRUE,FALSE,FALSE,FALSE,FALSE,FALSE,FALSE,FALSE,"Round 3",FALSE,FALSE,FALSE,FALSE,FALSE,FALSE,FALSE,FALSE,FALSE,FALSE,FALSE,FALSE,FALSE,FALSE,FALSE,FALSE,FALSE,FALSE,FALSE,FALSE,FALSE,FALSE,FALSE,FALSE,FALSE,FALSE,FALSE,FALSE,FALSE,0,0,0.00669285092428486,0.00669285092428486,"",""
"Jiri Prochazka (206) vs. Khalil Rountree (205)","Rountree stands firm, and Prochazka hurts him with a long but accurate combination.",48,FALSE,FALSE,FALSE,FALSE,FALSE,NA,NA,FALSE,FALSE,TRUE,FALSE,FALSE,FALSE,FALSE,FALSE,FALSE,FALSE,"Round 3",FALSE,FALSE,FALSE,FALSE,FALSE,FALSE,FALSE,FALSE,FALSE,FALSE,FALSE,FALSE,FALSE,FALSE,FALSE,FALSE,FALSE,FALSE,FALSE,FALSE,FALSE,FALSE,FALSE,FALSE,FALSE,FALSE,FALSE,FALSE,FALSE,0,0,0.00669285092428486,0.00669285092428486,"",""
"Jiri Prochazka (206) vs. Khalil Rountree (205)","Rountree takes a right hand at the end of a combo, and he is backing up as fast as he can.",49,FALSE,FALSE,FALSE,FALSE,FALSE,NA,NA,FALSE,FALSE,TRUE,FALSE,FALSE,FALSE,FALSE,FALSE,FALSE,FALSE,"Round 3",FALSE,FALSE,FALSE,FALSE,FALSE,FALSE,FALSE,FALSE,FALSE,FALSE,FALSE,FALSE,FALSE,FALSE,FALSE,FALSE,FALSE,FALSE,FALSE,FALSE,FALSE,FALSE,FALSE,FALSE,FALSE,FALSE,FALSE,FALSE,FALSE,0,0,0.00669285092428486,0.00669285092428486,"",""
"Jiri Prochazka (206) vs. Khalil Rountree (205)","Prochazka measures several uppercuts to the body, and Rountree fires back with a vengeance but his body is in trouble.",50,FALSE,FALSE,FALSE,FALSE,FALSE,NA,NA,FALSE,FALSE,TRUE,FALSE,FALSE,FALSE,FALSE,FALSE,FALSE,FALSE,"Round 3",FALSE,FALSE,FALSE,FALSE,FALSE,FALSE,FALSE,FALSE,FALSE,FALSE,FALSE,FALSE,FALSE,FALSE,TRUE,FALSE,FALSE,FALSE,FALSE,FALSE,FALSE,FALSE,FALSE,FALSE,FALSE,FALSE,FALSE,TRUE,FALSE,-80,0,0.00669285092428486,0.00669285092428486,"","injury_eye_context|injury_stoppage"
"Jiri Prochazka (206) vs. Khalil Rountree (205)","Rountree ties him up, and Prochazka welcomes this by slashing him with multiple elbows.",51,FALSE,FALSE,FALSE,FALSE,FALSE,NA,NA,FALSE,FALSE,TRUE,FALSE,FALSE,FALSE,FALSE,FALSE,FALSE,FALSE,"Round 3",FALSE,FALSE,FALSE,FALSE,FALSE,FALSE,FALSE,FALSE,FALSE,FALSE,FALSE,FALSE,FALSE,FALSE,FALSE,FALSE,FALSE,FALSE,FALSE,FALSE,FALSE,FALSE,FALSE,FALSE,FALSE,FALSE,FALSE,FALSE,FALSE,0,0,0.00669285092428486,0.00669285092428486,"",""
"Jiri Prochazka (206) vs. Khalil Rountree (205)","Prochazka breaks free and knees his man in the guts, and Rountree doubles over but somehow wills him back to keep fighting.",52,FALSE,FALSE,FALSE,FALSE,FALSE,NA,NA,FALSE,FALSE,TRUE,FALSE,FALSE,FALSE,FALSE,FALSE,FALSE,FALSE,"Round 3",FALSE,FALSE,FALSE,FALSE,FALSE,FALSE,FALSE,FALSE,FALSE,FALSE,FALSE,FALSE,FALSE,FALSE,FALSE,FALSE,FALSE,FALSE,FALSE,FALSE,FALSE,FALSE,FALSE,FALSE,FALSE,FALSE,FALSE,FALSE,FALSE,0,0,0.00669285092428486,0.00669285092428486,"",""
"Jiri Prochazka (206) vs. Khalil Rountree (205)","Prochazka gets caught while slugging it out, and Rountree grabs hold of the back of his neck and looks to get a standing guillotine choke.",53,FALSE,FALSE,FALSE,FALSE,FALSE,NA,NA,FALSE,FALSE,TRUE,FALSE,FALSE,FALSE,FALSE,FALSE,FALSE,FALSE,"Round 3",FALSE,FALSE,FALSE,FALSE,FALSE,FALSE,FALSE,FALSE,FALSE,FALSE,FALSE,FALSE,FALSE,FALSE,FALSE,FALSE,FALSE,FALSE,FALSE,FALSE,FALSE,FALSE,FALSE,FALSE,FALSE,FALSE,FALSE,FALSE,FALSE,0,0,0.00669285092428486,0.00669285092428486,"",""
"Jiri Prochazka (206) vs. Khalil Rountree (205)","Prochazka frees himself and walks down a fading Rountree, spinning with an elbow that buzzes the tower.",54,FALSE,FALSE,FALSE,FALSE,FALSE,NA,NA,FALSE,FALSE,TRUE,FALSE,FALSE,FALSE,FALSE,FALSE,FALSE,FALSE,"Round 3",FALSE,FALSE,FALSE,FALSE,FALSE,FALSE,FALSE,FALSE,FALSE,FALSE,FALSE,FALSE,FALSE,FALSE,FALSE,FALSE,FALSE,FALSE,FALSE,FALSE,FALSE,FALSE,FALSE,FALSE,FALSE,FALSE,FALSE,FALSE,FALSE,0,0,0.00669285092428486,0.00669285092428486,"",""
"Jiri Prochazka (206) vs. Khalil Rountree (205)","Rountree is taking shots but still giving it everything he has, and Prochazka snipes him and keeps him on the back foot.",55,FALSE,FALSE,FALSE,FALSE,FALSE,NA,NA,FALSE,FALSE,TRUE,FALSE,FALSE,FALSE,FALSE,FALSE,FALSE,FALSE,"Round 3",FALSE,FALSE,FALSE,FALSE,FALSE,FALSE,FALSE,FALSE,FALSE,FALSE,FALSE,FALSE,FALSE,FALSE,FALSE,FALSE,FALSE,FALSE,FALSE,FALSE,FALSE,FALSE,FALSE,FALSE,FALSE,FALSE,FALSE,FALSE,FALSE,0,0,0.00669285092428486,0.00669285092428486,"",""
"Jiri Prochazka (206) vs. Khalil Rountree (205)","Seeing that Rountree is busted up from the offense, Prochazka throws a veritable kitchen sink of head and body shots that Rountree cannot keep up with.",56,FALSE,FALSE,FALSE,FALSE,FALSE,NA,NA,FALSE,FALSE,TRUE,FALSE,FALSE,FALSE,FALSE,FALSE,FALSE,FALSE,"Round 3",FALSE,FALSE,FALSE,FALSE,FALSE,FALSE,FALSE,FALSE,FALSE,FALSE,FALSE,FALSE,FALSE,FALSE,FALSE,FALSE,FALSE,FALSE,FALSE,FALSE,FALSE,FALSE,FALSE,FALSE,FALSE,FALSE,FALSE,FALSE,FALSE,0,0,0.00669285092428486,0.00669285092428486,"",""
"Jiri Prochazka (206) vs. Khalil Rountree (205)","As he backs Rountree up to the fencing, Prochazka releases a tremendous one-two and follows with a laser-like straight left hand that sends Rountree slumping to the mat, face-first.",57,FALSE,FALSE,FALSE,FALSE,FALSE,NA,NA,FALSE,FALSE,TRUE,FALSE,FALSE,FALSE,FALSE,FALSE,FALSE,FALSE,"Round 3",TRUE,FALSE,FALSE,FALSE,FALSE,FALSE,FALSE,FALSE,FALSE,FALSE,FALSE,FALSE,FALSE,FALSE,FALSE,FALSE,FALSE,FALSE,FALSE,FALSE,FALSE,FALSE,FALSE,FALSE,FALSE,FALSE,FALSE,FALSE,FALSE,20,20,0.0474258731775668,0.0474258731775668,"strong_anchor",""
"Jiri Prochazka (206) vs. Khalil Rountree (205)","The victorious Czech fighter walks off, leaving a bloodied and battered Rountree on the mat sucking wind.",58,FALSE,FALSE,FALSE,FALSE,FALSE,NA,NA,FALSE,FALSE,TRUE,FALSE,FALSE,FALSE,FALSE,FALSE,FALSE,FALSE,"Round 3",FALSE,FALSE,FALSE,FALSE,FALSE,FALSE,FALSE,FALSE,FALSE,FALSE,FALSE,FALSE,FALSE,FALSE,TRUE,FALSE,FALSE,FALSE,FALSE,FALSE,FALSE,FALSE,FALSE,FALSE,FALSE,FALSE,FALSE,TRUE,FALSE,-80,0,0.00669285092428486,0.00669285092428486,"","injury_eye_context|injury_stoppage"
"Jiri Prochazka (206) vs. Khalil Rountree (205)","Unreal.",59,FALSE,FALSE,FALSE,FALSE,FALSE,NA,NA,FALSE,FALSE,TRUE,FALSE,FALSE,FALSE,FALSE,FALSE,FALSE,FALSE,"Round 3",FALSE,FALSE,FALSE,FALSE,FALSE,FALSE,FALSE,FALSE,FALSE,FALSE,FALSE,FALSE,FALSE,FALSE,FALSE,FALSE,FALSE,FALSE,FALSE,FALSE,FALSE,FALSE,FALSE,FALSE,FALSE,FALSE,FALSE,FALSE,FALSE,0,0,0.00669285092428486,0.00669285092428486,"",""
"Jiri Prochazka (206) vs. Khalil Rountree (205)","Prochazka has done it, securing a fantastic comeback against a top-tier foe with a titanic third-round performance.",60,FALSE,FALSE,FALSE,FALSE,FALSE,NA,NA,FALSE,FALSE,TRUE,FALSE,FALSE,FALSE,FALSE,FALSE,FALSE,FALSE,"Round 3",FALSE,FALSE,FALSE,FALSE,FALSE,FALSE,FALSE,FALSE,FALSE,FALSE,FALSE,FALSE,FALSE,FALSE,FALSE,FALSE,FALSE,FALSE,FALSE,FALSE,FALSE,FALSE,FALSE,FALSE,FALSE,FALSE,FALSE,FALSE,FALSE,0,0,0.00669285092428486,0.00669285092428486,"",""
"Jiri Prochazka (206) vs. Khalil Rountree (205)","""Round of the Year"" is not totally sewn up yet, but this frame is one that will be in the discussion for year-end accolades.",61,FALSE,FALSE,FALSE,FALSE,FALSE,NA,NA,FALSE,FALSE,TRUE,FALSE,FALSE,FALSE,FALSE,FALSE,FALSE,FALSE,"Round 3",FALSE,FALSE,FALSE,FALSE,FALSE,FALSE,FALSE,FALSE,FALSE,FALSE,FALSE,FALSE,FALSE,FALSE,FALSE,FALSE,FALSE,FALSE,FALSE,FALSE,FALSE,FALSE,FALSE,FALSE,FALSE,FALSE,FALSE,FALSE,FALSE,0,0,0.00669285092428486,0.00669285092428486,"",""
"Jiri Prochazka (206) vs. Khalil Rountree (205)","The Official Result Jiri Prochazka def.",62,FALSE,FALSE,FALSE,FALSE,FALSE,NA,NA,FALSE,FALSE,TRUE,FALSE,FALSE,FALSE,FALSE,FALSE,FALSE,FALSE,"Round 3",FALSE,FALSE,FALSE,FALSE,FALSE,FALSE,FALSE,FALSE,FALSE,FALSE,FALSE,FALSE,FALSE,FALSE,FALSE,FALSE,FALSE,FALSE,FALSE,FALSE,FALSE,FALSE,FALSE,FALSE,FALSE,FALSE,FALSE,FALSE,FALSE,0,0,0.00669285092428486,0.00669285092428486,"",""
"Jiri Prochazka (206) vs. Khalil Rountree (205)","Khalil Rountree R3 3:04 via KO (Punches)",63,FALSE,FALSE,FALSE,FALSE,FALSE,"3:04",NA,FALSE,FALSE,TRUE,FALSE,FALSE,FALSE,FALSE,FALSE,FALSE,FALSE,"Round 3",FALSE,FALSE,FALSE,FALSE,FALSE,FALSE,FALSE,FALSE,FALSE,FALSE,FALSE,FALSE,FALSE,FALSE,FALSE,FALSE,FALSE,FALSE,FALSE,FALSE,FALSE,FALSE,FALSE,FALSE,FALSE,FALSE,FALSE,FALSE,FALSE,0,0,0.00669285092428486,0.00669285092428486,"",""
"UFC Bantamweight Title Fight:
Merab Dvalishvili (135) vs. Cory Sandhagen (134.5)","UFC Bantamweight Title Fight: Merab Dvalishvili (135) vs.",1,FALSE,FALSE,FALSE,FALSE,FALSE,NA,NA,FALSE,FALSE,FALSE,FALSE,FALSE,FALSE,FALSE,FALSE,FALSE,FALSE,NA,FALSE,FALSE,FALSE,FALSE,FALSE,FALSE,FALSE,FALSE,FALSE,FALSE,FALSE,FALSE,TRUE,FALSE,FALSE,FALSE,FALSE,FALSE,FALSE,FALSE,FALSE,FALSE,FALSE,FALSE,FALSE,FALSE,FALSE,FALSE,FALSE,-40,0,0.00669285092428486,0.00669285092428486,"","gate_not_started"
"UFC Bantamweight Title Fight:
Merab Dvalishvili (135) vs. Cory Sandhagen (134.5)","Cory Sandhagen (134.5) BETTING PREVIEW | SCOUTING REPORT | ODDS: Dvalishvili (-375), Sandhagen (+295) Round 1 On his current run, 12 different men have tried to defeat Dvalishvili (20-4, 13-2 UFC), with Sean O'Malley undeservedly getting a second bite at the apple only to get submitted in the rematch.",2,FALSE,FALSE,FALSE,FALSE,FALSE,NA,"Round 1",FALSE,FALSE,FALSE,FALSE,FALSE,FALSE,FALSE,FALSE,FALSE,TRUE,"Round 1",FALSE,FALSE,FALSE,FALSE,FALSE,FALSE,FALSE,FALSE,FALSE,FALSE,FALSE,FALSE,TRUE,FALSE,FALSE,FALSE,FALSE,FALSE,FALSE,FALSE,FALSE,FALSE,FALSE,FALSE,FALSE,FALSE,FALSE,FALSE,FALSE,-40,0,0.00669285092428486,0.00669285092428486,"","gate_not_started"
"UFC Bantamweight Title Fight:
Merab Dvalishvili (135) vs. Cory Sandhagen (134.5)","One of those names is not Sandhagen (18-5, 11-4 UFC), who is fresh as a daisy and ready to pull off the upset.",3,FALSE,FALSE,FALSE,FALSE,FALSE,NA,NA,FALSE,FALSE,FALSE,FALSE,FALSE,FALSE,FALSE,FALSE,FALSE,FALSE,"Round 1",FALSE,FALSE,FALSE,FALSE,FALSE,FALSE,FALSE,FALSE,FALSE,FALSE,FALSE,FALSE,TRUE,FALSE,FALSE,FALSE,FALSE,FALSE,FALSE,FALSE,FALSE,FALSE,FALSE,FALSE,FALSE,FALSE,FALSE,FALSE,FALSE,-40,0,0.00669285092428486,0.00669285092428486,"","gate_not_started"
"UFC Bantamweight Title Fight:
Merab Dvalishvili (135) vs. Cory Sandhagen (134.5)","The bantamweight throne is up for grabs in this one, and referee Marc Goddard brings the two to the center of the cage to issue particulars and get them to touch gloves.",4,FALSE,FALSE,FALSE,FALSE,FALSE,NA,NA,TRUE,FALSE,TRUE,FALSE,FALSE,FALSE,FALSE,FALSE,FALSE,FALSE,"Round 1",TRUE,FALSE,FALSE,FALSE,FALSE,FALSE,FALSE,FALSE,FALSE,FALSE,FALSE,FALSE,FALSE,FALSE,FALSE,FALSE,FALSE,FALSE,FALSE,FALSE,FALSE,FALSE,FALSE,FALSE,FALSE,FALSE,FALSE,FALSE,FALSE,20,20,0.0474258731775668,0.0474258731775668,"strong_anchor",""
"UFC Bantamweight Title Fight:
Merab Dvalishvili (135) vs. Cory Sandhagen (134.5)","There is no ill will between them, so a glove touch is in order.",5,FALSE,FALSE,FALSE,FALSE,FALSE,NA,NA,FALSE,FALSE,TRUE,FALSE,FALSE,FALSE,FALSE,FALSE,FALSE,FALSE,"Round 1",FALSE,FALSE,FALSE,FALSE,FALSE,FALSE,FALSE,FALSE,FALSE,FALSE,FALSE,FALSE,FALSE,FALSE,FALSE,FALSE,FALSE,FALSE,FALSE,FALSE,FALSE,FALSE,FALSE,FALSE,FALSE,FALSE,FALSE,FALSE,FALSE,0,0,0.00669285092428486,0.00669285092428486,"",""
"UFC Bantamweight Title Fight:
Merab Dvalishvili (135) vs. Cory Sandhagen (134.5)","Sandhagen starts pushing the pace behind a jab, and a low kick gets in before Dvalishvili can fire back.",6,FALSE,FALSE,FALSE,FALSE,FALSE,NA,NA,FALSE,FALSE,TRUE,FALSE,FALSE,FALSE,FALSE,FALSE,FALSE,FALSE,"Round 1",FALSE,FALSE,FALSE,FALSE,FALSE,FALSE,FALSE,FALSE,FALSE,FALSE,FALSE,FALSE,FALSE,FALSE,FALSE,FALSE,FALSE,FALSE,FALSE,FALSE,FALSE,FALSE,FALSE,FALSE,FALSE,FALSE,FALSE,FALSE,FALSE,0,0,0.00669285092428486,0.00669285092428486,"",""
"UFC Bantamweight Title Fight:
Merab Dvalishvili (135) vs. Cory Sandhagen (134.5)","Dvalishvili pump-fakes his way in, and Sandhagen chew up his front leg and pops the champ with a left hand on the way out.",7,FALSE,FALSE,FALSE,FALSE,FALSE,NA,NA,FALSE,FALSE,TRUE,FALSE,FALSE,FALSE,FALSE,FALSE,FALSE,FALSE,"Round 1",FALSE,FALSE,FALSE,FALSE,FALSE,FALSE,FALSE,FALSE,FALSE,FALSE,FALSE,FALSE,FALSE,FALSE,FALSE,FALSE,FALSE,FALSE,FALSE,FALSE,FALSE,FALSE,FALSE,FALSE,FALSE,FALSE,FALSE,FALSE,FALSE,0,0,0.00669285092428486,0.00669285092428486,"",""
"UFC Bantamweight Title Fight:
Merab Dvalishvili (135) vs. Cory Sandhagen (134.5)","When Dvalishvili charges, Sandhagen beats him to the punch and slaps a low kick off the calf.",8,FALSE,FALSE,FALSE,FALSE,FALSE,NA,NA,FALSE,FALSE,TRUE,FALSE,FALSE,FALSE,FALSE,FALSE,FALSE,FALSE,"Round 1",FALSE,FALSE,FALSE,FALSE,FALSE,FALSE,FALSE,FALSE,FALSE,FALSE,FALSE,FALSE,FALSE,FALSE,FALSE,FALSE,FALSE,FALSE,FALSE,FALSE,FALSE,FALSE,FALSE,FALSE,FALSE,FALSE,FALSE,FALSE,FALSE,0,0,0.00669285092428486,0.00669285092428486,"",""
"UFC Bantamweight Title Fight:
Merab Dvalishvili (135) vs. Cory Sandhagen (134.5)","Dvalishvili walks face-first into a left hook, and Sandhagen follows it with two more punches and a calf kick.",9,FALSE,FALSE,FALSE,FALSE,FALSE,NA,NA,FALSE,FALSE,TRUE,FALSE,FALSE,FALSE,FALSE,FALSE,FALSE,FALSE,"Round 1",FALSE,FALSE,FALSE,FALSE,FALSE,FALSE,FALSE,FALSE,FALSE,FALSE,FALSE,FALSE,FALSE,FALSE,FALSE,FALSE,FALSE,FALSE,FALSE,FALSE,FALSE,FALSE,FALSE,FALSE,FALSE,FALSE,FALSE,FALSE,FALSE,0,0,0.00669285092428486,0.00669285092428486,"",""
"UFC Bantamweight Title Fight:
Merab Dvalishvili (135) vs. Cory Sandhagen (134.5)","""Sandman"" parries punches and is ready for a takedown shot, stonewalling the beltholder and pushing him back.",10,FALSE,FALSE,FALSE,FALSE,FALSE,NA,NA,FALSE,FALSE,TRUE,FALSE,FALSE,FALSE,FALSE,FALSE,FALSE,FALSE,"Round 1",FALSE,FALSE,FALSE,FALSE,FALSE,FALSE,FALSE,FALSE,FALSE,FALSE,FALSE,FALSE,FALSE,FALSE,FALSE,FALSE,FALSE,FALSE,FALSE,FALSE,FALSE,FALSE,FALSE,FALSE,FALSE,FALSE,FALSE,FALSE,FALSE,0,0,0.00669285092428486,0.00669285092428486,"",""
"UFC Bantamweight Title Fight:
Merab Dvalishvili (135) vs. Cory Sandhagen (134.5)","Dvalishvili sticks out a punch but absorbs an uppercut when backpedaling, and Sandhagen throws low while Dvalishvili goes high.",11,FALSE,FALSE,FALSE,FALSE,FALSE,NA,NA,FALSE,FALSE,TRUE,FALSE,FALSE,FALSE,FALSE,FALSE,FALSE,FALSE,"Round 1",FALSE,FALSE,FALSE,FALSE,FALSE,FALSE,FALSE,FALSE,FALSE,FALSE,FALSE,FALSE,FALSE,FALSE,TRUE,FALSE,FALSE,FALSE,FALSE,FALSE,FALSE,FALSE,FALSE,FALSE,FALSE,FALSE,FALSE,TRUE,FALSE,-80,0,0.00669285092428486,0.00669285092428486,"","injury_eye_context|injury_stoppage"
"UFC Bantamweight Title Fight:
Merab Dvalishvili (135) vs. Cory Sandhagen (134.5)","Dvalishvili drops down in pursuit of a single, and when Sandhagen defends the first try, the Georgian switches to a body lock and a trip.",12,FALSE,FALSE,FALSE,FALSE,FALSE,NA,NA,FALSE,FALSE,TRUE,FALSE,FALSE,FALSE,FALSE,FALSE,FALSE,FALSE,"Round 1",FALSE,FALSE,FALSE,FALSE,FALSE,FALSE,FALSE,FALSE,FALSE,FALSE,FALSE,FALSE,FALSE,FALSE,FALSE,FALSE,FALSE,FALSE,FALSE,FALSE,FALSE,FALSE,FALSE,FALSE,FALSE,FALSE,FALSE,FALSE,FALSE,0,0,0.00669285092428486,0.00669285092428486,"",""
"UFC Bantamweight Title Fight:
Merab Dvalishvili (135) vs. Cory Sandhagen (134.5)","Dvalishvili muscles the challenger around but cannot get Sandhagen down on repeated attempts.",13,FALSE,FALSE,FALSE,FALSE,FALSE,NA,NA,FALSE,FALSE,TRUE,FALSE,FALSE,FALSE,FALSE,FALSE,FALSE,FALSE,"Round 1",FALSE,FALSE,FALSE,FALSE,FALSE,FALSE,FALSE,FALSE,FALSE,FALSE,FALSE,FALSE,FALSE,FALSE,FALSE,FALSE,FALSE,FALSE,FALSE,FALSE,FALSE,FALSE,FALSE,FALSE,FALSE,FALSE,FALSE,FALSE,FALSE,0,0,0.00669285092428486,0.00669285092428486,"",""
"UFC Bantamweight Title Fight:
Merab Dvalishvili (135) vs. Cory Sandhagen (134.5)","Sandhagen plants knees to the body while Dvalishvili is attacking a takedown, and Dvalishvili gets Sandhagen down.",14,FALSE,FALSE,FALSE,FALSE,FALSE,NA,NA,FALSE,FALSE,TRUE,FALSE,FALSE,FALSE,FALSE,FALSE,FALSE,FALSE,"Round 1",FALSE,FALSE,FALSE,FALSE,FALSE,FALSE,FALSE,FALSE,FALSE,FALSE,FALSE,FALSE,FALSE,FALSE,FALSE,FALSE,FALSE,FALSE,FALSE,FALSE,FALSE,FALSE,FALSE,FALSE,FALSE,FALSE,FALSE,FALSE,FALSE,0,0,0.00669285092428486,0.00669285092428486,"",""
"UFC Bantamweight Title Fight:
Merab Dvalishvili (135) vs. Cory Sandhagen (134.5)","The challenger does not seem concerned, as he posts off and stands up without taking much damage going up or down.",15,FALSE,FALSE,FALSE,FALSE,FALSE,NA,NA,FALSE,FALSE,TRUE,FALSE,FALSE,FALSE,FALSE,FALSE,FALSE,FALSE,"Round 1",FALSE,FALSE,FALSE,FALSE,FALSE,FALSE,FALSE,FALSE,FALSE,FALSE,FALSE,FALSE,FALSE,FALSE,FALSE,FALSE,FALSE,FALSE,FALSE,FALSE,FALSE,FALSE,FALSE,FALSE,FALSE,FALSE,FALSE,FALSE,FALSE,0,0,0.00669285092428486,0.00669285092428486,"",""
"UFC Bantamweight Title Fight:
Merab Dvalishvili (135) vs. Cory Sandhagen (134.5)","Sandhagen backs Dvalishvili up and lines up a straight right hand down the pipe, and he chains a few punches into a low kick.",16,FALSE,FALSE,FALSE,FALSE,FALSE,NA,NA,FALSE,FALSE,TRUE,FALSE,FALSE,FALSE,FALSE,FALSE,FALSE,FALSE,"Round 1",FALSE,FALSE,FALSE,FALSE,FALSE,FALSE,FALSE,FALSE,FALSE,FALSE,FALSE,FALSE,FALSE,FALSE,FALSE,FALSE,FALSE,FALSE,FALSE,FALSE,FALSE,FALSE,FALSE,FALSE,FALSE,FALSE,FALSE,FALSE,FALSE,0,0,0.00669285092428486,0.00669285092428486,"",""
"UFC Bantamweight Title Fight:
Merab Dvalishvili (135) vs. Cory Sandhagen (134.5)","Sandhagen scores and evades the counter, keeping to his preferred range at the tail end of a right hand.",17,FALSE,FALSE,FALSE,FALSE,FALSE,NA,NA,TRUE,FALSE,TRUE,FALSE,FALSE,FALSE,FALSE,FALSE,FALSE,FALSE,"Round 1",FALSE,FALSE,FALSE,FALSE,FALSE,FALSE,FALSE,FALSE,FALSE,FALSE,FALSE,FALSE,FALSE,FALSE,FALSE,FALSE,FALSE,FALSE,FALSE,FALSE,FALSE,FALSE,FALSE,FALSE,FALSE,FALSE,FALSE,FALSE,FALSE,0,0,0.00669285092428486,0.00669285092428486,"",""
"UFC Bantamweight Title Fight:
Merab Dvalishvili (135) vs. Cory Sandhagen (134.5)","Dvalishvili tries to bite down on the mouthpiece and trade, but he quickly transitions to a clinch and body lock.",18,FALSE,FALSE,FALSE,FALSE,FALSE,NA,NA,FALSE,FALSE,TRUE,FALSE,FALSE,TRUE,FALSE,FALSE,FALSE,FALSE,"Round 1",FALSE,FALSE,FALSE,FALSE,FALSE,FALSE,FALSE,FALSE,FALSE,FALSE,FALSE,FALSE,FALSE,FALSE,FALSE,FALSE,FALSE,FALSE,FALSE,FALSE,FALSE,FALSE,FALSE,FALSE,FALSE,FALSE,FALSE,FALSE,FALSE,0,0,0.00669285092428486,0.00669285092428486,"",""
"UFC Bantamweight Title Fight:
Merab Dvalishvili (135) vs. Cory Sandhagen (134.5)","Three left hands from Dvalishvili get in before he has to break off, and Dvalishvili stalks him down but eats a jab and part of a step-in knee.",19,FALSE,FALSE,FALSE,FALSE,FALSE,NA,NA,FALSE,FALSE,TRUE,FALSE,FALSE,FALSE,FALSE,FALSE,FALSE,FALSE,"Round 1",FALSE,FALSE,FALSE,FALSE,FALSE,FALSE,FALSE,FALSE,FALSE,FALSE,FALSE,FALSE,FALSE,FALSE,FALSE,FALSE,FALSE,FALSE,FALSE,FALSE,FALSE,FALSE,FALSE,FALSE,FALSE,FALSE,FALSE,FALSE,FALSE,0,0,0.00669285092428486,0.00669285092428486,"",""
"UFC Bantamweight Title Fight:
Merab Dvalishvili (135) vs. Cory Sandhagen (134.5)","Sandhagen sticks and moves, skirting away from everything but a reaching left.",20,FALSE,FALSE,FALSE,FALSE,FALSE,NA,NA,FALSE,FALSE,TRUE,FALSE,FALSE,FALSE,FALSE,FALSE,FALSE,FALSE,"Round 1",FALSE,FALSE,FALSE,FALSE,FALSE,FALSE,FALSE,FALSE,FALSE,FALSE,FALSE,FALSE,FALSE,FALSE,FALSE,FALSE,FALSE,FALSE,FALSE,FALSE,FALSE,FALSE,FALSE,FALSE,FALSE,FALSE,FALSE,FALSE,FALSE,0,0,0.00669285092428486,0.00669285092428486,"",""
"UFC Bantamweight Title Fight:
Merab Dvalishvili (135) vs. Cory Sandhagen (134.5)","Sandhagen strings together combos until the horn sounds.",21,FALSE,FALSE,FALSE,FALSE,FALSE,NA,NA,FALSE,FALSE,TRUE,FALSE,FALSE,FALSE,FALSE,FALSE,FALSE,FALSE,"Round 1",FALSE,FALSE,FALSE,FALSE,FALSE,FALSE,FALSE,FALSE,FALSE,FALSE,FALSE,FALSE,FALSE,FALSE,FALSE,FALSE,FALSE,FALSE,FALSE,FALSE,FALSE,FALSE,FALSE,FALSE,FALSE,FALSE,FALSE,FALSE,FALSE,0,0,0.00669285092428486,0.00669285092428486,"",""
"UFC Bantamweight Title Fight:
Merab Dvalishvili (135) vs. Cory Sandhagen (134.5)","Sherdog Scores Jay Pettry scores the round: 10-9 Sandhagen Dayne Fox scores the round: 10-9 Sandhagen Scottie Smith scores the round: 10-9 Dvalishvili Round 2 To start off the round, Dvalishvili loops in a pair of short hooks, opening a cut on the side of the bridge of Sandhagen's nose.",22,FALSE,FALSE,FALSE,FALSE,FALSE,NA,"Round 2",FALSE,FALSE,TRUE,FALSE,FALSE,FALSE,FALSE,FALSE,FALSE,FALSE,"Round 2",FALSE,FALSE,FALSE,FALSE,FALSE,FALSE,FALSE,FALSE,FALSE,FALSE,FALSE,FALSE,FALSE,FALSE,TRUE,FALSE,FALSE,FALSE,FALSE,FALSE,FALSE,FALSE,FALSE,FALSE,FALSE,FALSE,FALSE,TRUE,FALSE,-80,0,0.00669285092428486,0.00669285092428486,"","injury_eye_context|injury_stoppage"
"UFC Bantamweight Title Fight:
Merab Dvalishvili (135) vs. Cory Sandhagen (134.5)","Dvalishvili surges his way into a takedown shot, and he lifts Sandhagen's leg up in the air but cannot put him down.",23,FALSE,FALSE,FALSE,FALSE,FALSE,NA,NA,FALSE,FALSE,TRUE,FALSE,FALSE,FALSE,FALSE,FALSE,FALSE,FALSE,"Round 2",FALSE,FALSE,FALSE,FALSE,FALSE,FALSE,FALSE,FALSE,FALSE,FALSE,FALSE,FALSE,FALSE,FALSE,FALSE,FALSE,FALSE,FALSE,FALSE,FALSE,FALSE,FALSE,FALSE,FALSE,FALSE,FALSE,FALSE,FALSE,FALSE,0,0,0.00669285092428486,0.00669285092428486,"",""
"UFC Bantamweight Title Fight:
Merab Dvalishvili (135) vs. Cory Sandhagen (134.5)","The frame of Sandhagen keeps him a gangly mess of limbs and fists, and Dvalishvili drags him down for a moment.",24,FALSE,FALSE,FALSE,FALSE,FALSE,NA,NA,FALSE,FALSE,TRUE,FALSE,FALSE,FALSE,FALSE,FALSE,FALSE,FALSE,"Round 2",FALSE,FALSE,FALSE,FALSE,FALSE,FALSE,FALSE,FALSE,FALSE,FALSE,FALSE,FALSE,FALSE,FALSE,FALSE,FALSE,FALSE,FALSE,FALSE,FALSE,FALSE,FALSE,FALSE,FALSE,FALSE,FALSE,FALSE,FALSE,FALSE,0,0,0.00669285092428486,0.00669285092428486,"",""
"UFC Bantamweight Title Fight:
Merab Dvalishvili (135) vs. Cory Sandhagen (134.5)","Sandhagen forces his way up and out, and he works the body and pitches a kick up high.",25,FALSE,FALSE,FALSE,FALSE,FALSE,NA,NA,FALSE,FALSE,TRUE,FALSE,FALSE,FALSE,FALSE,FALSE,FALSE,FALSE,"Round 2",FALSE,FALSE,FALSE,FALSE,FALSE,FALSE,FALSE,FALSE,FALSE,FALSE,FALSE,FALSE,FALSE,FALSE,FALSE,FALSE,FALSE,FALSE,FALSE,FALSE,FALSE,FALSE,FALSE,FALSE,FALSE,FALSE,FALSE,FALSE,FALSE,0,0,0.00669285092428486,0.00669285092428486,"",""
