"bout","sid","sentence","has_foul_raw","has_foul","rule_score","rule_conf","rule_reasons_pos","rule_reasons_neg","time_str","round_mentioned","event"
"Chang Ho Lee (136) vs. Cortavious Romious (139.5: Missed Weight)",6,"Romious offers an apologetic glove touch with a nod, and Lee takes it with the spirit in which it was given.",FALSE,FALSE,0,0.00669285092428486,"","",NA,"Round 1","UFCvegas-105-emmett-murphy-05-04-2025"
"Chang Ho Lee (136) vs. Cortavious Romious (139.5: Missed Weight)",7,"It takes mere seconds for the two to suddenly catch fire and start swinging everything at one another.",FALSE,FALSE,0,0.00669285092428486,"","",NA,"Round 1","UFCvegas-105-emmett-murphy-05-04-2025"
"Chang Ho Lee (136) vs. Cortavious Romious (139.5: Missed Weight)",8,"The two buzz one another like spinning Beyblades, zooming wild offense at one another until Lee eats something he doesn't like and shoots for a double.",FALSE,FALSE,0,0.00669285092428486,"","",NA,"Round 1","UFCvegas-105-emmett-murphy-05-04-2025"
"Chang Ho Lee (136) vs. Cortavious Romious (139.5: Missed Weight)",9,"Romious backs himself to the wall to keep himself upright, and Lee sweeps him off his feet and lands directly in mount.",FALSE,FALSE,0,0.00669285092428486,"","",NA,"Round 1","UFCvegas-105-emmett-murphy-05-04-2025"
"Chang Ho Lee (136) vs. Cortavious Romious (139.5: Missed Weight)",10,"Romious scrambles furiously to stand up and get hold of a 50-50 position, ultimately driving through the hips to dump Lee on his back.",FALSE,FALSE,0,0.00669285092428486,"","",NA,"Round 1","UFCvegas-105-emmett-murphy-05-04-2025"
"Chang Ho Lee (136) vs. Cortavious Romious (139.5: Missed Weight)",11,"Romious keeps the half guard for no more than a second until Lee turns to his knees.",FALSE,FALSE,0,0.00669285092428486,"","",NA,"Round 1","UFCvegas-105-emmett-murphy-05-04-2025"
"Chang Ho Lee (136) vs. Cortavious Romious (139.5: Missed Weight)",12,"Romious tries to jump on his back, and he slides out the back door as Lee takes his back and wraps the body triangle around the waist.",FALSE,FALSE,0,0.00669285092428486,"","",NA,"Round 1","UFCvegas-105-emmett-murphy-05-04-2025"
"Chang Ho Lee (136) vs. Cortavious Romious (139.5: Missed Weight)",13,"Lee's strikes have opened a cut on the forehead of Romious, softening him up with the punches on either side of the head to wrap up a rear-naked choke.",FALSE,FALSE,0,0.00669285092428486,"","injury_eye_context|injury_stoppage",NA,"Round 1","UFCvegas-105-emmett-murphy-05-04-2025"
"Chang Ho Lee (136) vs. Cortavious Romious (139.5: Missed Weight)",14,"Romious turns to try to explode out of the position, twisting from one side to the other but not splitting the legs wrapped around his midsection.",FALSE,FALSE,0,0.00669285092428486,"","",NA,"Round 1","UFCvegas-105-emmett-murphy-05-04-2025"
"Chang Ho Lee (136) vs. Cortavious Romious (139.5: Missed Weight)",15,"Lee fastens the rear-naked choke on the jaw, and when Romious scrambles and turns over, Lee wraps the choke up right beneath the chin.",FALSE,FALSE,0,0.00669285092428486,"","",NA,"Round 1","UFCvegas-105-emmett-murphy-05-04-2025"
"Chang Ho Lee (136) vs. Cortavious Romious (139.5: Missed Weight)",16,"Blood sprays from the cut on his forehead, and he uses complete force of will to twist around and turn Lee to his back.",FALSE,FALSE,0,0.00669285092428486,"","injury_eye_context|injury_stoppage",NA,"Round 1","UFCvegas-105-emmett-murphy-05-04-2025"
"Chang Ho Lee (136) vs. Cortavious Romious (139.5: Missed Weight)",17,"Lee turns the corner to put Romious on his back as the horn sounds.",FALSE,FALSE,0,0.00669285092428486,"","",NA,"Round 1","UFCvegas-105-emmett-murphy-05-04-2025"
"Chang Ho Lee (136) vs. Cortavious Romious (139.5: Missed Weight)",18,"Sherdog Scores Jay Pettry scores the round: 10-9 Lee Scottie Smith scores the round: 10-9 Lee Tristen Critchfield scores the round: 10-9 Lee Round 2 The fighters high-five to get going again, and Romious lets loose with a stiff low kick.",FALSE,FALSE,0,0.00669285092428486,"","",NA,"Round 2","UFCvegas-105-emmett-murphy-05-04-2025"
"Chang Ho Lee (136) vs. Cortavious Romious (139.5: Missed Weight)",19,"Lee jumps at him, and his knee loudly bangs into the cup.",TRUE,TRUE,100,0.993307149075715,"strong_anchor|foul_language|foul_re_hit","",NA,"Round 2","UFCvegas-105-emmett-murphy-05-04-2025"
"Chang Ho Lee (136) vs. Cortavious Romious (139.5: Missed Weight)",20,"As soon as Lee lands, Tognoni calls time to give Romious all the time he needs to recover.",FALSE,FALSE,0,0.00669285092428486,"","",NA,"Round 2","UFCvegas-105-emmett-murphy-05-04-2025"
"Chang Ho Lee (136) vs. Cortavious Romious (139.5: Missed Weight)",21,"Lee sits down to recover his wind, and Tognoni brings in the interpreter to issue a warning for the foul.",FALSE,FALSE,0,0.00669285092428486,"","",NA,"Round 2","UFCvegas-105-emmett-murphy-05-04-2025"
"Chang Ho Lee (136) vs. Cortavious Romious (139.5: Missed Weight)",22,"In the meantime, Romious stands up, and he tells Tognoni, ""Let's Get It"" as he asks for the restart after 90 seconds.",FALSE,FALSE,0,0.00669285092428486,"","",NA,"Round 2","UFCvegas-105-emmett-murphy-05-04-2025"
"Chang Ho Lee (136) vs. Cortavious Romious (139.5: Missed Weight)",23,"Both men blast each other with looping strikes, with Romious getting the best of an exchange courtesy of a powerful head kick.",FALSE,FALSE,0,0.00669285092428486,"","",NA,"Round 2","UFCvegas-105-emmett-murphy-05-04-2025"
"Chang Ho Lee (136) vs. Cortavious Romious (139.5: Missed Weight)",24,"Lee shoots for a takedown, and Romious shifts around to take the back and pursues an armbar.",FALSE,FALSE,0,0.00669285092428486,"","",NA,"Round 2","UFCvegas-105-emmett-murphy-05-04-2025"
"Chang Ho Lee (136) vs. Cortavious Romious (139.5: Missed Weight)",25,"Lee lets him slide off so he can relocate himself into half guard, slugging his opponent with his free right hand and elbow.",FALSE,FALSE,0,0.00669285092428486,"","",NA,"Round 2","UFCvegas-105-emmett-murphy-05-04-2025"
"Chang Ho Lee (136) vs. Cortavious Romious (139.5: Missed Weight)",26,"Romious pulls his toes in the chain links to reposition himself, prompting Tognoni to tell him that he can't do that.",TRUE,TRUE,100,0.993307149075715,"strong_anchor|foul_language|foul_re_hit","",NA,"Round 2","UFCvegas-105-emmett-murphy-05-04-2025"
"Chang Ho Lee (136) vs. Cortavious Romious (139.5: Missed Weight)",27,"Lee smothers his man and unloads with a few punches that further bloody Romious up, and Romious decides now is as good of a time as any to stand up and does just that.",FALSE,FALSE,0,0.00669285092428486,"","injury_eye_context|injury_stoppage",NA,"Round 2","UFCvegas-105-emmett-murphy-05-04-2025"
"Chang Ho Lee (136) vs. Cortavious Romious (139.5: Missed Weight)",28,"Lee tries to drag him back down, and Romious follows him on the way down to grip hold at the tail end of an armbar.",FALSE,FALSE,0,0.00669285092428486,"","",NA,"Round 2","UFCvegas-105-emmett-murphy-05-04-2025"
"Chang Ho Lee (136) vs. Cortavious Romious (139.5: Missed Weight)",29,"Romious grips the wrists to try to lock down the maneuver, but he cannot place it between his knees for leverage so he bails on it and rolls over.",FALSE,FALSE,0,0.00669285092428486,"","",NA,"Round 2","UFCvegas-105-emmett-murphy-05-04-2025"
"Chang Ho Lee (136) vs. Cortavious Romious (139.5: Missed Weight)",30,"Lee promptly takes his back, where he flattens out the Missouri native and batters him with left hands and elbows.Romious shells up, taking shots from both sides, and chants for Lee boom every time he lands a strike.",FALSE,FALSE,0,0.00669285092428486,"","",NA,"Round 2","UFCvegas-105-emmett-murphy-05-04-2025"
"Chang Ho Lee (136) vs. Cortavious Romious (139.5: Missed Weight)",31,"Lee pours it on, smashing Romious with relentless ground-and-pound and causing more blood to flow.",FALSE,FALSE,0,0.00669285092428486,"","injury_eye_context|injury_stoppage",NA,"Round 2","UFCvegas-105-emmett-murphy-05-04-2025"
"Chang Ho Lee (136) vs. Cortavious Romious (139.5: Missed Weight)",32,"As Lee lays a beating on Romious, Tognoni gets between them to save Romious from any further punishment.This is a statement win for the South Korean, who is now on the board in the Octagon with a win in a non-Road to UFC bout.",FALSE,FALSE,0,0.00669285092428486,"","",NA,"Round 2","UFCvegas-105-emmett-murphy-05-04-2025"
"Chang Ho Lee (136) vs. Cortavious Romious (139.5: Missed Weight)",33,"The Official Result Chang Ho Lee def.",FALSE,FALSE,0,0.00669285092428486,"","",NA,"Round 2","UFCvegas-105-emmett-murphy-05-04-2025"
"Chang Ho Lee (136) vs. Cortavious Romious (139.5: Missed Weight)",34,"Cortavious Romious R2 3:48 via TKO (Punches and Elbows)",FALSE,FALSE,0,0.00669285092428486,"","","3:48","Round 2","UFCvegas-105-emmett-murphy-05-04-2025"
"Joanderson Brito (146) vs. Pat Sabatini (145.5)",1,"Joanderson Brito (146) vs.",FALSE,FALSE,0,0.00669285092428486,"","gate_not_started",NA,NA,"UFCvegas-105-emmett-murphy-05-04-2025"
"Joanderson Brito (146) vs. Pat Sabatini (145.5)",2,"Pat Sabatini (145.5) BETTING PREVIEW | SCOUTING REPORT | ODDS: Brito (-205), Sabatini (+170) Round 1 It is a grappler against a wild man in the co-main event, one where the winner might potentially have a number next to their name on Monday.",FALSE,FALSE,0,0.00669285092428486,"","gate_not_started",NA,"Round 1","UFCvegas-105-emmett-murphy-05-04-2025"
"Joanderson Brito (146) vs. Pat Sabatini (145.5)",3,"Philly-based grappler Sabatini (19-5, 6-2 UFC) will present danger for as long as the bout is on the mat, but every fight starts on the feet.",FALSE,FALSE,0,0.00669285092428486,"","gate_not_started",NA,"Round 1","UFCvegas-105-emmett-murphy-05-04-2025"
"Joanderson Brito (146) vs. Pat Sabatini (145.5)",4,"Brito (17-4-1, 5-2 UFC) is no slouch when grappling, so fun exchanges could come early and often.",FALSE,FALSE,0,0.00669285092428486,"","gate_not_started",NA,"Round 1","UFCvegas-105-emmett-murphy-05-04-2025"
"Joanderson Brito (146) vs. Pat Sabatini (145.5)",5,"Referee Keith Peterson will have his hands full with these featherweights, although he is able to take a breath as the fighters look to collide with no nonsense in the building.",FALSE,FALSE,0,0.00669285092428486,"","",NA,"Round 1","UFCvegas-105-emmett-murphy-05-04-2025"
"Joanderson Brito (146) vs. Pat Sabatini (145.5)",6,"Fists are bumped before they are traded, and Brito gest right to walking the American down.",FALSE,FALSE,0,0.00669285092428486,"","",NA,"Round 1","UFCvegas-105-emmett-murphy-05-04-2025"
"Joanderson Brito (146) vs. Pat Sabatini (145.5)",7,"Sabatini springs from side to side, tossing out one kick and having Brito respond with a kick.",FALSE,FALSE,0,0.00669285092428486,"","",NA,"Round 1","UFCvegas-105-emmett-murphy-05-04-2025"
"Joanderson Brito (146) vs. Pat Sabatini (145.5)",8,"Sabatini follows the Brazilian's kick with a single, which he uses to deposit Brito on the canvas easily.",FALSE,FALSE,0,0.00669285092428486,"","",NA,"Round 1","UFCvegas-105-emmett-murphy-05-04-2025"
"Joanderson Brito (146) vs. Pat Sabatini (145.5)",9,"Brito defends with the guillotine off his back, opening himself up to Von Preux choke danger as Sabatini traps him with an arm-triangle at the same time.",FALSE,FALSE,0,0.00669285092428486,"","",NA,"Round 1","UFCvegas-105-emmett-murphy-05-04-2025"
"Joanderson Brito (146) vs. Pat Sabatini (145.5)",10,"Brito scoots his way to the wall to take a bit of pressure off of him, and he follows the moving legs of his opponent to maintain half guard or guard.",FALSE,FALSE,0,0.00669285092428486,"","",NA,"Round 1","UFCvegas-105-emmett-murphy-05-04-2025"
"Joanderson Brito (146) vs. Pat Sabatini (145.5)",11,"Sabatini tries again for the Von Flue, and he pulls his own head out of Brito's sub.",FALSE,FALSE,0,0.00669285092428486,"","",NA,"Round 1","UFCvegas-105-emmett-murphy-05-04-2025"
"Joanderson Brito (146) vs. Pat Sabatini (145.5)",12,"Sabatini stays flat on his man, squeezing down with an arm-triangle setup while Brito smacks him with short but frustrating strikes off his back.",FALSE,FALSE,0,0.00669285092428486,"","",NA,"Round 1","UFCvegas-105-emmett-murphy-05-04-2025"
"Joanderson Brito (146) vs. Pat Sabatini (145.5)",13,"Sabatini gets off the heavier of the blows while above, but Brito still manages to put his back on the wire.",FALSE,FALSE,0,0.00669285092428486,"","",NA,"Round 1","UFCvegas-105-emmett-murphy-05-04-2025"
"Joanderson Brito (146) vs. Pat Sabatini (145.5)",14,"Sabatini pulls him away from the fence, and Brito sits to stand while Sabatini threatening with a guillotine choke.",FALSE,FALSE,20,0.0474258731775668,"strong_anchor","",NA,"Round 1","UFCvegas-105-emmett-murphy-05-04-2025"
"Joanderson Brito (146) vs. Pat Sabatini (145.5)",15,"Sabatini lands a single knee before letting go of the choke, and he lifts Brito in the air and slams him down to the floor.",FALSE,FALSE,0,0.00669285092428486,"","",NA,"Round 1","UFCvegas-105-emmett-murphy-05-04-2025"
"Joanderson Brito (146) vs. Pat Sabatini (145.5)",16,"With Brito hanging on with the guillotine, the Von Preux counter is troubling him as Sabatini clings to his neck with his left arm.",FALSE,FALSE,0,0.00669285092428486,"","",NA,"Round 1","UFCvegas-105-emmett-murphy-05-04-2025"
"Joanderson Brito (146) vs. Pat Sabatini (145.5)",17,"Sabatini uses his weight to push Brito against the wall and hope for the leverage to be right for a submission.",FALSE,FALSE,0,0.00669285092428486,"","",NA,"Round 1","UFCvegas-105-emmett-murphy-05-04-2025"
"Joanderson Brito (146) vs. Pat Sabatini (145.5)",18,"Brito stays calm and wriggles his neck out of danger, and Sabatini climbs into half guard and assaults him with punches and elbows.",FALSE,FALSE,0,0.00669285092428486,"","",NA,"Round 1","UFCvegas-105-emmett-murphy-05-04-2025"
"Joanderson Brito (146) vs. Pat Sabatini (145.5)",19,"Brito attacks off his back, and again Sabatini's are far more effective.",FALSE,FALSE,0,0.00669285092428486,"","",NA,"Round 1","UFCvegas-105-emmett-murphy-05-04-2025"
"Joanderson Brito (146) vs. Pat Sabatini (145.5)",20,"The one-sided round ends with both men flailing at one another.",FALSE,FALSE,0,0.00669285092428486,"","",NA,"Round 1","UFCvegas-105-emmett-murphy-05-04-2025"
"Joanderson Brito (146) vs. Pat Sabatini (145.5)",21,"Sherdog Scores Jay Pettry scores the round: 10-8 Sabatini Scottie Smith scores the round: 10-9 Sabatini Tristen Critchfield scores the round: 10-9 Sabatini Round 2 Sabatini motions awkwardly to his opponent, offering the glove touch while also wanting to stay far away from the grappler.",FALSE,FALSE,0,0.00669285092428486,"","",NA,"Round 2","UFCvegas-105-emmett-murphy-05-04-2025"
"Joanderson Brito (146) vs. Pat Sabatini (145.5)",22,"Brito kicks, and Sabatini sells out for a takedown.",FALSE,FALSE,0,0.00669285092428486,"","",NA,"Round 2","UFCvegas-105-emmett-murphy-05-04-2025"
"Joanderson Brito (146) vs. Pat Sabatini (145.5)",23,"Brito hits his seat searching for a front choke, and Sabatini laughs it off and pushes Brito to his back.",FALSE,FALSE,0,0.00669285092428486,"","",NA,"Round 2","UFCvegas-105-emmett-murphy-05-04-2025"
"Joanderson Brito (146) vs. Pat Sabatini (145.5)",24,"Sabatini establishes himself on top in half guard, smothering Brito and preventing the expected explosions thanks in part to heavy chest pressure.",FALSE,FALSE,0,0.00669285092428486,"","",NA,"Round 2","UFCvegas-105-emmett-murphy-05-04-2025"
"Joanderson Brito (146) vs. Pat Sabatini (145.5)",25,"Sabatini looks to hook up a crucifix with his knee, and he opens things up to try to pass guard, only for Brito to drag him back.",FALSE,FALSE,0,0.00669285092428486,"","",NA,"Round 2","UFCvegas-105-emmett-murphy-05-04-2025"
"Joanderson Brito (146) vs. Pat Sabatini (145.5)",26,"Sabatini strikes when he finds openings, irritating the dangerous ""Tubarao"" while energy is drained from his tank.",FALSE,FALSE,0,0.00669285092428486,"","",NA,"Round 2","UFCvegas-105-emmett-murphy-05-04-2025"
"Joanderson Brito (146) vs. Pat Sabatini (145.5)",27,"Brito uses butterfly hooks to push off, and Sabatini is so singularly focused on the top control that he is not budging.",FALSE,FALSE,0,0.00669285092428486,"","",NA,"Round 2","UFCvegas-105-emmett-murphy-05-04-2025"
"Joanderson Brito (146) vs. Pat Sabatini (145.5)",28,"Sabatini scores several left hands on the chin, and he times Brito sitting up to flatten him back out in an instant.",FALSE,FALSE,0,0.00669285092428486,"","",NA,"Round 2","UFCvegas-105-emmett-murphy-05-04-2025"
"Joanderson Brito (146) vs. Pat Sabatini (145.5)",29,"The Brazilian is out of ideas, with Sabatini two steps ahead of him at every turn.",FALSE,FALSE,0,0.00669285092428486,"","",NA,"Round 2","UFCvegas-105-emmett-murphy-05-04-2025"
"Joanderson Brito (146) vs. Pat Sabatini (145.5)",30,"Sabatini renders his foe fairly powerless until the round concludes.",FALSE,FALSE,0,0.00669285092428486,"","",NA,"Round 2","UFCvegas-105-emmett-murphy-05-04-2025"
"Joanderson Brito (146) vs. Pat Sabatini (145.5)",31,"Sherdog Scores Jay Pettry scores the round: 10-9 Sabatini Scottie Smith scores the round: 10-9 Sabatini Tristen Critchfield scores the round: 10-9 Sabatini Round 3 Brito jogs out of his corner to touch gloves, and he dodges a spin strike to come up top with a huge right hand.",FALSE,FALSE,0,0.00669285092428486,"","",NA,"Round 3","UFCvegas-105-emmett-murphy-05-04-2025"
"Joanderson Brito (146) vs. Pat Sabatini (145.5)",32,"Sabatini rolls with the punch and switches stances to work his way forward.",FALSE,FALSE,0,0.00669285092428486,"","",NA,"Round 3","UFCvegas-105-emmett-murphy-05-04-2025"
"Joanderson Brito (146) vs. Pat Sabatini (145.5)",33,"Brito absorbs a spinning back fist to swing back a right hand, and he jumps guard with a guillotine choke when Sabatini shoots in for a single.",FALSE,FALSE,0,0.00669285092428486,"","",NA,"Round 3","UFCvegas-105-emmett-murphy-05-04-2025"
"Joanderson Brito (146) vs. Pat Sabatini (145.5)",34,"Sabatini issues the thumbs-up a few times as the submission is not under his chin, and he threatens with another Von Preux until Brito releases the grip.",FALSE,FALSE,0,0.00669285092428486,"","",NA,"Round 3","UFCvegas-105-emmett-murphy-05-04-2025"
"Joanderson Brito (146) vs. Pat Sabatini (145.5)",35,"Sabatini resides in the half guard, where he has spent most of this fight, and he bludgeons Brito every so often.",FALSE,FALSE,0,0.00669285092428486,"","",NA,"Round 3","UFCvegas-105-emmett-murphy-05-04-2025"
"Joanderson Brito (146) vs. Pat Sabatini (145.5)",36,"When Brito goes for broke swinging with his back stuck on the floor, Sabatini postures up to drill him with some ground-and-pound.",FALSE,FALSE,0,0.00669285092428486,"","",NA,"Round 3","UFCvegas-105-emmett-murphy-05-04-2025"
"Joanderson Brito (146) vs. Pat Sabatini (145.5)",37,"The smothering continues for the Renzo Gracie Philly fighter, displaying that there are levels to this grappling thing.",FALSE,FALSE,0,0.00669285092428486,"","",NA,"Round 3","UFCvegas-105-emmett-murphy-05-04-2025"
"Joanderson Brito (146) vs. Pat Sabatini (145.5)",38,"Brito, a savvy submission artist in his own right, has been blanked tonight, with a ceiling that is very clear above him.",FALSE,FALSE,0,0.00669285092428486,"","",NA,"Round 3","UFCvegas-105-emmett-murphy-05-04-2025"
"Joanderson Brito (146) vs. Pat Sabatini (145.5)",39,"Sabatini circles around to take Brito's back, getting his hooks in, and he starts hunting for a kneebar.",FALSE,FALSE,0,0.00669285092428486,"","",NA,"Round 3","UFCvegas-105-emmett-murphy-05-04-2025"
"Joanderson Brito (146) vs. Pat Sabatini (145.5)",40,"When Brito turns over, he gives up mount, and Sabatini starts whaling on him.",FALSE,FALSE,0,0.00669285092428486,"","",NA,"Round 3","UFCvegas-105-emmett-murphy-05-04-2025"
"Joanderson Brito (146) vs. Pat Sabatini (145.5)",41,"Brito gets to a knee despite taking strikes on the sides of the head, and Sabatini takes any remaining hope and deposits it in the local trash can with dominant control and grappling wizardry.",FALSE,FALSE,0,0.00669285092428486,"","",NA,"Round 3","UFCvegas-105-emmett-murphy-05-04-2025"
"Joanderson Brito (146) vs. Pat Sabatini (145.5)",42,"It might not have been the most scintillating to watch, but Sabatini sends a message that the fearsome marauder Brito has met his match.",FALSE,FALSE,0,0.00669285092428486,"","",NA,"Round 3","UFCvegas-105-emmett-murphy-05-04-2025"
"Joanderson Brito (146) vs. Pat Sabatini (145.5)",43,"Sherdog Scores Jay Pettry scores the round: 10-8 Sabatini (30-25 Sabatini) Scottie Smith scores the round: 10-8 Sabatini (30-26 Sabatini) Tristen Critchfield scores the round: 10-8 Sabatini (30-26 Sabatini) The Official Result Pat Sabatini def.",FALSE,FALSE,0,0.00669285092428486,"","",NA,"Round 3","UFCvegas-105-emmett-murphy-05-04-2025"
"Joanderson Brito (146) vs. Pat Sabatini (145.5)",44,"Joanderson Brito via Unanimous Decision (30-26, 30-26, 30-27)",FALSE,FALSE,0,0.00669285092428486,"","",NA,"Round 3","UFCvegas-105-emmett-murphy-05-04-2025"
"Josh Emmett (146) vs. Lerone Murphy (145.5)",1,"Josh Emmett (146) vs.",FALSE,FALSE,0,0.00669285092428486,"","gate_not_started",NA,NA,"UFCvegas-105-emmett-murphy-05-04-2025"
"Josh Emmett (146) vs. Lerone Murphy (145.5)",2,"Lerone Murphy (145.5) BETTING PREVIEW | SCOUTING REPORT | ODDS: Murphy (-325), Emmett (+260) Round 1 A championship opportunity could avail itself to the victorious man in the next 25 minutes or less.",FALSE,FALSE,0,0.00669285092428486,"","gate_not_started",NA,"Round 1","UFCvegas-105-emmett-murphy-05-04-2025"
"Josh Emmett (146) vs. Lerone Murphy (145.5)",3,"At the age of 40, Emmett (19-4, 10-4 UFC) is likely on his last path towards gold, and the younger Murphy (15-0-1, 7-0-1 UFC) knows this and has several intangibles and advantages on his side.",FALSE,FALSE,0,0.00669285092428486,"","gate_not_started",NA,"Round 1","UFCvegas-105-emmett-murphy-05-04-2025"
"Josh Emmett (146) vs. Lerone Murphy (145.5)",4,"He just has to make sure not to get his jaw jacked.",FALSE,FALSE,0,0.00669285092428486,"","gate_not_started",NA,"Round 1","UFCvegas-105-emmett-murphy-05-04-2025"
"Josh Emmett (146) vs. Lerone Murphy (145.5)",5,"The main event will be officiated by referee Jason Herzog, who brings the two featherweight contenders to the middle of the Octagon to issue final instructions.",FALSE,FALSE,0,0.00669285092428486,"","",NA,"Round 1","UFCvegas-105-emmett-murphy-05-04-2025"
"Josh Emmett (146) vs. Lerone Murphy (145.5)",6,"The fists are bumped, and with all systems go, it's on with the show.",FALSE,FALSE,0,0.00669285092428486,"","",NA,"Round 1","UFCvegas-105-emmett-murphy-05-04-2025"
"Josh Emmett (146) vs. Lerone Murphy (145.5)",7,"They bob in and out towards and away from one another, not committing to much for the first 30 seconds.",FALSE,FALSE,0,0.00669285092428486,"","",NA,"Round 1","UFCvegas-105-emmett-murphy-05-04-2025"
"Josh Emmett (146) vs. Lerone Murphy (145.5)",8,"Emmett walks down the unbeaten man and looses a right hand, but it is out of range so he tries again.",FALSE,FALSE,0,0.00669285092428486,"","",NA,"Round 1","UFCvegas-105-emmett-murphy-05-04-2025"
"Josh Emmett (146) vs. Lerone Murphy (145.5)",9,"A second scores, and a third reaches the body.",FALSE,FALSE,0,0.00669285092428486,"","",NA,"Round 1","UFCvegas-105-emmett-murphy-05-04-2025"
"Josh Emmett (146) vs. Lerone Murphy (145.5)",10,"Murphy sticks him and moves, staying constantly shifting and not stopping until he gets cut off.",FALSE,FALSE,0,0.00669285092428486,"","injury_eye_context|injury_stoppage",NA,"Round 1","UFCvegas-105-emmett-murphy-05-04-2025"
"Josh Emmett (146) vs. Lerone Murphy (145.5)",11,"Emmett lets his hands go, and Murphy slashes back with an elbow that opens a cut on the top of Emmett's dome.",FALSE,FALSE,0,0.00669285092428486,"","injury_eye_context|injury_stoppage",NA,"Round 1","UFCvegas-105-emmett-murphy-05-04-2025"
"Josh Emmett (146) vs. Lerone Murphy (145.5)",12,"Murphy backs off to measure a head kick, and Emmett shrugs at him and watches a right hand zoom past him.",FALSE,FALSE,0,0.00669285092428486,"","",NA,"Round 1","UFCvegas-105-emmett-murphy-05-04-2025"
"Josh Emmett (146) vs. Lerone Murphy (145.5)",13,"Blood leaks from the cut on the top of his head into his eye, an inopportune position, but he does not appear compromised with it yet.",FALSE,FALSE,0,0.00669285092428486,"strong_anchor","injury_eye_context|injury_stoppage",NA,"Round 1","UFCvegas-105-emmett-murphy-05-04-2025"
"Josh Emmett (146) vs. Lerone Murphy (145.5)",14,"Murphy pitches a front kick at him, and he sways back as Emmett nearly reaches him with his big right.",FALSE,FALSE,0,0.00669285092428486,"","",NA,"Round 1","UFCvegas-105-emmett-murphy-05-04-2025"
"Josh Emmett (146) vs. Lerone Murphy (145.5)",15,"Emmett swarms forward and is out of range, and Murphy sits down and kicks his front leg.",FALSE,FALSE,0,0.00669285092428486,"","",NA,"Round 1","UFCvegas-105-emmett-murphy-05-04-2025"
"Josh Emmett (146) vs. Lerone Murphy (145.5)",16,"Emmett darts in and out, the punches bouncing off the guard without doing much.",FALSE,FALSE,0,0.00669285092428486,"","",NA,"Round 1","UFCvegas-105-emmett-murphy-05-04-2025"
"Josh Emmett (146) vs. Lerone Murphy (145.5)",17,"""The Iceman"" is cold and calculating, not opening him up to a precarious predicament or leaving something out too long to get popped.",FALSE,FALSE,0,0.00669285092428486,"","",NA,"Round 1","UFCvegas-105-emmett-murphy-05-04-2025"
"Josh Emmett (146) vs. Lerone Murphy (145.5)",18,"Emmett walks him down and kicks him in the front leg, and when he absorbs a punch response, he again shrugs to Murphy.",FALSE,FALSE,0,0.00669285092428486,"","",NA,"Round 1","UFCvegas-105-emmett-murphy-05-04-2025"
"Josh Emmett (146) vs. Lerone Murphy (145.5)",19,"Emmett chains four punches together when Murphy stands still, and he takes a calf kick on his already welted leg.",FALSE,FALSE,0,0.00669285092428486,"","",NA,"Round 1","UFCvegas-105-emmett-murphy-05-04-2025"
