"bout","sid","sentence","has_foul_raw","has_foul","rule_score","rule_conf","rule_reasons_pos","rule_reasons_neg","time_str","round_mentioned","event"
"Mansur Abdul-Malik (186) vs. Cody Brundage (186)",31,"Brundage closes in and drives in a knee, and Abdul-Malik turns the corner and rails his opponent with a flush knee to the sternum and a direct head clash.",FALSE,FALSE,0,0.00669285092428486,"","",NA,"Round 3","UFC-usman-buckley-21-06-2025"
"Mansur Abdul-Malik (186) vs. Cody Brundage (186)",32,"Brundage goes down in a heap, shelling up as Abdul-Malik unloads on him with fiery fists.",FALSE,FALSE,0,0.00669285092428486,"","",NA,"Round 3","UFC-usman-buckley-21-06-2025"
"Mansur Abdul-Malik (186) vs. Cody Brundage (186)",33,"Abdul-Malik swings with bad intentions, and McKeehan gives Brundage every opportunity to recover before waving the fight off.",FALSE,FALSE,0,0.00669285092428486,"","",NA,"Round 3","UFC-usman-buckley-21-06-2025"
"Mansur Abdul-Malik (186) vs. Cody Brundage (186)",34,"Brundage immediately protests that he went down because of the clash of heads and not the knee, and the replay official is called upon to show the clear clash of heads.",FALSE,FALSE,0,0.00669285092428486,"","injury_stoppage",NA,"Round 3","UFC-usman-buckley-21-06-2025"
"Mansur Abdul-Malik (186) vs. Cody Brundage (186)",35,"One of the unluckiest fighters in the sport has yet another bizarre ending in his strange tenure with the UFC, and it is up to McKeehan and the officials to send this one to the scorecards for a technical decision due to the fight-ending headbutt and the bout reaching the third round.",TRUE,TRUE,100,0.993307149075715,"strong_anchor|foul_language|foul_re_hit","",NA,"Round 3","UFC-usman-buckley-21-06-2025"
"Mansur Abdul-Malik (186) vs. Cody Brundage (186)",36,"Sherdog Scores Jay Pettry scores the round: 10-9 Abdul-Malik (29-28 Abdul-Malik) Devin Tejada scores the round: 10-9 Abdul-Malik (29-28 Abdul-Malik) Tristen Critchfield scores the round: 10-9 Abdul-Malik (29-28 Abdul-Malik) The Official Result Mansur Abdul-Malik def.",FALSE,FALSE,0,0.00669285092428486,"","",NA,"Round 3","UFC-usman-buckley-21-06-2025"
"Mansur Abdul-Malik (186) vs. Cody Brundage (186)",37,"Cody Brundage via Technical Decision (Unanimous) R3 0:36",FALSE,FALSE,0,0.00669285092428486,"","","0:36","Round 3","UFC-usman-buckley-21-06-2025"
"Raoni Barcelos (136) vs. Cody Garbrandt (136)",1,"Raoni Barcelos (136) vs.",FALSE,FALSE,0,0.00669285092428486,"","gate_not_started",NA,NA,"UFC-usman-buckley-21-06-2025"
"Raoni Barcelos (136) vs. Cody Garbrandt (136)",2,"Cody Garbrandt (136) BETTING PREVIEW | SCOUTING REPORT | ODDS: Barcelos (-180), Garbrandt (+150) Round 1 Of the three Codys competing tonight, Garbrandt (14-6, 9-6 UFC) is the last one to try to get on the board for his namesake.",FALSE,FALSE,0,0.00669285092428486,"","gate_not_started",NA,"Round 1","UFC-usman-buckley-21-06-2025"
"Raoni Barcelos (136) vs. Cody Garbrandt (136)",3,"The former champ, who celebrates about 80% of his wins by knockout, takes on a man five years his elder but no less dangerous than ever in Barcelos (19-5, 8-4 UFC).",FALSE,FALSE,0,0.00669285092428486,"","gate_not_started",NA,"Round 1","UFC-usman-buckley-21-06-2025"
"Raoni Barcelos (136) vs. Cody Garbrandt (136)",4,"Most notably, the Brazilian derailed the hype train of Payton Talbott in January, firmly ruling out that he was washed up and ready to get tucked into bed.",FALSE,FALSE,0,0.00669285092428486,"","gate_not_started",NA,"Round 1","UFC-usman-buckley-21-06-2025"
"Raoni Barcelos (136) vs. Cody Garbrandt (136)",5,"Referee Mike Beltran draws the assignment to watch over the bantamweights, watching them bump fists together to start the match.",FALSE,FALSE,0,0.00669285092428486,"","",NA,"Round 1","UFC-usman-buckley-21-06-2025"
"Raoni Barcelos (136) vs. Cody Garbrandt (136)",6,"Garbrandt starts fast, rushing forward with four punches and a head kick.",FALSE,FALSE,0,0.00669285092428486,"","",NA,"Round 1","UFC-usman-buckley-21-06-2025"
"Raoni Barcelos (136) vs. Cody Garbrandt (136)",7,"Barcelos bounces off the fence, and Garbrandt surges towards him with a trio of flying fists.",FALSE,FALSE,20,0.0474258731775668,"strong_anchor","",NA,"Round 1","UFC-usman-buckley-21-06-2025"
"Raoni Barcelos (136) vs. Cody Garbrandt (136)",8,"Another combo comes from the former champ, and Barcelos ducks it and tries to take him down.",FALSE,FALSE,0,0.00669285092428486,"","",NA,"Round 1","UFC-usman-buckley-21-06-2025"
"Raoni Barcelos (136) vs. Cody Garbrandt (136)",9,"Garbrandt hops away and resets, already wary of the possible takedown in play.",FALSE,FALSE,0,0.00669285092428486,"","",NA,"Round 1","UFC-usman-buckley-21-06-2025"
"Raoni Barcelos (136) vs. Cody Garbrandt (136)",10,"Garbrandt measures with a single body kick, and he rails Barcelos with three speedy punches.",FALSE,FALSE,0,0.00669285092428486,"","",NA,"Round 1","UFC-usman-buckley-21-06-2025"
"Raoni Barcelos (136) vs. Cody Garbrandt (136)",11,"Barcelos drops to a knee, and Garbrandt points at him.",FALSE,FALSE,0,0.00669285092428486,"","",NA,"Round 1","UFC-usman-buckley-21-06-2025"
"Raoni Barcelos (136) vs. Cody Garbrandt (136)",12,"As Barcelos stands, he goes after a takedown.",FALSE,FALSE,0,0.00669285092428486,"","",NA,"Round 1","UFC-usman-buckley-21-06-2025"
"Raoni Barcelos (136) vs. Cody Garbrandt (136)",13,"Garbrandt ducks away from it, dodges an overhand right and falls to 50/50 when Barcelos looks for a takedown.",FALSE,FALSE,0,0.00669285092428486,"","",NA,"Round 1","UFC-usman-buckley-21-06-2025"
"Raoni Barcelos (136) vs. Cody Garbrandt (136)",14,"When the takedown does not materialize, Barcelos leaps at him and splits open Garbrandt's eyebrow with his knee.",FALSE,FALSE,0,0.00669285092428486,"","",NA,"Round 1","UFC-usman-buckley-21-06-2025"
"Raoni Barcelos (136) vs. Cody Garbrandt (136)",15,"Garbrandt backs away, avoiding a flying switch kick as chants for ""Let's go, Cody"" echo in the building.",FALSE,FALSE,0,0.00669285092428486,"","",NA,"Round 1","UFC-usman-buckley-21-06-2025"
"Raoni Barcelos (136) vs. Cody Garbrandt (136)",16,"Barcelos lands first after they stop calling for the former champ, working the body with a left.",FALSE,FALSE,0,0.00669285092428486,"","",NA,"Round 1","UFC-usman-buckley-21-06-2025"
"Raoni Barcelos (136) vs. Cody Garbrandt (136)",17,"Barcelos has a head kick slap off the raised guard, and he rolls with a right hand over the top.",FALSE,FALSE,0,0.00669285092428486,"","",NA,"Round 1","UFC-usman-buckley-21-06-2025"
"Raoni Barcelos (136) vs. Cody Garbrandt (136)",18,"Garbrandt swings and misses with a pair of punches, and his second effort to the body gets in.",FALSE,FALSE,0,0.00669285092428486,"","",NA,"Round 1","UFC-usman-buckley-21-06-2025"
"Raoni Barcelos (136) vs. Cody Garbrandt (136)",19,"""No Love"" shows Barcelos no love by tossing him out of the way, although the Brazilian recovers and fires off an uppercut that gets through.",FALSE,FALSE,0,0.00669285092428486,"","injury_eye_context|injury_stoppage",NA,"Round 1","UFC-usman-buckley-21-06-2025"
"Raoni Barcelos (136) vs. Cody Garbrandt (136)",20,"Garbrandt knees up the middle and tags Barcelos with two fast punches, and Barcelos gets his attention with a strong overhand right.",FALSE,FALSE,0,0.00669285092428486,"","",NA,"Round 1","UFC-usman-buckley-21-06-2025"
"Raoni Barcelos (136) vs. Cody Garbrandt (136)",21,"Garbrandt thinks about showboating or dancing but evaluates that the strike did some damage and plays it cool.",FALSE,FALSE,0,0.00669285092428486,"","",NA,"Round 1","UFC-usman-buckley-21-06-2025"
"Raoni Barcelos (136) vs. Cody Garbrandt (136)",22,"Barcelos attacks a single, and Garbrandt pops out of it and partially checks a calf kick flying at him.",FALSE,FALSE,0,0.00669285092428486,"","",NA,"Round 1","UFC-usman-buckley-21-06-2025"
"Raoni Barcelos (136) vs. Cody Garbrandt (136)",23,"Garbrandt has three or four punches land, and he does a little dance.",FALSE,FALSE,0,0.00669285092428486,"","",NA,"Round 1","UFC-usman-buckley-21-06-2025"
"Raoni Barcelos (136) vs. Cody Garbrandt (136)",24,"Barcelos takes him down, and Garbrandt gets away with an illegal upkick while scrambling.",TRUE,TRUE,100,0.993307149075715,"strong_anchor|foul_language|foul_re_hit","",NA,"Round 1","UFC-usman-buckley-21-06-2025"
"Raoni Barcelos (136) vs. Cody Garbrandt (136)",25,"Barcelos climbs into top position, lands a few hammerfists, and the horn sounds.",FALSE,FALSE,0,0.00669285092428486,"","",NA,"Round 1","UFC-usman-buckley-21-06-2025"
"Raoni Barcelos (136) vs. Cody Garbrandt (136)",26,"Sherdog Scores Jay Pettry scores the round: 10-9 Garbrandt Devin Tejada scores the round: 10-9 Barcelos Tristen Critchfield scores the round: 10-9 Garbrandt Round 2 The fighters high-five before getting after it, and Barcelos is quick to engage his wrestling.",FALSE,FALSE,0,0.00669285092428486,"","",NA,"Round 2","UFC-usman-buckley-21-06-2025"
"Raoni Barcelos (136) vs. Cody Garbrandt (136)",27,"Garbrandt's overhand right goes wide, and he plants his feet to defend the takedown effort.",FALSE,FALSE,0,0.00669285092428486,"","",NA,"Round 2","UFC-usman-buckley-21-06-2025"
"Raoni Barcelos (136) vs. Cody Garbrandt (136)",28,"Another try also comes up short, and Garbrandt pushes off and loads up on quick punches.",FALSE,FALSE,0,0.00669285092428486,"","",NA,"Round 2","UFC-usman-buckley-21-06-2025"
"Raoni Barcelos (136) vs. Cody Garbrandt (136)",29,"Barcelos chases Garbrandt around the outer edge of the cage, chambering and firing a right hand but missing with the follow-up.",FALSE,FALSE,20,0.0474258731775668,"strong_anchor","",NA,"Round 2","UFC-usman-buckley-21-06-2025"
"Raoni Barcelos (136) vs. Cody Garbrandt (136)",30,"Barcelos chops down the front leg, and he ducks down and eats a right hand while looking for a single.",FALSE,FALSE,0,0.00669285092428486,"","",NA,"Round 2","UFC-usman-buckley-21-06-2025"
"Raoni Barcelos (136) vs. Cody Garbrandt (136)",31,"When the takedown is not successful, Barcelos clips him with two right hands.",FALSE,FALSE,0,0.00669285092428486,"","",NA,"Round 2","UFC-usman-buckley-21-06-2025"
"Raoni Barcelos (136) vs. Cody Garbrandt (136)",32,"Garbrandt defends a double, but a knee up the middle from the Brazilian tags him cleanly.",FALSE,FALSE,0,0.00669285092428486,"","",NA,"Round 2","UFC-usman-buckley-21-06-2025"
"Raoni Barcelos (136) vs. Cody Garbrandt (136)",33,"Garbrandt puts out two punches that further develop some swelling on Barcelos' right cheek, but Barcelos ignores it and shoots for a single.",FALSE,FALSE,0,0.00669285092428486,"","explicit_no_pause|injury_eye_context|injury_stoppage",NA,"Round 2","UFC-usman-buckley-21-06-2025"
"Raoni Barcelos (136) vs. Cody Garbrandt (136)",34,"Garbrandt stuffs it, turns his man to the side and elbows him cleanly for it.",FALSE,FALSE,0,0.00669285092428486,"","",NA,"Round 2","UFC-usman-buckley-21-06-2025"
"Raoni Barcelos (136) vs. Cody Garbrandt (136)",35,"Barcelos keeps the pressure up, walking through a low kick and a body shot to catch ""No Love"" with his overhand right.",FALSE,FALSE,0,0.00669285092428486,"","",NA,"Round 2","UFC-usman-buckley-21-06-2025"
"Raoni Barcelos (136) vs. Cody Garbrandt (136)",36,"Barcelos times a crisp uppercut and drops down for a single, lifting Garbrandt's leg way up in the air.",FALSE,FALSE,0,0.00669285092428486,"","injury_eye_context|injury_stoppage",NA,"Round 2","UFC-usman-buckley-21-06-2025"
"Raoni Barcelos (136) vs. Cody Garbrandt (136)",37,"Garbrandt still stays upright, takes a right hand and puts his leg down.",FALSE,FALSE,0,0.00669285092428486,"","",NA,"Round 2","UFC-usman-buckley-21-06-2025"
"Raoni Barcelos (136) vs. Cody Garbrandt (136)",38,"Barcelos connects with another big right, and he reaches out with one to the midsection.",FALSE,FALSE,0,0.00669285092428486,"","",NA,"Round 2","UFC-usman-buckley-21-06-2025"
"Raoni Barcelos (136) vs. Cody Garbrandt (136)",39,"Barcelos jabs his way forward, scooting back to avoid all but a left hand in a combination.",FALSE,FALSE,0,0.00669285092428486,"","",NA,"Round 2","UFC-usman-buckley-21-06-2025"
"Raoni Barcelos (136) vs. Cody Garbrandt (136)",40,"Garbrandt rolls with a right hand on the way out, but the jab from the Brazilian is finding its home repeatedly.",FALSE,FALSE,0,0.00669285092428486,"","",NA,"Round 2","UFC-usman-buckley-21-06-2025"
"Raoni Barcelos (136) vs. Cody Garbrandt (136)",41,"Barcelos loads up on a right hand and ducks down, before unleashing another right hand that nearly puts the champ down.",FALSE,FALSE,0,0.00669285092428486,"","",NA,"Round 2","UFC-usman-buckley-21-06-2025"
"Raoni Barcelos (136) vs. Cody Garbrandt (136)",42,"The round ends with Garbrandt shooting for a desperation takedown.",FALSE,FALSE,0,0.00669285092428486,"","",NA,"Round 2","UFC-usman-buckley-21-06-2025"
"Raoni Barcelos (136) vs. Cody Garbrandt (136)",43,"Sherdog Scores Jay Pettry scores the round: 10-9 Barcelos Devin Tejada scores the round: 10-9 Barcelos Tristen Critchfield scores the round: 10-9 Barcelos Round 3 There is a final glove touch, and Barcelos gets right back to pressuring.",FALSE,FALSE,0,0.00669285092428486,"","",NA,"Round 3","UFC-usman-buckley-21-06-2025"
"Raoni Barcelos (136) vs. Cody Garbrandt (136)",44,"Garbrandt keeps him at bay for less than a second with a body kick, as Barcelos walks him down behind his overhand right.",FALSE,FALSE,0,0.00669285092428486,"","",NA,"Round 3","UFC-usman-buckley-21-06-2025"
"Raoni Barcelos (136) vs. Cody Garbrandt (136)",45,"Garbrandt shoots for a single, and Barcelos laughs it off.",FALSE,FALSE,0,0.00669285092428486,"","",NA,"Round 3","UFC-usman-buckley-21-06-2025"
"Raoni Barcelos (136) vs. Cody Garbrandt (136)",46,"A second takedown from Garbrandt is nowhere near being successful, and Barcelos pays him back with a calf kick that turns Garbrandt's knee.",FALSE,FALSE,0,0.00669285092428486,"","",NA,"Round 3","UFC-usman-buckley-21-06-2025"
"Raoni Barcelos (136) vs. Cody Garbrandt (136)",47,"Garbrandt gives him back two low kicks to think about, and he absorbs a flush right hand when circling away.",FALSE,FALSE,0,0.00669285092428486,"","",NA,"Round 3","UFC-usman-buckley-21-06-2025"
"Raoni Barcelos (136) vs. Cody Garbrandt (136)",48,"Barcelos kicks at his front leg again, setting up his jab and right hand.",FALSE,FALSE,0,0.00669285092428486,"","",NA,"Round 3","UFC-usman-buckley-21-06-2025"
"Raoni Barcelos (136) vs. Cody Garbrandt (136)",49,"Garbrandt rushes forward but is out of range for his combo, and he gets sat down with a leg kick.",FALSE,FALSE,0,0.00669285092428486,"","",NA,"Round 3","UFC-usman-buckley-21-06-2025"
"Raoni Barcelos (136) vs. Cody Garbrandt (136)",50,"The former champ shoots for a takedown and finds his way into a guillotine choke setup, but he breaks out of is as he leans against Barcelos.",FALSE,FALSE,0,0.00669285092428486,"","",NA,"Round 3","UFC-usman-buckley-21-06-2025"
"Raoni Barcelos (136) vs. Cody Garbrandt (136)",51,"The Brazilian breaks free, and Garbrandt connects at the end of a right and a left.",FALSE,FALSE,0,0.00669285092428486,"","",NA,"Round 3","UFC-usman-buckley-21-06-2025"
"Raoni Barcelos (136) vs. Cody Garbrandt (136)",52,"Barcelos clubs him with a one-two that forces the striker to shoot in on his hips, and he holds Garbrandt down and circles around to the side in hopes of taking the back.",FALSE,FALSE,0,0.00669285092428486,"","",NA,"Round 3","UFC-usman-buckley-21-06-2025"
"Raoni Barcelos (136) vs. Cody Garbrandt (136)",53,"Barcelos manages to take the back after softening Garbrandt up, and he sneaks a hook in.",FALSE,FALSE,0,0.00669285092428486,"","",NA,"Round 3","UFC-usman-buckley-21-06-2025"
"Raoni Barcelos (136) vs. Cody Garbrandt (136)",54,"""No Love"" lands some no-look punches, but Barcelos is singularly focused on shutting down any hopes of escape.",FALSE,FALSE,0,0.00669285092428486,"","",NA,"Round 3","UFC-usman-buckley-21-06-2025"
"Raoni Barcelos (136) vs. Cody Garbrandt (136)",55,"Garbrandt pushes his feet on the wall to turn himself around, where he drops down two punches before Barcelos explodes.",FALSE,FALSE,0,0.00669285092428486,"","",NA,"Round 3","UFC-usman-buckley-21-06-2025"
"Raoni Barcelos (136) vs. Cody Garbrandt (136)",56,"The two fighters burst back to their feet and start slugging it out, with Garbrandt landing flush and Barcelos doing the same.",FALSE,FALSE,0,0.00669285092428486,"","",NA,"Round 3","UFC-usman-buckley-21-06-2025"
"Raoni Barcelos (136) vs. Cody Garbrandt (136)",57,"Garbrandt waves him on, and Barcelos instead backs off.",FALSE,FALSE,0,0.00669285092428486,"","",NA,"Round 3","UFC-usman-buckley-21-06-2025"
"Raoni Barcelos (136) vs. Cody Garbrandt (136)",58,"Garbrandt scores a right hand and is chucked out of the way like a child's plaything when attempting a single.",FALSE,FALSE,0,0.00669285092428486,"","",NA,"Round 3","UFC-usman-buckley-21-06-2025"
"Raoni Barcelos (136) vs. Cody Garbrandt (136)",59,"Garbrandt points to the ground to initiate a brawl, but Barcelos goes the opposite direction and evades him until the fight wraps.",FALSE,FALSE,0,0.00669285092428486,"","",NA,"Round 3","UFC-usman-buckley-21-06-2025"
"Raoni Barcelos (136) vs. Cody Garbrandt (136)",60,"Barring something unexpected, all three Codys struck out tonight.",FALSE,FALSE,0,0.00669285092428486,"","",NA,"Round 3","UFC-usman-buckley-21-06-2025"
"Raoni Barcelos (136) vs. Cody Garbrandt (136)",61,"Sherdog Scores Jay Pettry scores the round: 10-9 Barcelos (29-28 Barcelos) Devin Tejada scores the round: 10-9 Barcelos (30-27 Barcelos) Tristen Critchfield scores the round: 10-9 Barcelos (29-28 Barcelos) The Official Result Raoni Barcelos def.",FALSE,FALSE,0,0.00669285092428486,"","",NA,"Round 3","UFC-usman-buckley-21-06-2025"
"Raoni Barcelos (136) vs. Cody Garbrandt (136)",62,"Cody Garbrandt via Unanimous Decision (29-28, 29-28, 29-28)",FALSE,FALSE,0,0.00669285092428486,"","",NA,"Round 3","UFC-usman-buckley-21-06-2025"
"Andre Petroski (186) vs. Edmen Shahbazyan (185)",1,"Andre Petroski (186) vs.",FALSE,FALSE,0,0.00669285092428486,"","gate_not_started",NA,NA,"UFC-usman-buckley-21-06-2025"
"Andre Petroski (186) vs. Edmen Shahbazyan (185)",2,"Edmen Shahbazyan (185) BETTING PREVIEW | SCOUTING REPORT | ODDS: Shahbazyan (-185), Petroski (+154) Round 1 As aggressive as ever, middleweight wunderkind Shahbazyan (14-5, 7-5 UFC) knows it only takes one for him to put an opponent away.",FALSE,FALSE,0,0.00669285092428486,"","gate_not_started",NA,"Round 1","UFC-usman-buckley-21-06-2025"
"Andre Petroski (186) vs. Edmen Shahbazyan (185)",3,"He draws bearded grappler Petroski (13-3, 8-2 UFC), who has had his chin checked in the past but can also grind his way to victory if need be.",FALSE,FALSE,0,0.00669285092428486,"","gate_not_started",NA,"Round 1","UFC-usman-buckley-21-06-2025"
"Andre Petroski (186) vs. Edmen Shahbazyan (185)",4,"This two-outcome match draws officiating from referee Kevin MacDonald, who bears witness to the fitness of the modern warrior.",FALSE,FALSE,0,0.00669285092428486,"","",NA,"Round 1","UFC-usman-buckley-21-06-2025"
"Andre Petroski (186) vs. Edmen Shahbazyan (185)",5,"Before BOOM, another hit is landed, they bump fists.",FALSE,FALSE,0,0.00669285092428486,"","",NA,"Round 1","UFC-usman-buckley-21-06-2025"
"Andre Petroski (186) vs. Edmen Shahbazyan (185)",6,"You're gonna feel it.",FALSE,FALSE,0,0.00669285092428486,"","",NA,"Round 1","UFC-usman-buckley-21-06-2025"
"Andre Petroski (186) vs. Edmen Shahbazyan (185)",7,"This is the ultimate.",FALSE,FALSE,0,0.00669285092428486,"","",NA,"Round 1","UFC-usman-buckley-21-06-2025"
"Andre Petroski (186) vs. Edmen Shahbazyan (185)",8,"Both men start fast, trading hands in the center of the cage.",FALSE,FALSE,20,0.0474258731775668,"strong_anchor","",NA,"Round 1","UFC-usman-buckley-21-06-2025"
"Andre Petroski (186) vs. Edmen Shahbazyan (185)",9,"Petroski lets go with a low kick and a level change, the latter likely to make Shahbazyan think about the possibility.",FALSE,FALSE,0,0.00669285092428486,"","",NA,"Round 1","UFC-usman-buckley-21-06-2025"
"Andre Petroski (186) vs. Edmen Shahbazyan (185)",10,"When Shahbazyan advances, Petroski clips him with a short right hand that makes Shahbazyan check his nose.",FALSE,FALSE,0,0.00669285092428486,"","",NA,"Round 1","UFC-usman-buckley-21-06-2025"
"Andre Petroski (186) vs. Edmen Shahbazyan (185)",11,"The two get stuck in neutral for a time when presenting in boxing range, and Shahbazyan breaks up the lull in action with a body kick.",FALSE,FALSE,0,0.00669285092428486,"","",NA,"Round 1","UFC-usman-buckley-21-06-2025"
"Andre Petroski (186) vs. Edmen Shahbazyan (185)",12,"As Petroski bounces in, Shahbazyan measures him with a sharp right hand.",FALSE,FALSE,0,0.00669285092428486,"","",NA,"Round 1","UFC-usman-buckley-21-06-2025"
"Andre Petroski (186) vs. Edmen Shahbazyan (185)",13,"Shahbazyan pecks out with a jab, but Petroski lands heavy on the calf with a kick.",FALSE,FALSE,0,0.00669285092428486,"","",NA,"Round 1","UFC-usman-buckley-21-06-2025"
"Andre Petroski (186) vs. Edmen Shahbazyan (185)",14,"The boos begin to grow louder as the two do not engage with much, and Petroski tries to engage his grappling and is turned away for his efforts.",FALSE,FALSE,0,0.00669285092428486,"","",NA,"Round 1","UFC-usman-buckley-21-06-2025"
"Andre Petroski (186) vs. Edmen Shahbazyan (185)",15,"Shahbazyan gets behind his jab, pecking it out to fluster Petroski.",FALSE,FALSE,0,0.00669285092428486,"","",NA,"Round 1","UFC-usman-buckley-21-06-2025"
"Andre Petroski (186) vs. Edmen Shahbazyan (185)",16,"A jab and a left hook stings the Renzo Gracie Philly product, and Petroski tries and fails to take the fight down again.",FALSE,FALSE,0,0.00669285092428486,"","",NA,"Round 1","UFC-usman-buckley-21-06-2025"
"Andre Petroski (186) vs. Edmen Shahbazyan (185)",17,"A quick left from Shahbazyan hurts Petroski, who bounces off the fence to gather himself.",FALSE,FALSE,20,0.0474258731775668,"strong_anchor","",NA,"Round 1","UFC-usman-buckley-21-06-2025"
"Andre Petroski (186) vs. Edmen Shahbazyan (185)",18,"Shahbazyan wraps a right hand around the guard, and he deposits his shin on the midsection as the sound of it echoes through the building.",FALSE,FALSE,0,0.00669285092428486,"","",NA,"Round 1","UFC-usman-buckley-21-06-2025"
"Andre Petroski (186) vs. Edmen Shahbazyan (185)",19,"Shahbazyan chases around his opponent with a few punches until the tepid round ends.",FALSE,FALSE,0,0.00669285092428486,"","",NA,"Round 1","UFC-usman-buckley-21-06-2025"
"Andre Petroski (186) vs. Edmen Shahbazyan (185)",20,"Sherdog Scores Jay Pettry scores the round: 10-9 Shahbazyan Devin Tejada scores the round: 10-9 Shahbazyan Tristen Critchfield scores the round: 10-9 Shahbazyan Round 2 As the second round begins, Petroski still cannot find his way in to attack.",FALSE,FALSE,0,0.00669285092428486,"","",NA,"Round 2","UFC-usman-buckley-21-06-2025"
"Andre Petroski (186) vs. Edmen Shahbazyan (185)",21,"This allows Shahbazyan to peck and poke at him with jabs, front kicks and anything else to maintain his distance.",FALSE,FALSE,0,0.00669285092428486,"","",NA,"Round 2","UFC-usman-buckley-21-06-2025"
"Andre Petroski (186) vs. Edmen Shahbazyan (185)",22,"Shahbazyan pushes off and a finger slides into his eye socket, and MacDonald calls time and tells Petroski to take all the time he needs.",TRUE,TRUE,100,0.993307149075715,"strong_anchor|foul_language|eye_clean_phrase|pause_plus_foul_language|foul_re_hit|ref_plus_foul_language","",NA,"Round 2","UFC-usman-buckley-21-06-2025"
"Andre Petroski (186) vs. Edmen Shahbazyan (185)",23,"With fighters too often hurrying back before they are fully recovered, MacDonald's request is a solid one.",FALSE,FALSE,0,0.00669285092428486,"","",NA,"Round 2","UFC-usman-buckley-21-06-2025"
"Andre Petroski (186) vs. Edmen Shahbazyan (185)",24,"Nevertheless, Petroski waves things back in after 45 seconds, in which he immediately reintroduces himself with a blistering right hand over the top.",FALSE,FALSE,0,0.00669285092428486,"","",NA,"Round 2","UFC-usman-buckley-21-06-2025"
"Andre Petroski (186) vs. Edmen Shahbazyan (185)",25,"Shahbazyan does not let him land a second time, instead disrupting his attacks with his flustering jab.",FALSE,FALSE,0,0.00669285092428486,"","",NA,"Round 2","UFC-usman-buckley-21-06-2025"
"Andre Petroski (186) vs. Edmen Shahbazyan (185)",26,"Petroski manages to get his hands on the younger fighter, but cannot ground him and settles for a body kick on the way out.",FALSE,FALSE,0,0.00669285092428486,"","",NA,"Round 2","UFC-usman-buckley-21-06-2025"
"Andre Petroski (186) vs. Edmen Shahbazyan (185)",27,"Petroski strings together three punches, the third that really gets Shahbazyan's attention.",FALSE,FALSE,0,0.00669285092428486,"","",NA,"Round 2","UFC-usman-buckley-21-06-2025"
"Andre Petroski (186) vs. Edmen Shahbazyan (185)",28,"Shahbazyan loads up with an overhand right, and Petroski's response of a one-two is effective.",FALSE,FALSE,0,0.00669285092428486,"","",NA,"Round 2","UFC-usman-buckley-21-06-2025"
"Andre Petroski (186) vs. Edmen Shahbazyan (185)",29,"Shahbazyan eventually boots his foe in the belly after some time of inaction, and he doubles up on it as Petroski frowns.",FALSE,FALSE,0,0.00669285092428486,"","",NA,"Round 2","UFC-usman-buckley-21-06-2025"
"Andre Petroski (186) vs. Edmen Shahbazyan (185)",30,"Shahbazyan skims the top of the head with his foot, and he digs a right to the midsection while Petroski backpedals.",FALSE,FALSE,0,0.00669285092428486,"","",NA,"Round 2","UFC-usman-buckley-21-06-2025"
"Andre Petroski (186) vs. Edmen Shahbazyan (185)",31,"They meet in the middle and trade power punches, with Shahbazyan goes to the body and shaking up Petroski to the head.",FALSE,FALSE,0,0.00669285092428486,"","",NA,"Round 2","UFC-usman-buckley-21-06-2025"
"Andre Petroski (186) vs. Edmen Shahbazyan (185)",32,"Petroski circles to either direction to try to get his wits about him, remaining safe until the round ends.",FALSE,FALSE,0,0.00669285092428486,"","",NA,"Round 2","UFC-usman-buckley-21-06-2025"
