"bout","sid","sentence","has_foul_raw","has_foul","rule_score","rule_conf","rule_reasons_pos","rule_reasons_neg","time_str","round_mentioned","event"
"Rodolfo Bellato (205.5) vs. Paul Craig (206)",17,"Bellato takes two more body kicks, nods and stalks ""Bearjew"" down.",FALSE,FALSE,0,0.00669285092428486,"","",NA,"Round 1","UFC-usman-buckley-21-06-2025"
"Rodolfo Bellato (205.5) vs. Paul Craig (206)",18,"Craig rips another kick to the ribs, and he spins with a back kick and drops down for a single.",FALSE,FALSE,0,0.00669285092428486,"","",NA,"Round 1","UFC-usman-buckley-21-06-2025"
"Rodolfo Bellato (205.5) vs. Paul Craig (206)",19,"Bellato frames off and keeps his balance, forcing Craig to sell out and drop down for it while pushing the heavy betting favorite against the wall.",FALSE,FALSE,0,0.00669285092428486,"","",NA,"Round 1","UFC-usman-buckley-21-06-2025"
"Rodolfo Bellato (205.5) vs. Paul Craig (206)",20,"Craig trips Bellato up, and as if he had springs in his shorts, Bellato bounces off the mat to get back to his feet.",FALSE,FALSE,0,0.00669285092428486,"","reaction_only|gate_reaction_only",NA,"Round 1","UFC-usman-buckley-21-06-2025"
"Rodolfo Bellato (205.5) vs. Paul Craig (206)",21,"Craig ducks a huge punch and goes after a takedown, but Bellato bowls him over and lands heavily in half guard.",FALSE,FALSE,0,0.00669285092428486,"","",NA,"Round 1","UFC-usman-buckley-21-06-2025"
"Rodolfo Bellato (205.5) vs. Paul Craig (206)",22,"Bellato flirts with an arm-triangle setup, retaining heavy chest pressure to not allow Craig to do something off his back.",FALSE,FALSE,0,0.00669285092428486,"","",NA,"Round 1","UFC-usman-buckley-21-06-2025"
"Rodolfo Bellato (205.5) vs. Paul Craig (206)",23,"Bellato postures up and stands up with 10 seconds to go, smacking Craig with a low kick and diving down.Craig pushes off of him and belts Bellato with a brutal upkick while Bellato's right knee is down.",FALSE,FALSE,0,0.00669285092428486,"","",NA,"Round 1","UFC-usman-buckley-21-06-2025"
"Rodolfo Bellato (205.5) vs. Paul Craig (206)",24,"The stunner of an upkick knocks Bellato clean out, who collapses to his back.",FALSE,FALSE,0,0.00669285092428486,"","",NA,"Round 1","UFC-usman-buckley-21-06-2025"
"Rodolfo Bellato (205.5) vs. Paul Craig (206)",25,"After a few seconds he snaps back to consciousness and looks terrified, eyes wide as dinner plates, and he scurries towards the wall to defend himself from an unknown threat.Still not knowing where he is, Bellato seats himself against the fence, and when MacDonald approaches him, Bellato tries to grapple him and even attempts a leglock.",FALSE,FALSE,20,0.0474258731775668,"strong_anchor","",NA,"Round 1","UFC-usman-buckley-21-06-2025"
"Rodolfo Bellato (205.5) vs. Paul Craig (206)",26,"MacDonald calmly, professionally informs Bellato that he got knocked out, and calls for a replay to determine the legality of the blow.",FALSE,FALSE,0,0.00669285092428486,"","",NA,"Round 1","UFC-usman-buckley-21-06-2025"
"Rodolfo Bellato (205.5) vs. Paul Craig (206)",27,"It is clear the fight is over and that Bellato will not be able to continue, so the only question is whether MacDonald will declare this fight result a disqualification or a no contest.",FALSE,FALSE,0,0.00669285092428486,"","",NA,"Round 1","UFC-usman-buckley-21-06-2025"
"Rodolfo Bellato (205.5) vs. Paul Craig (206)",28,"Meanwhile, virtual judge Devin Tejada specifically requested that his round score of a 10-6 in favor of Craig be declared here even though the round did not end.",FALSE,FALSE,0,0.00669285092428486,"","",NA,"Round 1","UFC-usman-buckley-21-06-2025"
"Rodolfo Bellato (205.5) vs. Paul Craig (206)",29,"This is a rough situation, one that merits this match be booked one more time in a few months.",FALSE,FALSE,0,0.00669285092428486,"","",NA,"Round 1","UFC-usman-buckley-21-06-2025"
"Rodolfo Bellato (205.5) vs. Paul Craig (206)",30,"The Official Result Paul Craig vs.",FALSE,FALSE,0,0.00669285092428486,"","",NA,"Round 1","UFC-usman-buckley-21-06-2025"
"Rodolfo Bellato (205.5) vs. Paul Craig (206)",31,"Rodolfo Bellato is Ruled a No Contest (Illegal Upkick) R1 4:59",TRUE,TRUE,100,0.993307149075715,"strong_anchor|foul_language|foul_re_hit","","4:59","Round 1","UFC-usman-buckley-21-06-2025"
"Alonzo Menifield (206) vs. Oumar Sy (206)",1,"Alonzo Menifield (206) vs.",FALSE,FALSE,0,0.00669285092428486,"","gate_not_started",NA,NA,"UFC-usman-buckley-21-06-2025"
"Alonzo Menifield (206) vs. Oumar Sy (206)",2,"Oumar Sy (206) BETTING PREVIEW | SCOUTING REPORT | ODDS: Sy (-700), Menifield (+500) Round 1 The main card opens up with a match that could end anywhere at any time.",FALSE,FALSE,0,0.00669285092428486,"","gate_not_started",NA,"Round 1","UFC-usman-buckley-21-06-2025"
"Alonzo Menifield (206) vs. Oumar Sy (206)",3,"Light heavyweight bombardier Menifield (16-5-1, 9-5-1 UFC) practically only knows one speed, sometimes to his detriment.",FALSE,FALSE,0,0.00669285092428486,"","gate_not_started",NA,"Round 1","UFC-usman-buckley-21-06-2025"
"Alonzo Menifield (206) vs. Oumar Sy (206)",4,"He will try to ply his explosive trade against Sy (11-0, 2-0 UFC) and look to hand the undefeated Frenchman his first loss.",FALSE,FALSE,0,0.00669285092428486,"","gate_not_started",NA,"Round 1","UFC-usman-buckley-21-06-2025"
"Alonzo Menifield (206) vs. Oumar Sy (206)",5,"Referee Blake Grice knows he might be needed at a moment's notice, so he is not far away when the two tap their hands together to signal they are ready to engage.",FALSE,FALSE,0,0.00669285092428486,"","",NA,"Round 1","UFC-usman-buckley-21-06-2025"
"Alonzo Menifield (206) vs. Oumar Sy (206)",6,"Sy takes the center of the Octagon and pushes out a front kick to get started, and Sy pushes off and grazes the eye as Menifield swats at his hand.",FALSE,FALSE,20,0.0474258731775668,"strong_anchor","",NA,"Round 1","UFC-usman-buckley-21-06-2025"
"Alonzo Menifield (206) vs. Oumar Sy (206)",7,"Sy meanders towards the UFC vet but does not throw anything, instead chasing him and whiffing badly with a spinning back fist.",FALSE,FALSE,0,0.00669285092428486,"","",NA,"Round 1","UFC-usman-buckley-21-06-2025"
"Alonzo Menifield (206) vs. Oumar Sy (206)",8,"Menifield responds with a lunging right hand, and he steps to the side as a front kick misses him.",FALSE,FALSE,0,0.00669285092428486,"","",NA,"Round 1","UFC-usman-buckley-21-06-2025"
"Alonzo Menifield (206) vs. Oumar Sy (206)",9,"Menifield times a right hand over the top when Sy commits to a kick, and Sy barely rolls with it in time.",FALSE,FALSE,0,0.00669285092428486,"","",NA,"Round 1","UFC-usman-buckley-21-06-2025"
"Alonzo Menifield (206) vs. Oumar Sy (206)",10,"Sy has a head kick blocked, and he splits the guard with a jab.",FALSE,FALSE,0,0.00669285092428486,"","",NA,"Round 1","UFC-usman-buckley-21-06-2025"
"Alonzo Menifield (206) vs. Oumar Sy (206)",11,"Menifield's head movement keeps him out of danger, and he unloads a massive right hand that skims the jaw.",FALSE,FALSE,0,0.00669285092428486,"","",NA,"Round 1","UFC-usman-buckley-21-06-2025"
"Alonzo Menifield (206) vs. Oumar Sy (206)",12,"Sy breathes a sigh of relief but the big swings are getting closer.",FALSE,FALSE,0,0.00669285092428486,"","",NA,"Round 1","UFC-usman-buckley-21-06-2025"
"Alonzo Menifield (206) vs. Oumar Sy (206)",13,"The Frenchman tries to keep the heavy swinger at bay with a front kick, and he stays in place a little too long and gets caught with a right.",FALSE,FALSE,0,0.00669285092428486,"","",NA,"Round 1","UFC-usman-buckley-21-06-2025"
"Alonzo Menifield (206) vs. Oumar Sy (206)",14,"Sy pitches out a head kick, and Menifield charges at him with four or five flurrying fists.",FALSE,FALSE,0,0.00669285092428486,"","",NA,"Round 1","UFC-usman-buckley-21-06-2025"
"Alonzo Menifield (206) vs. Oumar Sy (206)",15,"Menifield tracks Sy down and wings a left hand at him, and Sy showboats and pokes Menifield in the eye.",TRUE,TRUE,100,0.993307149075715,"strong_anchor|foul_re_hit","",NA,"Round 1","UFC-usman-buckley-21-06-2025"
"Alonzo Menifield (206) vs. Oumar Sy (206)",16,"Menifield protests, and Grice calls time.",FALSE,FALSE,0,0.00669285092428486,"","",NA,"Round 1","UFC-usman-buckley-21-06-2025"
"Alonzo Menifield (206) vs. Oumar Sy (206)",17,"Menifield jokingly says he sees two of Grice, and Grice chides him for saying something like that or else he will have to take action.",FALSE,FALSE,0,0.00669285092428486,"","",NA,"Round 1","UFC-usman-buckley-21-06-2025"
"Alonzo Menifield (206) vs. Oumar Sy (206)",18,"They resume, and Menifield gets back to chasing after the French fighter.",FALSE,FALSE,0,0.00669285092428486,"","",NA,"Round 1","UFC-usman-buckley-21-06-2025"
"Alonzo Menifield (206) vs. Oumar Sy (206)",19,"Sy stays at the end of his jab to keep Menifield from reaching him, and the telegraphed right hand is still out of flush range.",FALSE,FALSE,0,0.00669285092428486,"","",NA,"Round 1","UFC-usman-buckley-21-06-2025"
"Alonzo Menifield (206) vs. Oumar Sy (206)",20,"Sy slaps the front leg with a few kicks, and Menifield responds with one that is much heavier.",FALSE,FALSE,0,0.00669285092428486,"","",NA,"Round 1","UFC-usman-buckley-21-06-2025"
"Alonzo Menifield (206) vs. Oumar Sy (206)",21,"Sy goes to the body with a kick, and Menifield stumbles him with a left.",FALSE,FALSE,0,0.00669285092428486,"","",NA,"Round 1","UFC-usman-buckley-21-06-2025"
"Alonzo Menifield (206) vs. Oumar Sy (206)",22,"Menifield smells blood and swings with everything he has, clipping Sy with a right hand at the end but not hurting him.",FALSE,FALSE,0,0.00669285092428486,"","injury_eye_context|injury_stoppage",NA,"Round 1","UFC-usman-buckley-21-06-2025"
"Alonzo Menifield (206) vs. Oumar Sy (206)",23,"The round ends.",FALSE,FALSE,0,0.00669285092428486,"","",NA,"Round 1","UFC-usman-buckley-21-06-2025"
"Alonzo Menifield (206) vs. Oumar Sy (206)",24,"Sherdog Scores Jay Pettry scores the round: 10-9 Menifield Devin Tejada scores the round: 10-9 Menifield Tristen Critchfield scores the round: 10-9 Menifield Round 2 The fighters tap gloves to get going in the second stanza, and Sy reintroduces himself with a pair of front kicks.",FALSE,FALSE,0,0.00669285092428486,"","",NA,"Round 2","UFC-usman-buckley-21-06-2025"
"Alonzo Menifield (206) vs. Oumar Sy (206)",25,"Menifield offers a low kick back, and he is off-balance when he looks to unload his right.",FALSE,FALSE,0,0.00669285092428486,"","",NA,"Round 2","UFC-usman-buckley-21-06-2025"
"Alonzo Menifield (206) vs. Oumar Sy (206)",26,"Sy jabs and kicks, and he leans back as a right hand buzzes his chin.",FALSE,FALSE,0,0.00669285092428486,"","",NA,"Round 2","UFC-usman-buckley-21-06-2025"
"Alonzo Menifield (206) vs. Oumar Sy (206)",27,"Sy closes in to tie up the Texan, driving him to the wall and searching for a single.",FALSE,FALSE,0,0.00669285092428486,"","",NA,"Round 2","UFC-usman-buckley-21-06-2025"
"Alonzo Menifield (206) vs. Oumar Sy (206)",28,"The Frenchman transitions to a double, and Menifield wraps around him on the other side around his back.",FALSE,FALSE,0,0.00669285092428486,"","",NA,"Round 2","UFC-usman-buckley-21-06-2025"
"Alonzo Menifield (206) vs. Oumar Sy (206)",29,"Menifield sprawls to defend, and he wraps his arms around Sy's neck to hold him from getting anywhere.",FALSE,FALSE,0,0.00669285092428486,"","",NA,"Round 2","UFC-usman-buckley-21-06-2025"
"Alonzo Menifield (206) vs. Oumar Sy (206)",30,"Menifield latches onto a guillotine choke, switching grip from one arm to the other but nearly losing balance.",FALSE,FALSE,0,0.00669285092428486,"","",NA,"Round 2","UFC-usman-buckley-21-06-2025"
"Alonzo Menifield (206) vs. Oumar Sy (206)",31,"Sy stays attacking a single or a double, going from attempt to attempt as Menifield defends each one.",FALSE,FALSE,0,0.00669285092428486,"","",NA,"Round 2","UFC-usman-buckley-21-06-2025"
"Alonzo Menifield (206) vs. Oumar Sy (206)",32,"Sy sells out for a double, dropping down to his knees, and that too does not work.",FALSE,FALSE,0,0.00669285092428486,"","",NA,"Round 2","UFC-usman-buckley-21-06-2025"
"Alonzo Menifield (206) vs. Oumar Sy (206)",33,"Menifield's strength stops Sy from getting him down, and his guillotine choke makes Sy not go all-out for the takedown.",FALSE,FALSE,0,0.00669285092428486,"","",NA,"Round 2","UFC-usman-buckley-21-06-2025"
"Alonzo Menifield (206) vs. Oumar Sy (206)",34,"Menifield elbows him in the side of the head, and Sy stays pressed looking for that takedown.",FALSE,FALSE,0,0.00669285092428486,"","",NA,"Round 2","UFC-usman-buckley-21-06-2025"
"Alonzo Menifield (206) vs. Oumar Sy (206)",35,"As Grice asks for more action, Sy completes it and dumps the Texan on the mat.",FALSE,FALSE,0,0.00669285092428486,"","",NA,"Round 2","UFC-usman-buckley-21-06-2025"
"Alonzo Menifield (206) vs. Oumar Sy (206)",36,"Menifield gets to his knees, and Sy tries to grab him from behind.",FALSE,FALSE,0,0.00669285092428486,"","",NA,"Round 2","UFC-usman-buckley-21-06-2025"
"Alonzo Menifield (206) vs. Oumar Sy (206)",37,"Menifield turns and stands, defending another try to ground him as Grice claps for them to fight.",FALSE,FALSE,0,0.00669285092428486,"","",NA,"Round 2","UFC-usman-buckley-21-06-2025"
"Alonzo Menifield (206) vs. Oumar Sy (206)",38,"Menifield does not get taken down again as the horn sounds, and the audience is not impressed.",FALSE,FALSE,0,0.00669285092428486,"","",NA,"Round 2","UFC-usman-buckley-21-06-2025"
"Alonzo Menifield (206) vs. Oumar Sy (206)",39,"Sherdog Scores Jay Pettry scores the round: 10-9 Sy Devin Tejada scores the round: 10-9 Sy Tristen Critchfield scores the round: 10-9 Sy Round 3 There is a final glove touch, and Menifield leads off with a body kick.",FALSE,FALSE,0,0.00669285092428486,"","",NA,"Round 3","UFC-usman-buckley-21-06-2025"
"Alonzo Menifield (206) vs. Oumar Sy (206)",40,"Sy bounces a few punches off the guard and pushes off with a front kick.",FALSE,FALSE,0,0.00669285092428486,"","",NA,"Round 3","UFC-usman-buckley-21-06-2025"
"Alonzo Menifield (206) vs. Oumar Sy (206)",41,"Menifield sinks in a heavy low kick, swiping out with a left and a right as Sy closes in.",FALSE,FALSE,0,0.00669285092428486,"","",NA,"Round 3","UFC-usman-buckley-21-06-2025"
"Alonzo Menifield (206) vs. Oumar Sy (206)",42,"""Atomic Alonzo"" ducks his way in, allowing Sy to windmill a right hand past him as he regains ground.",FALSE,FALSE,0,0.00669285092428486,"","",NA,"Round 3","UFC-usman-buckley-21-06-2025"
"Alonzo Menifield (206) vs. Oumar Sy (206)",43,"A right hand from Menifield sneaks over the top, and he pierces the guard with a left.",FALSE,FALSE,0,0.00669285092428486,"","",NA,"Round 3","UFC-usman-buckley-21-06-2025"
"Alonzo Menifield (206) vs. Oumar Sy (206)",44,"Menifield counters a kick with a right hand and lets go with two chopping kicks.",FALSE,FALSE,0,0.00669285092428486,"","",NA,"Round 3","UFC-usman-buckley-21-06-2025"
"Alonzo Menifield (206) vs. Oumar Sy (206)",45,"Sy's one-two down the pipe partially lands, and his jab snaps the head back.",FALSE,FALSE,0,0.00669285092428486,"","",NA,"Round 3","UFC-usman-buckley-21-06-2025"
"Alonzo Menifield (206) vs. Oumar Sy (206)",46,"Menifield evades a front kick and pushes off from a Sy takedown effort, and fans in the building take their phones out and light up their screens, waving them around in protest of the lackluster fight.",FALSE,FALSE,0,0.00669285092428486,"","",NA,"Round 3","UFC-usman-buckley-21-06-2025"
"Alonzo Menifield (206) vs. Oumar Sy (206)",47,"The fighters trade single punches one after the other, and with Menifield raising his hand once to signal he scored it the way he wanted to.",FALSE,FALSE,0,0.00669285092428486,"","",NA,"Round 3","UFC-usman-buckley-21-06-2025"
"Alonzo Menifield (206) vs. Oumar Sy (206)",48,"Menifield punts the front leg and scores with a right and a left, and he wraps a right hand around the guard but off the shoulder.",FALSE,FALSE,0,0.00669285092428486,"","",NA,"Round 3","UFC-usman-buckley-21-06-2025"
"Alonzo Menifield (206) vs. Oumar Sy (206)",49,"Menifield sticks out a number of jabs, and he checks a low kick aimed at him.",FALSE,FALSE,0,0.00669285092428486,"","",NA,"Round 3","UFC-usman-buckley-21-06-2025"
"Alonzo Menifield (206) vs. Oumar Sy (206)",50,"Menifield has a few fists rebound off the guard and dodges a front kick.",FALSE,FALSE,0,0.00669285092428486,"","",NA,"Round 3","UFC-usman-buckley-21-06-2025"
"Alonzo Menifield (206) vs. Oumar Sy (206)",51,"The booing gets louder as the light heavyweights do not turn it up, until Menifield surges into action with a winging right.",FALSE,FALSE,0,0.00669285092428486,"","",NA,"Round 3","UFC-usman-buckley-21-06-2025"
"Alonzo Menifield (206) vs. Oumar Sy (206)",52,"He misses with that but cracks Sy with a left.",FALSE,FALSE,0,0.00669285092428486,"","",NA,"Round 3","UFC-usman-buckley-21-06-2025"
"Alonzo Menifield (206) vs. Oumar Sy (206)",53,"Swarming forward, Menifield knocks air around but misses the mark with much more.",FALSE,FALSE,0,0.00669285092428486,"","",NA,"Round 3","UFC-usman-buckley-21-06-2025"
"Alonzo Menifield (206) vs. Oumar Sy (206)",54,"Two more right hands from Menifield connect, and the dreadful match ends.",FALSE,FALSE,0,0.00669285092428486,"","",NA,"Round 3","UFC-usman-buckley-21-06-2025"
"Alonzo Menifield (206) vs. Oumar Sy (206)",55,"It is not been the best night for action thus far, and the crowd is reacting to that.",FALSE,FALSE,0,0.00669285092428486,"","",NA,"Round 3","UFC-usman-buckley-21-06-2025"
"Alonzo Menifield (206) vs. Oumar Sy (206)",56,"It could be anyone's fight, but at least it is over.",FALSE,FALSE,0,0.00669285092428486,"","",NA,"Round 3","UFC-usman-buckley-21-06-2025"
"Alonzo Menifield (206) vs. Oumar Sy (206)",57,"Sherdog Scores Jay Pettry scores the round: 10-9 Menifield (29-28 Menifield) Devin Tejada scores the round: 10-9 Menifield (29-28 Menifield) Tristen Critchfield scores the round: 10-9 Menifield (29-28 Menifield) The Official Result Alonzo Menifield def.",FALSE,FALSE,0,0.00669285092428486,"","",NA,"Round 3","UFC-usman-buckley-21-06-2025"
"Alonzo Menifield (206) vs. Oumar Sy (206)",58,"Oumar Sy via Unanimous Decision (29-28, 29-28, 29-28)",FALSE,FALSE,0,0.00669285092428486,"","",NA,"Round 3","UFC-usman-buckley-21-06-2025"
"Mansur Abdul-Malik (186) vs. Cody Brundage (186)",1,"Mansur Abdul-Malik (186) vs.",FALSE,FALSE,0,0.00669285092428486,"","gate_not_started",NA,NA,"UFC-usman-buckley-21-06-2025"
"Mansur Abdul-Malik (186) vs. Cody Brundage (186)",2,"Cody Brundage (186) BETTING PREVIEW | SCOUTING REPORT | ODDS: Abdul-Malik (-800), Brundage (+500) Round 1 The line on this middleweight pairing may not be quite as ludicrous as Wellmaker vs.",FALSE,FALSE,0,0.00669285092428486,"","gate_not_started",NA,"Round 1","UFC-usman-buckley-21-06-2025"
"Mansur Abdul-Malik (186) vs. Cody Brundage (186)",3,"Moutinho, but Abdul-Malik (8-0, 2-0 UFC) is coming in as a favorite anywhere from -950 to -1200, give or take.",FALSE,FALSE,0,0.00669285092428486,"","gate_not_started",NA,"Round 1","UFC-usman-buckley-21-06-2025"
"Mansur Abdul-Malik (186) vs. Cody Brundage (186)",4,"With eight finishes across his eight victories, prognosticators believe that his battle with Brundage (11-6, 1 NC; 5-5, 1 NC UFC) may not last long, win or lose.",FALSE,FALSE,0,0.00669285092428486,"","gate_not_started",NA,"Round 1","UFC-usman-buckley-21-06-2025"
"Mansur Abdul-Malik (186) vs. Cody Brundage (186)",5,"Referee Brent McKeehan is distinctly aware of the possibility, and is on his A-game right out of the gate.",FALSE,FALSE,0,0.00669285092428486,"","",NA,"Round 1","UFC-usman-buckley-21-06-2025"
"Mansur Abdul-Malik (186) vs. Cody Brundage (186)",6,"Fists are bumped before they are traded, and Brundage fires off some early warning kicks to demonstrate he is not going to be such an easy out.",FALSE,FALSE,0,0.00669285092428486,"","",NA,"Round 1","UFC-usman-buckley-21-06-2025"
"Mansur Abdul-Malik (186) vs. Cody Brundage (186)",7,"He lands a low kick as Abdul-Malik comes towards him, and he connects with a clean right hand.",FALSE,FALSE,0,0.00669285092428486,"","",NA,"Round 1","UFC-usman-buckley-21-06-2025"
"Mansur Abdul-Malik (186) vs. Cody Brundage (186)",8,"Brundage's front kick pushes off the chest, and Abdul-Malik's is much heavier in response.",FALSE,FALSE,0,0.00669285092428486,"","",NA,"Round 1","UFC-usman-buckley-21-06-2025"
"Mansur Abdul-Malik (186) vs. Cody Brundage (186)",9,"Brundage stands firm and delivers a kick to the body and one to the lead leg, and Abdul-Malik is unable to find his way in.",FALSE,FALSE,0,0.00669285092428486,"","",NA,"Round 1","UFC-usman-buckley-21-06-2025"
"Mansur Abdul-Malik (186) vs. Cody Brundage (186)",10,"The middleweights trade punches, and Abdul-Malik drives a front kick through the guard that surprises Brundage.",FALSE,FALSE,0,0.00669285092428486,"","",NA,"Round 1","UFC-usman-buckley-21-06-2025"
"Mansur Abdul-Malik (186) vs. Cody Brundage (186)",11,"Abdul-Malik walks him down but lets him entirely off the hook.",FALSE,FALSE,0,0.00669285092428486,"","",NA,"Round 1","UFC-usman-buckley-21-06-2025"
"Mansur Abdul-Malik (186) vs. Cody Brundage (186)",12,"Brundage strikes the front leg and fires a front kick down the middle, before lunging with an overhand right.",FALSE,FALSE,0,0.00669285092428486,"","",NA,"Round 1","UFC-usman-buckley-21-06-2025"
"Mansur Abdul-Malik (186) vs. Cody Brundage (186)",13,"Abdul-Malik swings a body kick and leaps at his foe with a jump knee, and Brundage steels himself and wings a pair of body shots back at him.",FALSE,FALSE,0,0.00669285092428486,"","",NA,"Round 1","UFC-usman-buckley-21-06-2025"
"Mansur Abdul-Malik (186) vs. Cody Brundage (186)",14,"The cautious round ends, and again fans drown the competitors out with boos.",FALSE,FALSE,0,0.00669285092428486,"","",NA,"Round 1","UFC-usman-buckley-21-06-2025"
"Mansur Abdul-Malik (186) vs. Cody Brundage (186)",15,"Sherdog Scores Jay Pettry scores the round: 10-9 Abdul-Malik Devin Tejada scores the round: 10-9 Abdul-Malik Tristen Critchfield scores the round: 10-9 Abdul-Malik Round 2 After a quick fist bump, the two meet in the middle of the cage without trading.",FALSE,FALSE,20,0.0474258731775668,"strong_anchor","",NA,"Round 2","UFC-usman-buckley-21-06-2025"
"Mansur Abdul-Malik (186) vs. Cody Brundage (186)",16,"Abdul-Malik tests the waters with a low kick, and he chambers a head kick and is met on the way down with an inside leg kick.",FALSE,FALSE,0,0.00669285092428486,"","",NA,"Round 2","UFC-usman-buckley-21-06-2025"
"Mansur Abdul-Malik (186) vs. Cody Brundage (186)",17,"Neither fighter is willing to commit to anything, resulting in a lull in action.",FALSE,FALSE,0,0.00669285092428486,"","",NA,"Round 2","UFC-usman-buckley-21-06-2025"
"Mansur Abdul-Malik (186) vs. Cody Brundage (186)",18,"Abdul-Malik decides to start fighting suddenly, running at Brundage and catching him with a right hand.",FALSE,FALSE,0,0.00669285092428486,"","",NA,"Round 2","UFC-usman-buckley-21-06-2025"
"Mansur Abdul-Malik (186) vs. Cody Brundage (186)",19,"Brundage retaliates with a flying knee, and Abdul-Malik tags him with another right on the ear as he plants his feet.",FALSE,FALSE,0,0.00669285092428486,"","",NA,"Round 2","UFC-usman-buckley-21-06-2025"
"Mansur Abdul-Malik (186) vs. Cody Brundage (186)",20,"The blow cuts Brundage behind his ear, which starts bleeding heavily down his neck.",FALSE,FALSE,0,0.00669285092428486,"","injury_eye_context|injury_stoppage",NA,"Round 2","UFC-usman-buckley-21-06-2025"
"Mansur Abdul-Malik (186) vs. Cody Brundage (186)",21,"He paws at it and pays it little mind, instead winging a right hand at the overwhelming favorite.",FALSE,FALSE,0,0.00669285092428486,"","",NA,"Round 2","UFC-usman-buckley-21-06-2025"
"Mansur Abdul-Malik (186) vs. Cody Brundage (186)",22,"Abdul-Malik walks into a left hand as he tries to attack with a knee, and then they back off and measure one another for a while.",FALSE,FALSE,0,0.00669285092428486,"","",NA,"Round 2","UFC-usman-buckley-21-06-2025"
"Mansur Abdul-Malik (186) vs. Cody Brundage (186)",23,"Abdul-Malik eventually pushes out a front kick, and Brundage finds a way in and connects with two punches.",FALSE,FALSE,0,0.00669285092428486,"","",NA,"Round 2","UFC-usman-buckley-21-06-2025"
"Mansur Abdul-Malik (186) vs. Cody Brundage (186)",24,"Brundage's overhand right just misses as the crowd gasps, seemingly desperate for a clean, solid strike to land.",FALSE,FALSE,0,0.00669285092428486,"","",NA,"Round 2","UFC-usman-buckley-21-06-2025"
"Mansur Abdul-Malik (186) vs. Cody Brundage (186)",25,"Brundage crashes the pocket but backs off when taking a low kick.",FALSE,FALSE,0,0.00669285092428486,"","",NA,"Round 2","UFC-usman-buckley-21-06-2025"
"Mansur Abdul-Malik (186) vs. Cody Brundage (186)",26,"Abdul-Malik spins with a back kick, and Brundage retaliates with an overhand right.",FALSE,FALSE,0,0.00669285092428486,"","",NA,"Round 2","UFC-usman-buckley-21-06-2025"
"Mansur Abdul-Malik (186) vs. Cody Brundage (186)",27,"The horn sounds to wrap the disappointing round.",FALSE,FALSE,0,0.00669285092428486,"","",NA,"Round 2","UFC-usman-buckley-21-06-2025"
"Mansur Abdul-Malik (186) vs. Cody Brundage (186)",28,"Sherdog Scores Jay Pettry scores the round: 10-9 Brundage Devin Tejada scores the round: 10-9 Brundage Tristen Critchfield scores the round: 10-9 Brundage Round 3 Abdul-Malik runs at his opponent as soon as the round begins, railing Brundage with a flying knee.",FALSE,FALSE,0,0.00669285092428486,"","",NA,"Round 3","UFC-usman-buckley-21-06-2025"
"Mansur Abdul-Malik (186) vs. Cody Brundage (186)",29,"This immediately devolves in a ludicrous brawl, where both fighters wing hooks with everything they have.",FALSE,FALSE,0,0.00669285092428486,"","",NA,"Round 3","UFC-usman-buckley-21-06-2025"
"Mansur Abdul-Malik (186) vs. Cody Brundage (186)",30,"Abdul-Malik hurts Brundage, Brundage returns fire, and they proceed to bang it out.",FALSE,FALSE,0,0.00669285092428486,"","",NA,"Round 3","UFC-usman-buckley-21-06-2025"
